id,audio_path,transcript,sentence_chosen,sentence_rejected,chosen,rejected,dpo_weight
12600072,/vol/tensusers8/aparikh/hf_cache/so/speechocean762/WAVE/SPEAKER1260/012600072.WAV,WE WILL CONTINUE TO FIGHT THIS,Good,Excellent,WE/Excellent WILL/Excellent CONTINUE/Excellent TO/Excellent FIGHT/Excellent THIS/Excellent,WE/Good WILL/Good CONTINUE/Good TO/Good FIGHT/Good THIS/Good,1.5
12600082,/vol/tensusers8/aparikh/hf_cache/so/speechocean762/WAVE/SPEAKER1260/012600082.WAV,THE UNITED STATES IS LIVING ON ITS PASTS,Good,Average,THE/Excellent UNITED/Excellent STATES/Excellent IS/Excellent LIVING/Excellent ON/Excellent ITS/Excellent PASTS/Excellent,THE/Good UNITED/Good STATES/Good IS/Good LIVING/Good ON/Good ITS/Good PASTS/Good,1.5
12600129,/vol/tensusers8/aparikh/hf_cache/so/speechocean762/WAVE/SPEAKER1260/012600129.WAV,THAT PUT ME IN SUCH A GOOD MOOD,Good,Average,THAT/Good PUT/Excellent ME/Excellent IN/Excellent SUCH/Excellent A/Excellent GOOD/Excellent MOOD/Excellent,THAT/Average PUT/Good ME/Good IN/Good SUCH/Good A/Good GOOD/Good MOOD/Good,1.5
12600131,/vol/tensusers8/aparikh/hf_cache/so/speechocean762/WAVE/SPEAKER1260/012600131.WAV,HAVE A LITTLE BIT OF FAITH LOVE,Good,Average,HAVE/Excellent A/Excellent LITTLE/Excellent BIT/Excellent OF/Excellent FAITH/Excellent LOVE/Excellent,HAVE/Good A/Good LITTLE/Good BIT/Good OF/Good FAITH/Good LOVE/Good,1.5
12600177,/vol/tensusers8/aparikh/hf_cache/so/speechocean762/WAVE/SPEAKER1260/012600177.WAV,SHE IS OUT OF THIS WORLD,Good,Average,SHE/Excellent IS/Excellent OUT/Excellent OF/Excellent THIS/Excellent WORLD/Excellent,SHE/Good IS/Good OUT/Good OF/Good THIS/Good WORLD/Good,1.5
12600186,/vol/tensusers8/aparikh/hf_cache/so/speechocean762/WAVE/SPEAKER1260/012600186.WAV,WELL THAT WAS A BAD PERIOD,Good,Average,WELL/Excellent THAT/Excellent WAS/Excellent A/Excellent BAD/Excellent PERIOD/Average,WELL/Good THAT/Good WAS/Good A/Good BAD/Good PERIOD/Good,1.5
12600210,/vol/tensusers8/aparikh/hf_cache/so/speechocean762/WAVE/SPEAKER1260/012600210.WAV,APRIL IS OVER THEY OVER AND THEY RESULTS ARE IN,Good,Excellent,APRIL/Excellent IS/Excellent OVER/Excellent THEY/Excellent OVER/Excellent AND/Excellent THEY/Excellent RESULTS/Excellent ARE/Excellent IN/Excellent,APRIL/Good IS/Good OVER/Good THEY/Good OVER/Good AND/Good THEY/Good RESULTS/Good ARE/Good IN/Good,1.5
12600219,/vol/tensusers8/aparikh/hf_cache/so/speechocean762/WAVE/SPEAKER1260/012600219.WAV,FEELING A LITTLE TOO SAD,Good,Excellent,FEELING/Excellent A/Excellent LITTLE/Excellent TOO/Excellent SAD/Excellent,FEELING/Good A/Good LITTLE/Good TOO/Good SAD/Good,1.5
12600224,/vol/tensusers8/aparikh/hf_cache/so/speechocean762/WAVE/SPEAKER1260/012600224.WAV,WAIT YOU HAVE A CALLED,Excellent,Good,WAIT/Excellent YOU/Excellent HAVE/Excellent A/Excellent CALLED/Excellent,WAIT/Good YOU/Good HAVE/Good A/Good CALLED/Good,1.5
12600251,/vol/tensusers8/aparikh/hf_cache/so/speechocean762/WAVE/SPEAKER1260/012600251.WAV,LESS THAN A WEEK AGO,Good,Average,LESS/Excellent THAN/Excellent A/Excellent WEEK/Excellent AGO/Excellent,LESS/Good THAN/Good A/Good WEEK/Good AGO/Good,1.5
12600252,/vol/tensusers8/aparikh/hf_cache/so/speechocean762/WAVE/SPEAKER1260/012600252.WAV,PRIDE IS A HUGE PROBLEM,Good,Excellent,PRIDE/Excellent IS/Excellent A/Excellent HUGE/Excellent PROBLEM/Average,PRIDE/Good IS/Good A/Good HUGE/Good PROBLEM/Bad,1.5
12600263,/vol/tensusers8/aparikh/hf_cache/so/speechocean762/WAVE/SPEAKER1260/012600263.WAV,HE IS GOING TO END UP DEAD,Good,Excellent,HE/Excellent IS/Excellent GOING/Excellent TO/Excellent END/Excellent UP/Excellent DEAD/Excellent,HE/Good IS/Good GOING/Good TO/Good END/Good UP/Good DEAD/Good,1.5
12600281,/vol/tensusers8/aparikh/hf_cache/so/speechocean762/WAVE/SPEAKER1260/012600281.WAV,REPEAT COULD HAPPEN TO ANY OF US,Good,Excellent,REPEAT/Excellent COULD/Excellent HAPPEN/Excellent TO/Excellent ANY/Excellent OF/Excellent US/Excellent,REPEAT/Good COULD/Good HAPPEN/Good TO/Good ANY/Good OF/Good US/Good,1.5
12600295,/vol/tensusers8/aparikh/hf_cache/so/speechocean762/WAVE/SPEAKER1260/012600295.WAV,WHAT'S UP WITH THE CALLS,Good,Excellent,WHAT'S/Excellent UP/Excellent WITH/Excellent THE/Excellent CALLS/Excellent,WHAT'S/Good UP/Good WITH/Good THE/Good CALLS/Good,1.5
12600330,/vol/tensusers8/aparikh/hf_cache/so/speechocean762/WAVE/SPEAKER1260/012600330.WAV,HE PUSHED THE IDEA AWAY,Excellent,Good,HE/Excellent PUSHED/Excellent THE/Excellent IDEA/Excellent AWAY/Excellent,HE/Good PUSHED/Good THE/Good IDEA/Good AWAY/Good,1.5
12600338,/vol/tensusers8/aparikh/hf_cache/so/speechocean762/WAVE/SPEAKER1260/012600338.WAV,NOT BY A GOOD DEAL,Good,Excellent,NOT/Excellent BY/Excellent A/Excellent GOOD/Excellent DEAL/Bad,NOT/Good BY/Good A/Good GOOD/Good DEAL/Average,1.5
12600345,/vol/tensusers8/aparikh/hf_cache/so/speechocean762/WAVE/SPEAKER1260/012600345.WAV,WE PROFIT FROM THE WORK OF THE SPECIALISTS,Good,Average,WE/Excellent PROFIT/Excellent FROM/Excellent THE/Bad WORK/Excellent OF/Excellent THE/Excellent SPECIALISTS/Excellent,WE/Good PROFIT/Good FROM/Good THE/Good WORK/Good OF/Good THE/Good SPECIALISTS/Good,1.5
12600357,/vol/tensusers8/aparikh/hf_cache/so/speechocean762/WAVE/SPEAKER1260/012600357.WAV,AMONG RUSSIANS THERE ARE MANY SUCH,Good,Excellent,AMONG/Excellent RUSSIANS/Excellent THERE/Excellent ARE/Excellent MANY/Excellent SUCH/Excellent,AMONG/Good RUSSIANS/Good THERE/Good ARE/Good MANY/Good SUCH/Good,1.5
12600368,/vol/tensusers8/aparikh/hf_cache/so/speechocean762/WAVE/SPEAKER1260/012600368.WAV,SHE'S ONE OF THESE WILD FELLOWS,Good,Average,SHE'S/Excellent ONE/Excellent OF/Excellent THESE/Excellent WILD/Excellent FELLOWS/Good,SHE'S/Good ONE/Good OF/Good THESE/Good WILD/Good FELLOWS/Excellent,1.5
13090018,/vol/tensusers8/aparikh/hf_cache/so/speechocean762/WAVE/SPEAKER1309/013090018.WAV,SO OF COURSE I WAS PICKED ON,Good,Excellent,SO/Excellent OF/Excellent COURSE/Excellent I/Excellent WAS/Excellent PICKED/Excellent ON/Excellent,SO/Good OF/Good COURSE/Good I/Good WAS/Good PICKED/Good ON/Good,1.5
13090027,/vol/tensusers8/aparikh/hf_cache/so/speechocean762/WAVE/SPEAKER1309/013090027.WAV,IT IS A CONTRADICTION IN TERMS,Good,Average,IT/Excellent IS/Excellent A/Excellent CONTRADICTION/Excellent IN/Excellent TERMS/Excellent,IT/Good IS/Good A/Good CONTRADICTION/Good IN/Good TERMS/Good,1.5
13090041,/vol/tensusers8/aparikh/hf_cache/so/speechocean762/WAVE/SPEAKER1309/013090041.WAV,SHE HAD SUFFERED STROKES AND HEART FAILURE,Excellent,Good,SHE/Excellent HAD/Excellent SUFFERED/Excellent STROKES/Excellent AND/Excellent HEART/Excellent FAILURE/Excellent,SHE/Good HAD/Good SUFFERED/Good STROKES/Good AND/Good HEART/Good FAILURE/Good,1.5
13090051,/vol/tensusers8/aparikh/hf_cache/so/speechocean762/WAVE/SPEAKER1309/013090051.WAV,HOWEVER THAT WAS THEN AND THIS IS NOW,Good,Average,HOWEVER/Excellent THAT/Excellent WAS/Excellent THEN/Excellent AND/Excellent THIS/Excellent IS/Excellent NOW/Excellent,HOWEVER/Good THAT/Good WAS/Good THEN/Good AND/Good THIS/Good IS/Good NOW/Good,1.5
13090076,/vol/tensusers8/aparikh/hf_cache/so/speechocean762/WAVE/SPEAKER1309/013090076.WAV,AND WITHOUT FEAR OF BEING ARRESTED,Good,Average,AND/Excellent WITHOUT/Excellent FEAR/Excellent OF/Excellent BEING/Excellent ARRESTED/Good,AND/Good WITHOUT/Good FEAR/Good OF/Good BEING/Good ARRESTED/Average,1.5
13090105,/vol/tensusers8/aparikh/hf_cache/so/speechocean762/WAVE/SPEAKER1309/013090105.WAV,I JUST WANT MY MONEY,Excellent,Good,I/Excellent JUST/Excellent WANT/Excellent MY/Excellent MONEY/Excellent,I/Good JUST/Good WANT/Good MY/Good MONEY/Good,1.5
13090128,/vol/tensusers8/aparikh/hf_cache/so/speechocean762/WAVE/SPEAKER1309/013090128.WAV,THAT WAS THE BEFORE THIS IS THE AFTER,Excellent,Good,THAT/Excellent WAS/Excellent THE/Excellent BEFORE/Excellent THIS/Excellent IS/Excellent THE/Excellent AFTER/Excellent,THAT/Good WAS/Good THE/Good BEFORE/Good THIS/Good IS/Good THE/Good AFTER/Good,1.5
13090147,/vol/tensusers8/aparikh/hf_cache/so/speechocean762/WAVE/SPEAKER1309/013090147.WAV,TOMORROW IS GOING TO BE A BIG DAY FOR ME,Good,Average,TOMORROW/Excellent IS/Excellent GOING/Excellent TO/Excellent BE/Excellent A/Excellent BIG/Excellent DAY/Excellent FOR/Good ME/Excellent,TOMORROW/Good IS/Good GOING/Good TO/Good BE/Good A/Good BIG/Good DAY/Good FOR/Average ME/Good,1.5
13090148,/vol/tensusers8/aparikh/hf_cache/so/speechocean762/WAVE/SPEAKER1309/013090148.WAV,HOW DO YOU WIDE THE GAMES,Good,Excellent,HOW/Excellent DO/Excellent YOU/Excellent WIDE/Excellent THE/Excellent GAMES/Excellent,HOW/Good DO/Good YOU/Good WIDE/Good THE/Good GAMES/Good,1.5
13090160,/vol/tensusers8/aparikh/hf_cache/so/speechocean762/WAVE/SPEAKER1309/013090160.WAV,I HAVE TO KEEP TELLING MYSELF THAT,Good,Average,I/Excellent HAVE/Excellent TO/Excellent KEEP/Excellent TELLING/Excellent MYSELF/Excellent THAT/Excellent,I/Good HAVE/Good TO/Good KEEP/Good TELLING/Good MYSELF/Good THAT/Good,1.5
13090179,/vol/tensusers8/aparikh/hf_cache/so/speechocean762/WAVE/SPEAKER1309/013090179.WAV,SHE IS HIGH AS A KITE MOST OF THE TIME,Excellent,Good,SHE/Excellent IS/Excellent HIGH/Excellent AS/Excellent A/Excellent KITE/Excellent MOST/Excellent OF/Excellent THE/Bad TIME/Excellent,SHE/Good IS/Good HIGH/Good AS/Good A/Good KITE/Good MOST/Good OF/Good THE/Average TIME/Good,1.5
13090181,/vol/tensusers8/aparikh/hf_cache/so/speechocean762/WAVE/SPEAKER1309/013090181.WAV,COME BACK TO THE PARTY MAN,Excellent,Good,COME/Excellent BACK/Excellent TO/Excellent THE/Excellent PARTY/Excellent MAN/Excellent,COME/Good BACK/Good TO/Good THE/Good PARTY/Good MAN/Good,1.5
13090184,/vol/tensusers8/aparikh/hf_cache/so/speechocean762/WAVE/SPEAKER1309/013090184.WAV,PASSED HALF A MILLION VIEWS,Good,Excellent,PASSED/Average HALF/Excellent A/Excellent MILLION/Excellent VIEWS/Excellent,PASSED/Good HALF/Good A/Good MILLION/Good VIEWS/Good,1.5
13090185,/vol/tensusers8/aparikh/hf_cache/so/speechocean762/WAVE/SPEAKER1309/013090185.WAV,MAINLY THOSE WHO WERE NOT WORKING,Good,Average,MAINLY/Excellent THOSE/Excellent WHO/Excellent WERE/Excellent NOT/Excellent WORKING/Excellent,MAINLY/Good THOSE/Good WHO/Good WERE/Good NOT/Good WORKING/Good,1.5
13090202,/vol/tensusers8/aparikh/hf_cache/so/speechocean762/WAVE/SPEAKER1309/013090202.WAV,WHERE ARE THE BELLES FROM,Good,Average,WHERE/Excellent ARE/Excellent THE/Excellent BELLES/Excellent FROM/Excellent,WHERE/Good ARE/Good THE/Good BELLES/Good FROM/Good,1.5
13090232,/vol/tensusers8/aparikh/hf_cache/so/speechocean762/WAVE/SPEAKER1309/013090232.WAV,PEOPLE ARE NOT READY FOR IT,Good,Average,PEOPLE/Excellent ARE/Excellent NOT/Excellent READY/Excellent FOR/Excellent IT/Excellent,PEOPLE/Good ARE/Good NOT/Good READY/Good FOR/Good IT/Good,1.5
13090267,/vol/tensusers8/aparikh/hf_cache/so/speechocean762/WAVE/SPEAKER1309/013090267.WAV,THEN WOULD STOP WORKING IN THE MIDDLE OF THE NIGHT,Good,Average,THEN/Excellent WOULD/Excellent STOP/Excellent WORKING/Excellent IN/Excellent THE/Excellent MIDDLE/Excellent OF/Excellent THE/Excellent NIGHT/Excellent,THEN/Good WOULD/Good STOP/Good WORKING/Good IN/Good THE/Good MIDDLE/Good OF/Good THE/Good NIGHT/Good,1.5
13090287,/vol/tensusers8/aparikh/hf_cache/so/speechocean762/WAVE/SPEAKER1309/013090287.WAV,CHEESE IS ON THE ATTACK,Good,Average,CHEESE/Excellent IS/Excellent ON/Excellent THE/Excellent ATTACK/Excellent,CHEESE/Good IS/Good ON/Good THE/Good ATTACK/Good,1.5
13090339,/vol/tensusers8/aparikh/hf_cache/so/speechocean762/WAVE/SPEAKER1309/013090339.WAV,BUT I WANTED TO KNOW SO BADLY,Good,Average,BUT/Excellent I/Excellent WANTED/Excellent TO/Excellent KNOW/Excellent SO/Excellent BADLY/Excellent,BUT/Good I/Good WANTED/Good TO/Good KNOW/Good SO/Good BADLY/Good,1.5
13090364,/vol/tensusers8/aparikh/hf_cache/so/speechocean762/WAVE/SPEAKER1309/013090364.WAV,LOVE TO THROW YOURSELF ON THE EARTH AND KISS IT,Good,Excellent,LOVE/Excellent TO/Excellent THROW/Excellent YOURSELF/Excellent ON/Excellent THE/Excellent EARTH/Excellent AND/Excellent KISS/Excellent IT/Excellent,LOVE/Good TO/Good THROW/Good YOURSELF/Good ON/Good THE/Good EARTH/Good AND/Good KISS/Good IT/Good,1.5
13360001,/vol/tensusers8/aparikh/hf_cache/so/speechocean762/WAVE/SPEAKER1336/013360001.WAV,OUR FUTURE IS NEVER TRAPPED IN THE HANDS OF FATE,Bad,Average,OUR/Bad FUTURE/Excellent IS/Excellent NEVER/Average TRAPPED/Excellent IN/Excellent THE/Excellent HANDS/Average OF/Excellent FATE/Excellent,OUR/Average FUTURE/Good IS/Good NEVER/Good TRAPPED/Good IN/Good THE/Good HANDS/Bad OF/Good FATE/Good,1.5
13360002,/vol/tensusers8/aparikh/hf_cache/so/speechocean762/WAVE/SPEAKER1336/013360002.WAV,HE HAD A HEART OF GOD,Good,Average,HE/Excellent HAD/Excellent A/Excellent HEART/Excellent OF/Excellent GOD/Excellent,HE/Good HAD/Good A/Good HEART/Good OF/Good GOD/Good,1.5
13360016,/vol/tensusers8/aparikh/hf_cache/so/speechocean762/WAVE/SPEAKER1336/013360016.WAV,WE COME IN WITH A CANDIDATE,Good,Average,WE/Excellent COME/Excellent IN/Excellent WITH/Bad A/Excellent CANDIDATE/Excellent,WE/Good COME/Good IN/Good WITH/Good A/Good CANDIDATE/Good,1.5
13360082,/vol/tensusers8/aparikh/hf_cache/so/speechocean762/WAVE/SPEAKER1336/013360082.WAV,IT IS THE RESULT OF MAJOR REFORM IN THE COUNTRY,Good,Average,IT/Excellent IS/Excellent THE/Excellent RESULT/Excellent OF/Excellent MAJOR/Excellent REFORM/Excellent IN/Excellent THE/Excellent COUNTRY/Excellent,IT/Good IS/Good THE/Good RESULT/Good OF/Good MAJOR/Good REFORM/Good IN/Good THE/Good COUNTRY/Good,1.5
13360123,/vol/tensusers8/aparikh/hf_cache/so/speechocean762/WAVE/SPEAKER1336/013360123.WAV,IT IS A GOOD POINT,Good,Average,IT/Excellent IS/Excellent A/Excellent GOOD/Excellent POINT/Excellent,IT/Good IS/Good A/Good GOOD/Good POINT/Good,1.5
13360130,/vol/tensusers8/aparikh/hf_cache/so/speechocean762/WAVE/SPEAKER1336/013360130.WAV,BUT EVEN THAT IS PART OF THE POINT,Good,Excellent,BUT/Excellent EVEN/Excellent THAT/Excellent IS/Excellent PART/Excellent OF/Excellent THE/Excellent POINT/Excellent,BUT/Good EVEN/Good THAT/Good IS/Good PART/Good OF/Good THE/Good POINT/Good,1.5
13360140,/vol/tensusers8/aparikh/hf_cache/so/speechocean762/WAVE/SPEAKER1336/013360140.WAV,HOW IS IT MARCH ALREADY,Good,Excellent,HOW/Excellent IS/Excellent IT/Excellent MARCH/Excellent ALREADY/Excellent,HOW/Good IS/Good IT/Good MARCH/Good ALREADY/Good,1.5
13360145,/vol/tensusers8/aparikh/hf_cache/so/speechocean762/WAVE/SPEAKER1336/013360145.WAV,A MEN A CAMERA A BOOK,Good,Excellent,A/Excellent MEN/Excellent A/Excellent CAMERA/Average A/Excellent BOOK/Excellent,A/Good MEN/Good A/Good CAMERA/Bad A/Good BOOK/Good,1.5
13360146,/vol/tensusers8/aparikh/hf_cache/so/speechocean762/WAVE/SPEAKER1336/013360146.WAV,SO I CAN TAKE A LISTEN,Good,Average,SO/Excellent I/Excellent CAN/Excellent TAKE/Excellent A/Excellent LISTEN/Average,SO/Good I/Good CAN/Good TAKE/Good A/Good LISTEN/Good,1.5
13360161,/vol/tensusers8/aparikh/hf_cache/so/speechocean762/WAVE/SPEAKER1336/013360161.WAV,WANT TO BE THE FIRST TO HEAR THE NEWS,Good,Average,WANT/Excellent TO/Excellent BE/Excellent THE/Excellent FIRST/Excellent TO/Excellent HEAR/Excellent THE/Excellent NEWS/Average,WANT/Good TO/Good BE/Good THE/Good FIRST/Good TO/Good HEAR/Good THE/Good NEWS/Good,1.5
13360162,/vol/tensusers8/aparikh/hf_cache/so/speechocean762/WAVE/SPEAKER1336/013360162.WAV,THIS IS A WASTE OF MONEY,Good,Average,THIS/Excellent IS/Excellent A/Excellent WASTE/Excellent OF/Excellent MONEY/Good,THIS/Good IS/Good A/Good WASTE/Good OF/Good MONEY/Excellent,1.5
13360171,/vol/tensusers8/aparikh/hf_cache/so/speechocean762/WAVE/SPEAKER1336/013360171.WAV,I HOPE YOU WILL HAVE THE BEST BIRTHDAY,Good,Average,I/Excellent HOPE/Excellent YOU/Excellent WILL/Good HAVE/Excellent THE/Excellent BEST/Excellent BIRTHDAY/Good,I/Good HOPE/Good YOU/Good WILL/Average HAVE/Good THE/Good BEST/Good BIRTHDAY/Excellent,1.5
13360226,/vol/tensusers8/aparikh/hf_cache/so/speechocean762/WAVE/SPEAKER1336/013360226.WAV,WHAT TIME WOULD YOU LIKE TO DO,Good,Excellent,WHAT/Excellent TIME/Excellent WOULD/Excellent YOU/Excellent LIKE/Excellent TO/Excellent DO/Excellent,WHAT/Good TIME/Good WOULD/Good YOU/Good LIKE/Good TO/Good DO/Good,1.5
13360234,/vol/tensusers8/aparikh/hf_cache/so/speechocean762/WAVE/SPEAKER1336/013360234.WAV,TRYING TO GET UP AND GET READY FOR WORK,Good,Excellent,TRYING/Excellent TO/Excellent GET/Excellent UP/Excellent AND/Excellent GET/Excellent READY/Excellent FOR/Excellent WORK/Excellent,TRYING/Good TO/Good GET/Good UP/Good AND/Good GET/Good READY/Good FOR/Good WORK/Good,1.5
13360235,/vol/tensusers8/aparikh/hf_cache/so/speechocean762/WAVE/SPEAKER1336/013360235.WAV,THIS IS THE BEST LUNCH,Good,Excellent,THIS/Excellent IS/Excellent THE/Excellent BEST/Excellent LUNCH/Excellent,THIS/Good IS/Good THE/Good BEST/Good LUNCH/Good,1.5
13360257,/vol/tensusers8/aparikh/hf_cache/so/speechocean762/WAVE/SPEAKER1336/013360257.WAV,THEN WE HAVE A WINNER,Good,Excellent,THEN/Excellent WE/Excellent HAVE/Excellent A/Excellent WINNER/Excellent,THEN/Good WE/Good HAVE/Good A/Good WINNER/Good,1.5
13360263,/vol/tensusers8/aparikh/hf_cache/so/speechocean762/WAVE/SPEAKER1336/013360263.WAV,THE PICTURE OF THE NIGHT,Good,Excellent,THE/Excellent PICTURE/Excellent OF/Excellent THE/Excellent NIGHT/Bad,THE/Good PICTURE/Good OF/Good THE/Good NIGHT/Good,1.5
13360268,/vol/tensusers8/aparikh/hf_cache/so/speechocean762/WAVE/SPEAKER1336/013360268.WAV,BUT WE HAVE THE BRAINS,Good,Average,BUT/Excellent WE/Excellent HAVE/Excellent THE/Excellent BRAINS/Good,BUT/Good WE/Good HAVE/Good THE/Good BRAINS/Excellent,1.5
13360360,/vol/tensusers8/aparikh/hf_cache/so/speechocean762/WAVE/SPEAKER1336/013360360.WAV,THERE HE IS ON THE BACK SEAT,Good,Excellent,THERE/Excellent HE/Excellent IS/Excellent ON/Excellent THE/Excellent BACK/Excellent SEAT/Excellent,THERE/Good HE/Good IS/Good ON/Good THE/Good BACK/Good SEAT/Good,1.5
13360363,/vol/tensusers8/aparikh/hf_cache/so/speechocean762/WAVE/SPEAKER1336/013360363.WAV,HE SEEMED TO SHAKE HIMSELF,Excellent,Good,HE/Excellent SEEMED/Excellent TO/Excellent SHAKE/Excellent HIMSELF/Excellent,HE/Good SEEMED/Good TO/Good SHAKE/Good HIMSELF/Good,1.5
13620027,/vol/tensusers8/aparikh/hf_cache/so/speechocean762/WAVE/SPEAKER1362/013620027.WAV,IT IS A WORLD PROBLEM,Good,Average,IT/Excellent IS/Excellent A/Excellent WORLD/Excellent PROBLEM/Excellent,IT/Good IS/Good A/Good WORLD/Good PROBLEM/Good,1.5
13620030,/vol/tensusers8/aparikh/hf_cache/so/speechocean762/WAVE/SPEAKER1362/013620030.WAV,HE'S A TRUE TIME PLAYER ON THE OFF AN FLIGHT,Good,Average,HE'S/Excellent A/Excellent TRUE/Excellent TIME/Excellent PLAYER/Average ON/Excellent THE/Excellent OFF/Excellent AN/Excellent FLIGHT/Excellent,HE'S/Good A/Good TRUE/Good TIME/Good PLAYER/Good ON/Good THE/Good OFF/Good AN/Good FLIGHT/Good,1.5
13620106,/vol/tensusers8/aparikh/hf_cache/so/speechocean762/WAVE/SPEAKER1362/013620106.WAV,IF YOU MISS THERE'S A RARELY CONSEQUENCE,Good,Excellent,IF/Excellent YOU/Excellent MISS/Excellent THERE'S/Excellent A/Excellent RARELY/Excellent CONSEQUENCE/Excellent,IF/Good YOU/Good MISS/Good THERE'S/Good A/Good RARELY/Good CONSEQUENCE/Good,1.5
13620108,/vol/tensusers8/aparikh/hf_cache/so/speechocean762/WAVE/SPEAKER1362/013620108.WAV,BUT THERE WAS NO ONE WHO COULD HELP,Good,Excellent,BUT/Excellent THERE/Excellent WAS/Excellent NO/Excellent ONE/Excellent WHO/Excellent COULD/Excellent HELP/Excellent,BUT/Good THERE/Good WAS/Good NO/Good ONE/Good WHO/Good COULD/Good HELP/Good,1.5
13620128,/vol/tensusers8/aparikh/hf_cache/so/speechocean762/WAVE/SPEAKER1362/013620128.WAV,GOING TO GIVE A GO,Good,Average,GOING/Excellent TO/Excellent GIVE/Excellent A/Excellent GO/Excellent,GOING/Good TO/Good GIVE/Good A/Good GO/Good,1.5
13620137,/vol/tensusers8/aparikh/hf_cache/so/speechocean762/WAVE/SPEAKER1362/013620137.WAV,WE NEED YOU HELP TO KEEP IT UP,Good,Excellent,WE/Excellent NEED/Excellent YOU/Excellent HELP/Excellent TO/Excellent KEEP/Excellent IT/Excellent UP/Excellent,WE/Good NEED/Good YOU/Good HELP/Good TO/Good KEEP/Good IT/Good UP/Good,1.5
13620140,/vol/tensusers8/aparikh/hf_cache/so/speechocean762/WAVE/SPEAKER1362/013620140.WAV,I CAN SEE IT BEING A NEW TURNED,Good,Excellent,I/Excellent CAN/Excellent SEE/Excellent IT/Excellent BEING/Excellent A/Excellent NEW/Excellent TURNED/Excellent,I/Good CAN/Good SEE/Good IT/Good BEING/Good A/Good NEW/Good TURNED/Good,1.5
13620143,/vol/tensusers8/aparikh/hf_cache/so/speechocean762/WAVE/SPEAKER1362/013620143.WAV,SHOULD BE FUN TO SEE THE RESULTS,Good,Average,SHOULD/Excellent BE/Excellent FUN/Good TO/Excellent SEE/Excellent THE/Excellent RESULTS/Excellent,SHOULD/Good BE/Good FUN/Average TO/Good SEE/Good THE/Good RESULTS/Good,1.5
13620146,/vol/tensusers8/aparikh/hf_cache/so/speechocean762/WAVE/SPEAKER1362/013620146.WAV,IT'S A LIE OF COURSE,Excellent,Good,IT'S/Excellent A/Excellent LIE/Excellent OF/Excellent COURSE/Excellent,IT'S/Good A/Good LIE/Good OF/Good COURSE/Good,1.5
13620162,/vol/tensusers8/aparikh/hf_cache/so/speechocean762/WAVE/SPEAKER1362/013620162.WAV,ARE YOU AT THE CONCERT,Excellent,Good,ARE/Excellent YOU/Excellent AT/Excellent THE/Excellent CONCERT/Excellent,ARE/Good YOU/Good AT/Good THE/Good CONCERT/Good,1.5
13620175,/vol/tensusers8/aparikh/hf_cache/so/speechocean762/WAVE/SPEAKER1362/013620175.WAV,BUT HE'S NOT SUPPOSED TO BE GOOD,Good,Average,BUT/Excellent HE'S/Excellent NOT/Excellent SUPPOSED/Excellent TO/Excellent BE/Excellent GOOD/Excellent,BUT/Good HE'S/Good NOT/Good SUPPOSED/Good TO/Good BE/Good GOOD/Good,1.5
13620184,/vol/tensusers8/aparikh/hf_cache/so/speechocean762/WAVE/SPEAKER1362/013620184.WAV,FIRST ONE OF THE EVENING,Good,Excellent,FIRST/Excellent ONE/Excellent OF/Excellent THE/Excellent EVENING/Excellent,FIRST/Good ONE/Good OF/Good THE/Good EVENING/Good,1.5
13620185,/vol/tensusers8/aparikh/hf_cache/so/speechocean762/WAVE/SPEAKER1362/013620185.WAV,LIVING IN THE BAY WITH A WIN IN THE BAY,Good,Average,LIVING/Excellent IN/Excellent THE/Excellent BAY/Excellent WITH/Excellent A/Excellent WIN/Bad IN/Excellent THE/Excellent BAY/Excellent,LIVING/Good IN/Good THE/Good BAY/Good WITH/Good A/Good WIN/Average IN/Good THE/Good BAY/Good,1.5
13620210,/vol/tensusers8/aparikh/hf_cache/so/speechocean762/WAVE/SPEAKER1362/013620210.WAV,WELCOME TO THE START OF THE WORK WEEK,Good,Average,WELCOME/Excellent TO/Excellent THE/Excellent START/Excellent OF/Excellent THE/Excellent WORK/Excellent WEEK/Excellent,WELCOME/Good TO/Good THE/Good START/Good OF/Good THE/Good WORK/Good WEEK/Good,1.5
13620241,/vol/tensusers8/aparikh/hf_cache/so/speechocean762/WAVE/SPEAKER1362/013620241.WAV,NEED TO GET THE REST,Good,Excellent,NEED/Excellent TO/Excellent GET/Excellent THE/Excellent REST/Excellent,NEED/Good TO/Good GET/Good THE/Good REST/Good,1.5
13620257,/vol/tensusers8/aparikh/hf_cache/so/speechocean762/WAVE/SPEAKER1362/013620257.WAV,MAKE THE RIGHT CHOICE PARENTS,Good,Average,MAKE/Excellent THE/Excellent RIGHT/Excellent CHOICE/Excellent PARENTS/Excellent,MAKE/Good THE/Good RIGHT/Good CHOICE/Good PARENTS/Good,1.5
13620258,/vol/tensusers8/aparikh/hf_cache/so/speechocean762/WAVE/SPEAKER1362/013620258.WAV,DO YOU KNOW THE ANSWER,Good,Average,DO/Excellent YOU/Excellent KNOW/Excellent THE/Excellent ANSWER/Excellent,DO/Good YOU/Good KNOW/Good THE/Good ANSWER/Good,1.5
13620292,/vol/tensusers8/aparikh/hf_cache/so/speechocean762/WAVE/SPEAKER1362/013620292.WAV,THAT'S THE TRADE TIME I ASK,Good,Average,THAT'S/Excellent THE/Excellent TRADE/Excellent TIME/Excellent I/Excellent ASK/Excellent,THAT'S/Good THE/Good TRADE/Good TIME/Good I/Good ASK/Good,1.5
13620361,/vol/tensusers8/aparikh/hf_cache/so/speechocean762/WAVE/SPEAKER1362/013620361.WAV,BUT IT WAS SLOW WORK,Good,Excellent,BUT/Excellent IT/Excellent WAS/Excellent SLOW/Excellent WORK/Excellent,BUT/Good IT/Good WAS/Good SLOW/Good WORK/Good,1.5
13620366,/vol/tensusers8/aparikh/hf_cache/so/speechocean762/WAVE/SPEAKER1362/013620366.WAV,THEN HE MADE FOR HOME,Good,Average,THEN/Excellent HE/Excellent MADE/Excellent FOR/Excellent HOME/Excellent,THEN/Good HE/Good MADE/Good FOR/Good HOME/Good,1.5
13720023,/vol/tensusers8/aparikh/hf_cache/so/speechocean762/WAVE/SPEAKER1372/013720023.WAV,I HAD A GREAT TIME,Excellent,Good,I/Excellent HAD/Excellent A/Excellent GREAT/Excellent TIME/Excellent,I/Good HAD/Good A/Good GREAT/Good TIME/Good,1.5
13720051,/vol/tensusers8/aparikh/hf_cache/so/speechocean762/WAVE/SPEAKER1372/013720051.WAV,THAT WAS CERTAINLY AS TOUGH DAY IN MY LIFE,Good,Excellent,THAT/Excellent WAS/Excellent CERTAINLY/Excellent AS/Good TOUGH/Excellent DAY/Excellent IN/Excellent MY/Excellent LIFE/Excellent,THAT/Good WAS/Good CERTAINLY/Good AS/Excellent TOUGH/Good DAY/Good IN/Good MY/Good LIFE/Good,1.5
13720070,/vol/tensusers8/aparikh/hf_cache/so/speechocean762/WAVE/SPEAKER1372/013720070.WAV,AND OF COURSE IT HAPPENS THAT WAY,Good,Excellent,AND/Excellent OF/Excellent COURSE/Excellent IT/Excellent HAPPENS/Excellent THAT/Excellent WAY/Excellent,AND/Good OF/Good COURSE/Good IT/Good HAPPENS/Good THAT/Good WAY/Good,1.5
13720082,/vol/tensusers8/aparikh/hf_cache/so/speechocean762/WAVE/SPEAKER1372/013720082.WAV,THERE WAS NO REASON TO TAKE HIM OUT,Good,Average,THERE/Excellent WAS/Excellent NO/Excellent REASON/Excellent TO/Excellent TAKE/Excellent HIM/Excellent OUT/Excellent,THERE/Good WAS/Good NO/Good REASON/Good TO/Good TAKE/Good HIM/Good OUT/Good,1.5
13720140,/vol/tensusers8/aparikh/hf_cache/so/speechocean762/WAVE/SPEAKER1372/013720140.WAV,AND IF SO WILL IS THE REAL ONE,Good,Excellent,AND/Excellent IF/Excellent SO/Excellent WILL/Excellent IS/Excellent THE/Excellent REAL/Excellent ONE/Good,AND/Good IF/Good SO/Good WILL/Good IS/Good THE/Good REAL/Good ONE/Average,1.5
13720152,/vol/tensusers8/aparikh/hf_cache/so/speechocean762/WAVE/SPEAKER1372/013720152.WAV,AM I NOT ALLOWED TO LEAVE MY HOUSE,Good,Excellent,AM/Average I/Excellent NOT/Excellent ALLOWED/Excellent TO/Excellent LEAVE/Excellent MY/Excellent HOUSE/Good,AM/Good I/Good NOT/Good ALLOWED/Good TO/Good LEAVE/Good MY/Good HOUSE/Average,1.5
13720153,/vol/tensusers8/aparikh/hf_cache/so/speechocean762/WAVE/SPEAKER1372/013720153.WAV,READY TO GET DOWN TO BUSINESS,Good,Excellent,READY/Excellent TO/Excellent GET/Excellent DOWN/Excellent TO/Excellent BUSINESS/Good,READY/Good TO/Good GET/Good DOWN/Good TO/Good BUSINESS/Excellent,1.5
