id,audio_path,transcript,sentence_chosen,sentence_rejected,chosen,rejected,dpo_weight
69120061,/vol/tensusers8/aparikh/hf_cache/so/speechocean762/WAVE/SPEAKER6912/069120061.WAV,HOW WELL DID I KNOW HER,Excellent,Good,HOW/Excellent WELL/Excellent DID/Excellent I/Excellent KNOW/Excellent HER/Excellent,HOW/Good WELL/Good DID/Good I/Good KNOW/Good HER/Good,1.5
69120072,/vol/tensusers8/aparikh/hf_cache/so/speechocean762/WAVE/SPEAKER6912/069120072.WAV,IT TURNED US TO SILK,Average,Good,IT/Excellent TURNED/Excellent US/Excellent TO/Excellent SILK/Bad,IT/Good TURNED/Good US/Good TO/Good SILK/Good,1.5
69120083,/vol/tensusers8/aparikh/hf_cache/so/speechocean762/WAVE/SPEAKER6912/069120083.WAV,MY FRIENDS FOUND WATER,Good,Excellent,MY/Excellent FRIENDS/Excellent FOUND/Excellent WATER/Excellent,MY/Good FRIENDS/Good FOUND/Good WATER/Good,1.5
69120087,/vol/tensusers8/aparikh/hf_cache/so/speechocean762/WAVE/SPEAKER6912/069120087.WAV,SO PRETTY AND SO YOUNG,Excellent,Good,SO/Excellent PRETTY/Excellent AND/Excellent SO/Excellent YOUNG/Excellent,SO/Good PRETTY/Good AND/Good SO/Good YOUNG/Good,1.5
69120092,/vol/tensusers8/aparikh/hf_cache/so/speechocean762/WAVE/SPEAKER6912/069120092.WAV,TOGETHER THEY HELD HIM UP,Good,Excellent,TOGETHER/Excellent THEY/Excellent HELD/Excellent HIM/Excellent UP/Excellent,TOGETHER/Good THEY/Good HELD/Good HIM/Good UP/Good,1.5
69120093,/vol/tensusers8/aparikh/hf_cache/so/speechocean762/WAVE/SPEAKER6912/069120093.WAV,I GOT UP AND CROSSED THE ROOM TO HIM,Good,Excellent,I/Excellent GOT/Excellent UP/Excellent AND/Excellent CROSSED/Excellent THE/Excellent ROOM/Excellent TO/Excellent HIM/Excellent,I/Good GOT/Good UP/Good AND/Good CROSSED/Good THE/Good ROOM/Good TO/Good HIM/Good,1.5
69120094,/vol/tensusers8/aparikh/hf_cache/so/speechocean762/WAVE/SPEAKER6912/069120094.WAV,SHE WANTED TO QUESTION HIM,Good,Average,SHE/Excellent WANTED/Excellent TO/Excellent QUESTION/Excellent HIM/Excellent,SHE/Good WANTED/Good TO/Good QUESTION/Good HIM/Good,1.5
69120106,/vol/tensusers8/aparikh/hf_cache/so/speechocean762/WAVE/SPEAKER6912/069120106.WAV,THEN I TOOK HIS CHILD THERE,Good,Average,THEN/Excellent I/Excellent TOOK/Excellent HIS/Excellent CHILD/Excellent THERE/Excellent,THEN/Good I/Good TOOK/Good HIS/Good CHILD/Good THERE/Good,1.5
69120121,/vol/tensusers8/aparikh/hf_cache/so/speechocean762/WAVE/SPEAKER6912/069120121.WAV,I WOULD NOT MYSELF SAY THAT IT IS SO,Good,Excellent,I/Excellent WOULD/Excellent NOT/Excellent MYSELF/Excellent SAY/Excellent THAT/Excellent IT/Excellent IS/Excellent SO/Excellent,I/Good WOULD/Good NOT/Good MYSELF/Good SAY/Good THAT/Good IT/Good IS/Good SO/Good,1.5
69120123,/vol/tensusers8/aparikh/hf_cache/so/speechocean762/WAVE/SPEAKER6912/069120123.WAV,DID I PLEASE YOU,Excellent,Good,DID/Excellent I/Excellent PLEASE/Excellent YOU/Excellent,DID/Good I/Good PLEASE/Good YOU/Good,1.5
69120140,/vol/tensusers8/aparikh/hf_cache/so/speechocean762/WAVE/SPEAKER6912/069120140.WAV,HE STOOD AWAY FROM HER IN HIS SHAME,Good,Average,HE/Excellent STOOD/Excellent AWAY/Excellent FROM/Excellent HER/Excellent IN/Excellent HIS/Excellent SHAME/Excellent,HE/Good STOOD/Good AWAY/Good FROM/Good HER/Good IN/Good HIS/Good SHAME/Good,1.5
69120151,/vol/tensusers8/aparikh/hf_cache/so/speechocean762/WAVE/SPEAKER6912/069120151.WAV,SHE HELD HER HAND TO HIM,Good,Average,SHE/Excellent HELD/Bad HER/Excellent HAND/Excellent TO/Excellent HIM/Excellent,SHE/Good HELD/Good HER/Good HAND/Good TO/Good HIM/Good,1.5
69120165,/vol/tensusers8/aparikh/hf_cache/so/speechocean762/WAVE/SPEAKER6912/069120165.WAV,SHE MADE ME BETTER LAST NIGHT,Good,Excellent,SHE/Excellent MADE/Excellent ME/Excellent BETTER/Excellent LAST/Excellent NIGHT/Excellent,SHE/Good MADE/Good ME/Good BETTER/Good LAST/Good NIGHT/Good,1.5
69120170,/vol/tensusers8/aparikh/hf_cache/so/speechocean762/WAVE/SPEAKER6912/069120170.WAV,BUT WE HAVE LOST THE BEST OF MEN,Good,Excellent,BUT/Excellent WE/Excellent HAVE/Bad LOST/Excellent THE/Excellent BEST/Excellent OF/Excellent MEN/Excellent,BUT/Good WE/Good HAVE/Good LOST/Good THE/Good BEST/Good OF/Good MEN/Good,1.5
70010001,/vol/tensusers8/aparikh/hf_cache/so/speechocean762/WAVE/SPEAKER7001/070010001.WAV,IT WAS GOOD FOR ME,Average,Good,IT/Excellent WAS/Excellent GOOD/Bad FOR/Excellent ME/Excellent,IT/Good WAS/Good GOOD/Average FOR/Good ME/Good,1.5
70010002,/vol/tensusers8/aparikh/hf_cache/so/speechocean762/WAVE/SPEAKER7001/070010002.WAV,WE HAVE CLIMBED ONE STEP UP THE LADDER,Average,Good,WE/Excellent HAVE/Excellent CLIMBED/Average ONE/Excellent STEP/Excellent UP/Excellent THE/Excellent LADDER/Average,WE/Good HAVE/Good CLIMBED/Good ONE/Good STEP/Good UP/Good THE/Good LADDER/Good,1.5
70010003,/vol/tensusers8/aparikh/hf_cache/so/speechocean762/WAVE/SPEAKER7001/070010003.WAV,PLUS THE KIDS REALLY LIKE THE DOGS,Average,Good,PLUS/Average THE/Excellent KIDS/Bad REALLY/Average LIKE/Excellent THE/Excellent DOGS/Good,PLUS/Bad THE/Good KIDS/Good REALLY/Good LIKE/Good THE/Good DOGS/Average,1.5
70010004,/vol/tensusers8/aparikh/hf_cache/so/speechocean762/WAVE/SPEAKER7001/070010004.WAV,EVEN WHEN WE LOSE IT USUALLY A VERY CLOSE GAME,Bad,Good,EVEN/Excellent WHEN/Excellent WE/Excellent LOSE/Bad IT/Excellent USUALLY/Average A/Excellent VERY/Bad CLOSE/Excellent GAME/Excellent,EVEN/Good WHEN/Good WE/Good LOSE/Good IT/Good USUALLY/Good A/Good VERY/Average CLOSE/Good GAME/Good,2.0
70010005,/vol/tensusers8/aparikh/hf_cache/so/speechocean762/WAVE/SPEAKER7001/070010005.WAV,MOSTLY THE AMERICAN COMMUNITY IN EUROPE FOLLOWS THE GAME,Bad,Good,MOSTLY/Average THE/Excellent AMERICAN/Excellent COMMUNITY/Bad IN/Excellent EUROPE/Good FOLLOWS/Good THE/Excellent GAME/Excellent,MOSTLY/Good THE/Good AMERICAN/Good COMMUNITY/Average IN/Good EUROPE/Excellent FOLLOWS/Excellent THE/Good GAME/Good,2.0
70010006,/vol/tensusers8/aparikh/hf_cache/so/speechocean762/WAVE/SPEAKER7001/070010006.WAV,WHAT HE WAS TALKING ABOUT WAS SPORTS IN GENERAL,Average,Bad,WHAT/Excellent HE/Excellent WAS/Good TALKING/Excellent ABOUT/Excellent WAS/Good SPORTS/Average IN/Excellent GENERAL/Bad,WHAT/Good HE/Good WAS/Excellent TALKING/Good ABOUT/Good WAS/Excellent SPORTS/Good IN/Good GENERAL/Good,1.5
70010007,/vol/tensusers8/aparikh/hf_cache/so/speechocean762/WAVE/SPEAKER7001/070010007.WAV,WAY TO HELP US ALL OUT,Average,Good,WAY/Excellent TO/Excellent HELP/Excellent US/Excellent ALL/Excellent OUT/Excellent,WAY/Good TO/Good HELP/Good US/Good ALL/Good OUT/Good,1.5
70010008,/vol/tensusers8/aparikh/hf_cache/so/speechocean762/WAVE/SPEAKER7001/070010008.WAV,LOVELY TO MAKE YOUR ACQUAINTANCE SIR,Bad,Good,LOVELY/Excellent TO/Excellent MAKE/Excellent YOUR/Bad ACQUAINTANCE/Bad SIR/Excellent,LOVELY/Good TO/Good MAKE/Good YOUR/Good ACQUAINTANCE/Average SIR/Good,2.0
70010009,/vol/tensusers8/aparikh/hf_cache/so/speechocean762/WAVE/SPEAKER7001/070010009.WAV,SUCCESSFUL FIRST DAY FOR COLLEGE,Average,Good,SUCCESSFUL/Bad FIRST/Excellent DAY/Excellent FOR/Excellent COLLEGE/Average,SUCCESSFUL/Average FIRST/Good DAY/Good FOR/Good COLLEGE/Good,1.5
70010010,/vol/tensusers8/aparikh/hf_cache/so/speechocean762/WAVE/SPEAKER7001/070010010.WAV,THIS IS A PRETTY GOOD PLACE TO START,Bad,Good,THIS/Excellent IS/Excellent A/Excellent PRETTY/Bad GOOD/Excellent PLACE/Excellent TO/Excellent START/Good,THIS/Good IS/Good A/Good PRETTY/Good GOOD/Good PLACE/Good TO/Good START/Average,2.0
70010011,/vol/tensusers8/aparikh/hf_cache/so/speechocean762/WAVE/SPEAKER7001/070010011.WAV,LOVE IS A STRONG MAN IN THE MIDDLE,Good,Excellent,LOVE/Excellent IS/Excellent A/Excellent STRONG/Good MAN/Excellent IN/Excellent THE/Excellent MIDDLE/Bad,LOVE/Good IS/Good A/Good STRONG/Excellent MAN/Good IN/Good THE/Good MIDDLE/Good,1.5
70010012,/vol/tensusers8/aparikh/hf_cache/so/speechocean762/WAVE/SPEAKER7001/070010012.WAV,SOMEBODY LET ME KNOW WHEN IT'S OVER,Average,Good,SOMEBODY/Average LET/Excellent ME/Excellent KNOW/Excellent WHEN/Excellent IT'S/Bad OVER/Excellent,SOMEBODY/Bad LET/Good ME/Good KNOW/Good WHEN/Good IT'S/Average OVER/Good,1.5
70010013,/vol/tensusers8/aparikh/hf_cache/so/speechocean762/WAVE/SPEAKER7001/070010013.WAV,YOU PUT IT ON WRONG,Average,Good,YOU/Excellent PUT/Excellent IT/Excellent ON/Excellent WRONG/Bad,YOU/Good PUT/Good IT/Good ON/Good WRONG/Good,1.5
70010014,/vol/tensusers8/aparikh/hf_cache/so/speechocean762/WAVE/SPEAKER7001/070010014.WAV,COMPETITION IS GOOD FOR THE INDUSTRY,Average,Good,COMPETITION/Excellent IS/Excellent GOOD/Excellent FOR/Excellent THE/Excellent INDUSTRY/Average,COMPETITION/Good IS/Good GOOD/Good FOR/Good THE/Good INDUSTRY/Good,1.5
70010015,/vol/tensusers8/aparikh/hf_cache/so/speechocean762/WAVE/SPEAKER7001/070010015.WAV,SHE LOOKED ANXIOUSLY AT THE HOUSE AND STARTED,Average,Good,SHE/Excellent LOOKED/Average ANXIOUSLY/Bad AT/Excellent THE/Excellent HOUSE/Excellent AND/Excellent STARTED/Average,SHE/Good LOOKED/Bad ANXIOUSLY/Average AT/Good THE/Good HOUSE/Good AND/Good STARTED/Good,1.5
70010016,/vol/tensusers8/aparikh/hf_cache/so/speechocean762/WAVE/SPEAKER7001/070010016.WAV,THEY MAY MAKE ME MORE UNHAPPY THAN I AM,Average,Good,THEY/Excellent MAY/Excellent MAKE/Excellent ME/Excellent MORE/Excellent UNHAPPY/Average THAN/Excellent I/Excellent AM/Excellent,THEY/Good MAY/Good MAKE/Good ME/Good MORE/Good UNHAPPY/Good THAN/Good I/Good AM/Good,1.5
70010017,/vol/tensusers8/aparikh/hf_cache/so/speechocean762/WAVE/SPEAKER7001/070010017.WAV,SHE WOULD BE SORRY FOR HIS DEATH,Bad,Average,SHE/Excellent WOULD/Bad BE/Excellent SORRY/Excellent FOR/Excellent HIS/Good DEATH/Bad,SHE/Good WOULD/Good BE/Good SORRY/Good FOR/Good HIS/Average DEATH/Good,1.5
70010018,/vol/tensusers8/aparikh/hf_cache/so/speechocean762/WAVE/SPEAKER7001/070010018.WAV,MY PEOPLE WILL BRING YOU TO THE SHIP,Average,Good,MY/Excellent PEOPLE/Average WILL/Bad BRING/Excellent YOU/Excellent TO/Excellent THE/Excellent SHIP/Bad,MY/Good PEOPLE/Good WILL/Average BRING/Good YOU/Good TO/Good THE/Good SHIP/Good,1.5
70010019,/vol/tensusers8/aparikh/hf_cache/so/speechocean762/WAVE/SPEAKER7001/070010019.WAV,IT WAS A PROOF OF HIS FRIENDSHIP,Average,Good,IT/Excellent WAS/Good A/Excellent PROOF/Average OF/Excellent HIS/Good FRIENDSHIP/Average,IT/Good WAS/Average A/Good PROOF/Good OF/Good HIS/Average FRIENDSHIP/Good,1.5
70010020,/vol/tensusers8/aparikh/hf_cache/so/speechocean762/WAVE/SPEAKER7001/070010020.WAV,I FOUND I HAD NO NEED TO THINK,Average,Good,I/Excellent FOUND/Average I/Excellent HAD/Bad NO/Excellent NEED/Excellent TO/Excellent THINK/Excellent,I/Good FOUND/Good I/Good HAD/Good NO/Good NEED/Good TO/Good THINK/Good,1.5
75510004,/vol/tensusers8/aparikh/hf_cache/so/speechocean762/WAVE/SPEAKER7551/075510004.WAV,I SHALL END BY FALLING IN LOVE WITH HER,Excellent,Good,I/Excellent SHALL/Excellent END/Excellent BY/Excellent FALLING/Excellent IN/Excellent LOVE/Excellent WITH/Excellent HER/Excellent,I/Good SHALL/Good END/Good BY/Good FALLING/Good IN/Good LOVE/Good WITH/Good HER/Good,1.5
75510010,/vol/tensusers8/aparikh/hf_cache/so/speechocean762/WAVE/SPEAKER7551/075510010.WAV,IT LOOKED LIKE ONE OF ALARM TO ME,Good,Average,IT/Excellent LOOKED/Excellent LIKE/Excellent ONE/Excellent OF/Excellent ALARM/Excellent TO/Excellent ME/Excellent,IT/Good LOOKED/Good LIKE/Good ONE/Good OF/Good ALARM/Good TO/Good ME/Good,1.5
75510017,/vol/tensusers8/aparikh/hf_cache/so/speechocean762/WAVE/SPEAKER7551/075510017.WAV,YOU SAY YOU ARE A BUSINESS MAN,Excellent,Good,YOU/Excellent SAY/Excellent YOU/Excellent ARE/Excellent A/Excellent BUSINESS/Good MAN/Excellent,YOU/Good SAY/Good YOU/Good ARE/Good A/Good BUSINESS/Average MAN/Good,1.5
75510036,/vol/tensusers8/aparikh/hf_cache/so/speechocean762/WAVE/SPEAKER7551/075510036.WAV,WE WISH ALL MAY TAKE WORRYING BY BUS,Excellent,Good,WE/Excellent WISH/Excellent ALL/Excellent MAY/Excellent TAKE/Excellent WORRYING/Excellent BY/Excellent BUS/Excellent,WE/Good WISH/Good ALL/Good MAY/Good TAKE/Good WORRYING/Good BY/Good BUS/Good,1.5
75510038,/vol/tensusers8/aparikh/hf_cache/so/speechocean762/WAVE/SPEAKER7551/075510038.WAV,IF SO HAD YOU NOT BETTER SHOW IT,Good,Excellent,IF/Excellent SO/Excellent HAD/Excellent YOU/Excellent NOT/Excellent BETTER/Excellent SHOW/Excellent IT/Excellent,IF/Good SO/Good HAD/Good YOU/Good NOT/Good BETTER/Good SHOW/Good IT/Good,1.5
75510041,/vol/tensusers8/aparikh/hf_cache/so/speechocean762/WAVE/SPEAKER7551/075510041.WAV,NOT ANYONE BUT YOU,Excellent,Good,NOT/Excellent ANYONE/Excellent BUT/Excellent YOU/Excellent,NOT/Good ANYONE/Good BUT/Good YOU/Good,1.5
75510057,/vol/tensusers8/aparikh/hf_cache/so/speechocean762/WAVE/SPEAKER7551/075510057.WAV,HE CAN STILL BE SAVED,Excellent,Good,HE/Excellent CAN/Excellent STILL/Excellent BE/Excellent SAVED/Excellent,HE/Good CAN/Good STILL/Good BE/Good SAVED/Good,1.5
75510076,/vol/tensusers8/aparikh/hf_cache/so/speechocean762/WAVE/SPEAKER7551/075510076.WAV,IS THERE ANYTHING MORE BEFORE I GO OUT,Excellent,Good,IS/Excellent THERE/Excellent ANYTHING/Excellent MORE/Excellent BEFORE/Excellent I/Excellent GO/Excellent OUT/Excellent,IS/Good THERE/Good ANYTHING/Good MORE/Good BEFORE/Good I/Good GO/Good OUT/Good,1.5
75510086,/vol/tensusers8/aparikh/hf_cache/so/speechocean762/WAVE/SPEAKER7551/075510086.WAV,HE PUT IT BACK IN HIS POCKET,Excellent,Good,HE/Excellent PUT/Excellent IT/Excellent BACK/Excellent IN/Excellent HIS/Excellent POCKET/Excellent,HE/Good PUT/Good IT/Good BACK/Good IN/Good HIS/Good POCKET/Good,1.5
75510090,/vol/tensusers8/aparikh/hf_cache/so/speechocean762/WAVE/SPEAKER7551/075510090.WAV,I COULD NEVER APPEAR BRIGHT BEFORE THE WORLD AGAIN,Good,Average,I/Excellent COULD/Excellent NEVER/Excellent APPEAR/Excellent BRIGHT/Excellent BEFORE/Excellent THE/Excellent WORLD/Excellent AGAIN/Excellent,I/Good COULD/Good NEVER/Good APPEAR/Good BRIGHT/Good BEFORE/Good THE/Good WORLD/Good AGAIN/Good,1.5
75510091,/vol/tensusers8/aparikh/hf_cache/so/speechocean762/WAVE/SPEAKER7551/075510091.WAV,TO BEEN THING I HAVE MADE UP MY MIND,Good,Average,TO/Excellent BEEN/Bad THING/Excellent I/Excellent HAVE/Excellent MADE/Excellent UP/Excellent MY/Excellent MIND/Excellent,TO/Good BEEN/Average THING/Good I/Good HAVE/Good MADE/Good UP/Good MY/Good MIND/Good,1.5
75510099,/vol/tensusers8/aparikh/hf_cache/so/speechocean762/WAVE/SPEAKER7551/075510099.WAV,AT NIGHT I DREAM MY HANDS,Good,Excellent,AT/Excellent NIGHT/Excellent I/Excellent DREAM/Excellent MY/Excellent HANDS/Good,AT/Good NIGHT/Good I/Good DREAM/Good MY/Good HANDS/Average,1.5
75510129,/vol/tensusers8/aparikh/hf_cache/so/speechocean762/WAVE/SPEAKER7551/075510129.WAV,WHEN IS THERE LETTER TO GO I WONDER,Good,Excellent,WHEN/Excellent IS/Excellent THERE/Excellent LETTER/Excellent TO/Excellent GO/Excellent I/Excellent WONDER/Excellent,WHEN/Good IS/Good THERE/Good LETTER/Good TO/Good GO/Good I/Good WONDER/Good,1.5
75510131,/vol/tensusers8/aparikh/hf_cache/so/speechocean762/WAVE/SPEAKER7551/075510131.WAV,HE SPENDS A LOT OF TIME RUSHING ABOUT IN IT,Good,Average,HE/Excellent SPENDS/Excellent A/Excellent LOT/Excellent OF/Excellent TIME/Excellent RUSHING/Excellent ABOUT/Excellent IN/Excellent IT/Excellent,HE/Good SPENDS/Good A/Good LOT/Good OF/Good TIME/Good RUSHING/Good ABOUT/Good IN/Good IT/Good,1.5
75510137,/vol/tensusers8/aparikh/hf_cache/so/speechocean762/WAVE/SPEAKER7551/075510137.WAV,BUT THERE WAS SOMEONE ELSE,Good,Excellent,BUT/Excellent THERE/Excellent WAS/Excellent SOMEONE/Excellent ELSE/Excellent,BUT/Good THERE/Good WAS/Good SOMEONE/Good ELSE/Good,1.5
75510142,/vol/tensusers8/aparikh/hf_cache/so/speechocean762/WAVE/SPEAKER7551/075510142.WAV,THE WATER WAS WRONG AND WE HAD GREAT FUN,Good,Average,THE/Excellent WATER/Excellent WAS/Excellent WRONG/Excellent AND/Excellent WE/Excellent HAD/Excellent GREAT/Excellent FUN/Excellent,THE/Good WATER/Good WAS/Good WRONG/Good AND/Good WE/Good HAD/Good GREAT/Good FUN/Good,1.5
75510144,/vol/tensusers8/aparikh/hf_cache/so/speechocean762/WAVE/SPEAKER7551/075510144.WAV,SHE WAS BETWEEN SIXTEEN AND SEVENTEEN YEARS OLD,Good,Average,SHE/Excellent WAS/Excellent BETWEEN/Excellent SIXTEEN/Excellent AND/Excellent SEVENTEEN/Excellent YEARS/Excellent OLD/Excellent,SHE/Good WAS/Good BETWEEN/Good SIXTEEN/Good AND/Good SEVENTEEN/Good YEARS/Good OLD/Good,1.5
75510163,/vol/tensusers8/aparikh/hf_cache/so/speechocean762/WAVE/SPEAKER7551/075510163.WAV,NOTHING WILL PUT AN END OF TO HIM,Good,Excellent,NOTHING/Excellent WILL/Excellent PUT/Excellent AN/Excellent END/Excellent OF/Excellent TO/Excellent HIM/Good,NOTHING/Good WILL/Good PUT/Good AN/Good END/Good OF/Good TO/Good HIM/Excellent,1.5
75510165,/vol/tensusers8/aparikh/hf_cache/so/speechocean762/WAVE/SPEAKER7551/075510165.WAV,I THINK I CAN GUESSED AT THE PERSON,Good,Average,I/Excellent THINK/Excellent I/Excellent CAN/Excellent GUESSED/Excellent AT/Excellent THE/Excellent PERSON/Excellent,I/Good THINK/Good I/Good CAN/Good GUESSED/Good AT/Good THE/Good PERSON/Good,1.5
75510167,/vol/tensusers8/aparikh/hf_cache/so/speechocean762/WAVE/SPEAKER7551/075510167.WAV,I HUNT ALL OVER THE TOWN TO FIND IT,Good,Average,I/Excellent HUNT/Excellent ALL/Excellent OVER/Excellent THE/Excellent TOWN/Excellent TO/Excellent FIND/Average IT/Excellent,I/Good HUNT/Good ALL/Good OVER/Good THE/Good TOWN/Good TO/Good FIND/Good IT/Good,1.5
80020001,/vol/tensusers8/aparikh/hf_cache/so/speechocean762/WAVE/SPEAKER8002/080020001.WAV,BUT THAT'S ANOTHER STORY ALTOGETHER,Average,Good,BUT/Excellent THAT'S/Excellent ANOTHER/Bad STORY/Excellent ALTOGETHER/Bad,BUT/Good THAT'S/Good ANOTHER/Good STORY/Good ALTOGETHER/Average,1.5
80020002,/vol/tensusers8/aparikh/hf_cache/so/speechocean762/WAVE/SPEAKER8002/080020002.WAV,IT WAS VERY VERY STRANGE,Bad,Good,IT/Excellent WAS/Bad VERY/Excellent VERY/Excellent STRANGE/Bad,IT/Good WAS/Good VERY/Good VERY/Good STRANGE/Good,2.0
80020003,/vol/tensusers8/aparikh/hf_cache/so/speechocean762/WAVE/SPEAKER8002/080020003.WAV,NATIONALLY THOUGH THE TREND IS BEGINNING TO TURN UPWARD AGAIN,Bad,Good,NATIONALLY/Bad THOUGH/Bad THE/Excellent TREND/Average IS/Excellent BEGINNING/Excellent TO/Excellent TURN/Bad UPWARD/Average AGAIN/Excellent,NATIONALLY/Average THOUGH/Average THE/Good TREND/Bad IS/Good BEGINNING/Good TO/Good TURN/Average UPWARD/Good AGAIN/Good,2.0
80020004,/vol/tensusers8/aparikh/hf_cache/so/speechocean762/WAVE/SPEAKER8002/080020004.WAV,WORRY IS PART OF LIFE,Good,Average,WORRY/Excellent IS/Excellent PART/Excellent OF/Excellent LIFE/Excellent,WORRY/Good IS/Good PART/Good OF/Good LIFE/Good,1.5
80020005,/vol/tensusers8/aparikh/hf_cache/so/speechocean762/WAVE/SPEAKER8002/080020005.WAV,NO NEED FOR A DOCK,Bad,Good,NO/Bad NEED/Excellent FOR/Bad A/Excellent DOCK/Excellent,NO/Average NEED/Good FOR/Average A/Good DOCK/Good,2.0
80020006,/vol/tensusers8/aparikh/hf_cache/so/speechocean762/WAVE/SPEAKER8002/080020006.WAV,TIME FOR A BIT OF HONOR,Bad,Good,TIME/Excellent FOR/Excellent A/Excellent BIT/Bad OF/Excellent HONOR/Bad,TIME/Good FOR/Good A/Good BIT/Average OF/Good HONOR/Good,2.0
80020007,/vol/tensusers8/aparikh/hf_cache/so/speechocean762/WAVE/SPEAKER8002/080020007.WAV,CHECK OUT FOR THE WIN,Average,Bad,CHECK/Average OUT/Excellent FOR/Bad THE/Excellent WIN/Excellent,CHECK/Good OUT/Good FOR/Good THE/Good WIN/Good,1.5
80020008,/vol/tensusers8/aparikh/hf_cache/so/speechocean762/WAVE/SPEAKER8002/080020008.WAV,IT'S GOING TO BE A BUSY WEEK,Bad,Average,IT'S/Bad GOING/Excellent TO/Excellent BE/Excellent A/Excellent BUSY/Bad WEEK/Excellent,IT'S/Average GOING/Good TO/Good BE/Good A/Good BUSY/Good WEEK/Good,1.5
80020009,/vol/tensusers8/aparikh/hf_cache/so/speechocean762/WAVE/SPEAKER8002/080020009.WAV,I HAVE NO ONE BUT MYSELF TO BLAMES FOR THIS,Bad,Average,I/Excellent HAVE/Excellent NO/Bad ONE/Excellent BUT/Excellent MYSELF/Excellent TO/Excellent BLAMES/Bad FOR/Excellent THIS/Bad,I/Good HAVE/Good NO/Good ONE/Good BUT/Good MYSELF/Good TO/Good BLAMES/Good FOR/Good THIS/Average,1.5
80020010,/vol/tensusers8/aparikh/hf_cache/so/speechocean762/WAVE/SPEAKER8002/080020010.WAV,WHAT A PERFECT ENDING TO THE DAY,Average,Bad,WHAT/Excellent A/Excellent PERFECT/Bad ENDING/Average TO/Excellent THE/Excellent DAY/Excellent,WHAT/Good A/Good PERFECT/Good ENDING/Good TO/Good THE/Good DAY/Good,1.5
80020011,/vol/tensusers8/aparikh/hf_cache/so/speechocean762/WAVE/SPEAKER8002/080020011.WAV,LOVING LIFE AND ALL THE PEOPLE IN MINE,Good,Excellent,LOVING/Excellent LIFE/Excellent AND/Excellent ALL/Excellent THE/Excellent PEOPLE/Excellent IN/Excellent MINE/Bad,LOVING/Good LIFE/Good AND/Good ALL/Good THE/Good PEOPLE/Good IN/Good MINE/Good,1.5
80020012,/vol/tensusers8/aparikh/hf_cache/so/speechocean762/WAVE/SPEAKER8002/080020012.WAV,COOL FOR HIM TO STICK UP FOR HER,Bad,Average,COOL/Excellent FOR/Excellent HIM/Excellent TO/Excellent STICK/Average UP/Excellent FOR/Bad HER/Bad,COOL/Good FOR/Good HIM/Good TO/Good STICK/Good UP/Good FOR/Good HER/Average,1.5
80020013,/vol/tensusers8/aparikh/hf_cache/so/speechocean762/WAVE/SPEAKER8002/080020013.WAV,DEPENDS ON A NUMBER OF THINGS,Average,Good,DEPENDS/Excellent ON/Excellent A/Excellent NUMBER/Excellent OF/Excellent THINGS/Bad,DEPENDS/Good ON/Good A/Good NUMBER/Good OF/Good THINGS/Good,1.5
80020014,/vol/tensusers8/aparikh/hf_cache/so/speechocean762/WAVE/SPEAKER8002/080020014.WAV,THAT WAS HEAD TO SAY,Bad,Good,THAT/Excellent WAS/Bad HEAD/Excellent TO/Excellent SAY/Bad,THAT/Good WAS/Average HEAD/Good TO/Good SAY/Average,2.0
80020015,/vol/tensusers8/aparikh/hf_cache/so/speechocean762/WAVE/SPEAKER8002/080020015.WAV,WANT TO GO FOR A WALK,Good,Excellent,WANT/Excellent TO/Excellent GO/Excellent FOR/Excellent A/Excellent WALK/Bad,WANT/Good TO/Good GO/Good FOR/Good A/Good WALK/Good,1.5
80020016,/vol/tensusers8/aparikh/hf_cache/so/speechocean762/WAVE/SPEAKER8002/080020016.WAV,CHEERS TO A GREAT GROUP,Average,Good,CHEERS/Bad TO/Excellent A/Excellent GREAT/Bad GROUP/Bad,CHEERS/Average TO/Good A/Good GREAT/Average GROUP/Good,1.5
80020017,/vol/tensusers8/aparikh/hf_cache/so/speechocean762/WAVE/SPEAKER8002/080020017.WAV,FIRST PLACE IN THE DIVISION,Average,Good,FIRST/Excellent PLACE/Excellent IN/Excellent THE/Excellent DIVISION/Average,FIRST/Good PLACE/Good IN/Good THE/Good DIVISION/Bad,1.5
80020018,/vol/tensusers8/aparikh/hf_cache/so/speechocean762/WAVE/SPEAKER8002/080020018.WAV,MOVE THE STAR WITH MORE MOVES,Bad,Average,MOVE/Bad THE/Excellent STAR/Excellent WITH/Good MORE/Excellent MOVES/Bad,MOVE/Average THE/Good STAR/Good WITH/Excellent MORE/Good MOVES/Good,1.5
80020019,/vol/tensusers8/aparikh/hf_cache/so/speechocean762/WAVE/SPEAKER8002/080020019.WAV,IT'S BEING USED TO MAKE MORE MONEY,Average,Good,IT'S/Bad BEING/Bad USED/Excellent TO/Excellent MAKE/Excellent MORE/Excellent MONEY/Excellent,IT'S/Average BEING/Good USED/Good TO/Good MAKE/Good MORE/Good MONEY/Good,1.5
80020020,/vol/tensusers8/aparikh/hf_cache/so/speechocean762/WAVE/SPEAKER8002/080020020.WAV,IT WAS DIFFICULT TO GET THERE,Average,Good,IT/Excellent WAS/Good DIFFICULT/Excellent TO/Excellent GET/Excellent THERE/Excellent,IT/Good WAS/Average DIFFICULT/Good TO/Good GET/Good THERE/Good,1.5
80570004,/vol/tensusers8/aparikh/hf_cache/so/speechocean762/WAVE/SPEAKER8057/080570004.WAV,YOURS IS A PRETTY BUSINESS,Good,Excellent,YOURS/Excellent IS/Excellent A/Excellent PRETTY/Excellent BUSINESS/Excellent,YOURS/Good IS/Good A/Good PRETTY/Good BUSINESS/Good,1.5
80570009,/vol/tensusers8/aparikh/hf_cache/so/speechocean762/WAVE/SPEAKER8057/080570009.WAV,DO YOU KNOW ANYTHING OF IT,Good,Excellent,DO/Excellent YOU/Excellent KNOW/Good ANYTHING/Excellent OF/Excellent IT/Excellent,DO/Good YOU/Good KNOW/Excellent ANYTHING/Good OF/Good IT/Good,1.5
80570013,/vol/tensusers8/aparikh/hf_cache/so/speechocean762/WAVE/SPEAKER8057/080570013.WAV,BUT SURELY THERE IS DANGER,Good,Excellent,BUT/Excellent SURELY/Excellent THERE/Excellent IS/Excellent DANGER/Excellent,BUT/Good SURELY/Good THERE/Good IS/Good DANGER/Good,1.5
80570014,/vol/tensusers8/aparikh/hf_cache/so/speechocean762/WAVE/SPEAKER8057/080570014.WAV,THEN COMES A BLANK IN THE PAPER,Good,Excellent,THEN/Excellent COMES/Excellent A/Excellent BLANK/Excellent IN/Excellent THE/Excellent PAPER/Excellent,THEN/Good COMES/Good A/Good BLANK/Good IN/Good THE/Good PAPER/Good,1.5
80570031,/vol/tensusers8/aparikh/hf_cache/so/speechocean762/WAVE/SPEAKER8057/080570031.WAV,IT SEEMED ALL THAT HE COULD DO TO SPEAK,Good,Average,IT/Excellent SEEMED/Excellent ALL/Excellent THAT/Excellent HE/Excellent COULD/Excellent DO/Excellent TO/Excellent SPEAK/Excellent,IT/Good SEEMED/Good ALL/Good THAT/Good HE/Good COULD/Good DO/Good TO/Good SPEAK/Good,1.5
80570053,/vol/tensusers8/aparikh/hf_cache/so/speechocean762/WAVE/SPEAKER8057/080570053.WAV,RUNNING BY ME BEATING MY ME,Excellent,Good,RUNNING/Excellent BY/Excellent ME/Excellent BEATING/Excellent MY/Excellent ME/Excellent,RUNNING/Good BY/Good ME/Good BEATING/Good MY/Good ME/Good,1.5
80570067,/vol/tensusers8/aparikh/hf_cache/so/speechocean762/WAVE/SPEAKER8057/080570067.WAV,HOW SHALL I DESCRIBE WHAT WE SAW,Good,Average,HOW/Excellent SHALL/Excellent I/Excellent DESCRIBE/Excellent WHAT/Excellent WE/Excellent SAW/Excellent,HOW/Good SHALL/Good I/Good DESCRIBE/Good WHAT/Good WE/Good SAW/Good,1.5
80570071,/vol/tensusers8/aparikh/hf_cache/so/speechocean762/WAVE/SPEAKER8057/080570071.WAV,AT LEAST I SHALL BE WITH MY OWN PEOPLE,Good,Average,AT/Excellent LEAST/Excellent I/Excellent SHALL/Excellent BE/Excellent WITH/Excellent MY/Excellent OWN/Excellent PEOPLE/Excellent,AT/Good LEAST/Good I/Good SHALL/Good BE/Good WITH/Good MY/Good OWN/Good PEOPLE/Good,1.5
80570072,/vol/tensusers8/aparikh/hf_cache/so/speechocean762/WAVE/SPEAKER8057/080570072.WAV,DRESS THEM IN BLACK AND PLACE THEM OUTSIDE MY TENT,Good,Excellent,DRESS/Excellent THEM/Excellent IN/Excellent BLACK/Excellent AND/Excellent PLACE/Excellent THEM/Excellent OUTSIDE/Excellent MY/Excellent TENT/Excellent,DRESS/Good THEM/Good IN/Good BLACK/Good AND/Good PLACE/Good THEM/Good OUTSIDE/Good MY/Good TENT/Good,1.5
80570080,/vol/tensusers8/aparikh/hf_cache/so/speechocean762/WAVE/SPEAKER8057/080570080.WAV,IF PEOPLE LAUGHED AT HER SHE LAUGHED WITH THEM,Good,Excellent,IF/Excellent PEOPLE/Excellent LAUGHED/Excellent AT/Excellent HER/Excellent SHE/Excellent LAUGHED/Excellent WITH/Excellent THEM/Excellent,IF/Good PEOPLE/Good LAUGHED/Good AT/Good HER/Good SHE/Good LAUGHED/Good WITH/Good THEM/Good,1.5
