id,audio_path,transcript,sentence_chosen,sentence_rejected,chosen,rejected,dpo_weight
10011,/vol/tensusers8/aparikh/hf_cache/so/speechocean762/WAVE/SPEAKER0001/000010011.WAV,WE CALL IT BEAR,Good,Excellent,WE/Excellent CALL/Excellent IT/Excellent BEAR/Average,WE/Good CALL/Good IT/Good BEAR/Good,1.5
10035,/vol/tensusers8/aparikh/hf_cache/so/speechocean762/WAVE/SPEAKER0001/000010035.WAV,ZERO THREE FIVE ONE,Good,Average,ZERO/Good THREE/Good FIVE/Excellent ONE/Excellent,ZERO/Average THREE/Excellent FIVE/Good ONE/Good,1.5
10053,/vol/tensusers8/aparikh/hf_cache/so/speechocean762/WAVE/SPEAKER0001/000010053.WAV,THREE TWO TWO SEVEN,Excellent,Good,THREE/Excellent TWO/Excellent TWO/Excellent SEVEN/Excellent,THREE/Good TWO/Good TWO/Good SEVEN/Good,1.5
10063,/vol/tensusers8/aparikh/hf_cache/so/speechocean762/WAVE/SPEAKER0001/000010063.WAV,ELEPHANTS TAI GOOSE,Excellent,Good,ELEPHANTS/Excellent TAI/Excellent GOOSE/Excellent,ELEPHANTS/Good TAI/Good GOOSE/Good,1.5
10069,/vol/tensusers8/aparikh/hf_cache/so/speechocean762/WAVE/SPEAKER0001/000010069.WAV,TOM GIVES UP BOXING,Excellent,Good,TOM/Excellent GIVES/Excellent UP/Excellent BOXING/Excellent,TOM/Good GIVES/Good UP/Good BOXING/Good,1.5
10075,/vol/tensusers8/aparikh/hf_cache/so/speechocean762/WAVE/SPEAKER0001/000010075.WAV,HE HATES SHOOTING,Excellent,Good,HE/Excellent HATES/Excellent SHOOTING/Excellent,HE/Good HATES/Good SHOOTING/Good,1.5
10089,/vol/tensusers8/aparikh/hf_cache/so/speechocean762/WAVE/SPEAKER0001/000010089.WAV,MANDY HAS A BIG ARM,Excellent,Good,MANDY/Excellent HAS/Excellent A/Excellent BIG/Excellent ARM/Excellent,MANDY/Good HAS/Good A/Good BIG/Good ARM/Good,1.5
10095,/vol/tensusers8/aparikh/hf_cache/so/speechocean762/WAVE/SPEAKER0001/000010095.WAV,LOOK AT ANN'S PANTS,Excellent,Good,LOOK/Excellent AT/Excellent ANN'S/Good PANTS/Excellent,LOOK/Good AT/Good ANN'S/Excellent PANTS/Good,1.5
10106,/vol/tensusers8/aparikh/hf_cache/so/speechocean762/WAVE/SPEAKER0001/000010106.WAV,WHAT ABOUT THE BUS,Excellent,Good,WHAT/Excellent ABOUT/Excellent THE/Excellent BUS/Excellent,WHAT/Good ABOUT/Good THE/Good BUS/Good,1.5
10113,/vol/tensusers8/aparikh/hf_cache/so/speechocean762/WAVE/SPEAKER0001/000010113.WAV,THEN HE WENT TO THEME PARK,Average,Good,THEN/Excellent HE/Good WENT/Excellent TO/Excellent THEME/Bad PARK/Excellent,THEN/Good HE/Excellent WENT/Good TO/Good THEME/Good PARK/Good,1.5
10115,/vol/tensusers8/aparikh/hf_cache/so/speechocean762/WAVE/SPEAKER0001/000010115.WAV,LET'S GO TO THE RESTROOM,Excellent,Good,LET'S/Excellent GO/Excellent TO/Excellent THE/Excellent RESTROOM/Excellent,LET'S/Good GO/Good TO/Good THE/Good RESTROOM/Good,1.5
10121,/vol/tensusers8/aparikh/hf_cache/so/speechocean762/WAVE/SPEAKER0001/000010121.WAV,THEN MIKE WALKS TO COFFEE,Excellent,Good,THEN/Excellent MIKE/Excellent WALKS/Excellent TO/Excellent COFFEE/Excellent,THEN/Good MIKE/Good WALKS/Good TO/Good COFFEE/Good,1.5
10122,/vol/tensusers8/aparikh/hf_cache/so/speechocean762/WAVE/SPEAKER0001/000010122.WAV,SO MARY WENT ON TO STUDY,Excellent,Good,SO/Excellent MARY/Excellent WENT/Excellent ON/Excellent TO/Excellent STUDY/Excellent,SO/Good MARY/Good WENT/Good ON/Good TO/Good STUDY/Good,1.5
10133,/vol/tensusers8/aparikh/hf_cache/so/speechocean762/WAVE/SPEAKER0001/000010133.WAV,KATE GOT THE TOMATO,Good,Excellent,KATE/Good GOT/Excellent THE/Excellent TOMATO/Good,KATE/Excellent GOT/Good THE/Good TOMATO/Excellent,1.5
10135,/vol/tensusers8/aparikh/hf_cache/so/speechocean762/WAVE/SPEAKER0001/000010135.WAV,TINA LOVES EGGPLANT,Good,Excellent,TINA/Excellent LOVES/Excellent EGGPLANT/Excellent,TINA/Good LOVES/Good EGGPLANT/Good,1.5
10140,/vol/tensusers8/aparikh/hf_cache/so/speechocean762/WAVE/SPEAKER0001/000010140.WAV,DORA IS NOT A CLEANER,Good,Average,DORA/Excellent IS/Excellent NOT/Excellent A/Excellent CLEANER/Excellent,DORA/Good IS/Good NOT/Good A/Good CLEANER/Good,1.5
10145,/vol/tensusers8/aparikh/hf_cache/so/speechocean762/WAVE/SPEAKER0001/000010145.WAV,MARK LIVED IN NEW YORK,Excellent,Good,MARK/Excellent LIVED/Excellent IN/Excellent NEW/Excellent YORK/Excellent,MARK/Good LIVED/Good IN/Good NEW/Good YORK/Good,1.5
10149,/vol/tensusers8/aparikh/hf_cache/so/speechocean762/WAVE/SPEAKER0001/000010149.WAV,BOB LIVES IN CAIRO NOW,Good,Excellent,BOB/Excellent LIVES/Excellent IN/Excellent CAIRO/Good NOW/Excellent,BOB/Good LIVES/Good IN/Good CAIRO/Average NOW/Good,1.5
10168,/vol/tensusers8/aparikh/hf_cache/so/speechocean762/WAVE/SPEAKER0001/000010168.WAV,BYE,Excellent,Good,BYE/Excellent,BYE/Good,1.5
10173,/vol/tensusers8/aparikh/hf_cache/so/speechocean762/WAVE/SPEAKER0001/000010173.WAV,TREES,Excellent,Good,TREES/Good,TREES/Excellent,1.5
50003,/vol/tensusers8/aparikh/hf_cache/so/speechocean762/WAVE/SPEAKER0005/000050003.WAV,MIKE LIKES THE WHITE ONE,Good,Excellent,MIKE/Excellent LIKES/Excellent THE/Excellent WHITE/Excellent ONE/Excellent,MIKE/Good LIKES/Good THE/Good WHITE/Good ONE/Good,1.5
50010,/vol/tensusers8/aparikh/hf_cache/so/speechocean762/WAVE/SPEAKER0005/000050010.WAV,ITS NAME IS SAY,Good,Excellent,ITS/Excellent NAME/Excellent IS/Good SAY/Excellent,ITS/Good NAME/Good IS/Average SAY/Good,1.5
50024,/vol/tensusers8/aparikh/hf_cache/so/speechocean762/WAVE/SPEAKER0005/000050024.WAV,BILLY LOVES AMERICA,Good,Average,BILLY/Excellent LOVES/Good AMERICA/Excellent,BILLY/Good LOVES/Average AMERICA/Good,1.5
50028,/vol/tensusers8/aparikh/hf_cache/so/speechocean762/WAVE/SPEAKER0005/000050028.WAV,TWO TWO EIGHT SEVEN,Good,Excellent,TWO/Excellent TWO/Excellent EIGHT/Excellent SEVEN/Excellent,TWO/Good TWO/Good EIGHT/Good SEVEN/Good,1.5
50038,/vol/tensusers8/aparikh/hf_cache/so/speechocean762/WAVE/SPEAKER0005/000050038.WAV,FOUR FIVE FOUR SEVEN,Good,Excellent,FOUR/Excellent FIVE/Excellent FOUR/Excellent SEVEN/Excellent,FOUR/Good FIVE/Good FOUR/Good SEVEN/Good,1.5
50040,/vol/tensusers8/aparikh/hf_cache/so/speechocean762/WAVE/SPEAKER0005/000050040.WAV,FIVE THREE NINE ZERO,Good,Excellent,FIVE/Excellent THREE/Good NINE/Excellent ZERO/Excellent,FIVE/Good THREE/Excellent NINE/Good ZERO/Good,1.5
50047,/vol/tensusers8/aparikh/hf_cache/so/speechocean762/WAVE/SPEAKER0005/000050047.WAV,SIX FIVE THREE,Good,Average,SIX/Excellent FIVE/Excellent THREE/Excellent,SIX/Good FIVE/Good THREE/Good,1.5
50049,/vol/tensusers8/aparikh/hf_cache/so/speechocean762/WAVE/SPEAKER0005/000050049.WAV,TWO FIVE EIGHT,Good,Average,TWO/Excellent FIVE/Good EIGHT/Excellent,TWO/Good FIVE/Average EIGHT/Good,1.5
50055,/vol/tensusers8/aparikh/hf_cache/so/speechocean762/WAVE/SPEAKER0005/000050055.WAV,WE LESS MEAT,Excellent,Good,WE/Excellent LESS/Excellent MEAT/Excellent,WE/Good LESS/Good MEAT/Good,1.5
50078,/vol/tensusers8/aparikh/hf_cache/so/speechocean762/WAVE/SPEAKER0005/000050078.WAV,DOSE MIKE LIKE THE HAMBURGER,Good,Excellent,DOSE/Excellent MIKE/Excellent LIKE/Excellent THE/Excellent HAMBURGER/Excellent,DOSE/Good MIKE/Good LIKE/Good THE/Good HAMBURGER/Good,1.5
50079,/vol/tensusers8/aparikh/hf_cache/so/speechocean762/WAVE/SPEAKER0005/000050079.WAV,ANNIE WANT HAVE SOME PRETTIES,Good,Average,ANNIE/Excellent WANT/Excellent HAVE/Excellent SOME/Excellent PRETTIES/Excellent,ANNIE/Good WANT/Good HAVE/Good SOME/Good PRETTIES/Good,1.5
50083,/vol/tensusers8/aparikh/hf_cache/so/speechocean762/WAVE/SPEAKER0005/000050083.WAV,KATE'S GOT SOME GREY,Average,Good,KATE'S/Good GOT/Excellent SOME/Excellent GREY/Worst,KATE'S/Average GOT/Good SOME/Good GREY/Bad,1.5
50095,/vol/tensusers8/aparikh/hf_cache/so/speechocean762/WAVE/SPEAKER0005/000050095.WAV,LOOK AT JOHN'S SWEATER,Good,Excellent,LOOK/Excellent AT/Excellent JOHN'S/Average SWEATER/Excellent,LOOK/Good AT/Good JOHN'S/Good SWEATER/Good,1.5
50099,/vol/tensusers8/aparikh/hf_cache/so/speechocean762/WAVE/SPEAKER0005/000050099.WAV,TIM HAS A BEAUTIFUL TELL,Good,Average,TIM/Excellent HAS/Excellent A/Excellent BEAUTIFUL/Excellent TELL/Bad,TIM/Good HAS/Good A/Good BEAUTIFUL/Good TELL/Average,1.5
50100,/vol/tensusers8/aparikh/hf_cache/so/speechocean762/WAVE/SPEAKER0005/000050100.WAV,JIM LIKES YOUR BLUE SHORE,Good,Excellent,JIM/Excellent LIKES/Excellent YOUR/Excellent BLUE/Excellent SHORE/Excellent,JIM/Good LIKES/Good YOUR/Good BLUE/Good SHORE/Good,1.5
50114,/vol/tensusers8/aparikh/hf_cache/so/speechocean762/WAVE/SPEAKER0005/000050114.WAV,ANNIE WENT WALKING THEM PARK,Good,Excellent,ANNIE/Excellent WENT/Excellent WALKING/Excellent THEM/Excellent PARK/Excellent,ANNIE/Good WENT/Good WALKING/Good THEM/Good PARK/Good,1.5
50118,/vol/tensusers8/aparikh/hf_cache/so/speechocean762/WAVE/SPEAKER0005/000050118.WAV,LAYLA CAN SEE THE HOMETOWN,Average,Bad,LAYLA/Excellent CAN/Excellent SEE/Excellent THE/Excellent HOMETOWN/Bad,LAYLA/Good CAN/Good SEE/Good THE/Good HOMETOWN/Good,1.5
50122,/vol/tensusers8/aparikh/hf_cache/so/speechocean762/WAVE/SPEAKER0005/000050122.WAV,SO TINA WENT ON TO WASHROOM,Average,Bad,SO/Excellent TINA/Excellent WENT/Bad ON/Excellent TO/Excellent WASHROOM/Excellent,SO/Good TINA/Good WENT/Good ON/Good TO/Good WASHROOM/Good,1.5
50174,/vol/tensusers8/aparikh/hf_cache/so/speechocean762/WAVE/SPEAKER0005/000050174.WAV,ALL WITH HIM,Good,Average,ALL/Excellent WITH/Excellent HIM/Excellent,ALL/Good WITH/Good HIM/Good,1.5
50175,/vol/tensusers8/aparikh/hf_cache/so/speechocean762/WAVE/SPEAKER0005/000050175.WAV,GOOD JOB,Excellent,Good,GOOD/Excellent JOB/Excellent,GOOD/Good JOB/Good,1.5
60015,/vol/tensusers8/aparikh/hf_cache/so/speechocean762/WAVE/SPEAKER0006/000060015.WAV,JAYME IS GOING TO SEE HEN,Excellent,Good,JAYME/Excellent IS/Excellent GOING/Excellent TO/Excellent SEE/Excellent HEN/Excellent,JAYME/Good IS/Good GOING/Good TO/Good SEE/Good HEN/Good,1.5
60020,/vol/tensusers8/aparikh/hf_cache/so/speechocean762/WAVE/SPEAKER0006/000060020.WAV,DORA IS COME FROM JAPAN,Excellent,Good,DORA/Excellent IS/Excellent COME/Excellent FROM/Excellent JAPAN/Excellent,DORA/Good IS/Good COME/Good FROM/Good JAPAN/Good,1.5
60029,/vol/tensusers8/aparikh/hf_cache/so/speechocean762/WAVE/SPEAKER0006/000060029.WAV,SIX ONE SIX ZERO,Excellent,Good,SIX/Excellent ONE/Excellent SIX/Excellent ZERO/Excellent,SIX/Good ONE/Good SIX/Good ZERO/Good,1.5
60031,/vol/tensusers8/aparikh/hf_cache/so/speechocean762/WAVE/SPEAKER0006/000060031.WAV,FIVE TWO FOUR SEVEN,Excellent,Good,FIVE/Excellent TWO/Excellent FOUR/Excellent SEVEN/Excellent,FIVE/Good TWO/Good FOUR/Good SEVEN/Good,1.5
60049,/vol/tensusers8/aparikh/hf_cache/so/speechocean762/WAVE/SPEAKER0006/000060049.WAV,ZERO THREE FIVE,Good,Average,ZERO/Excellent THREE/Excellent FIVE/Excellent,ZERO/Good THREE/Good FIVE/Good,1.5
60056,/vol/tensusers8/aparikh/hf_cache/so/speechocean762/WAVE/SPEAKER0006/000060056.WAV,PHONE PARTS TICKETS,Excellent,Good,PHONE/Excellent PARTS/Excellent TICKETS/Excellent,PHONE/Good PARTS/Good TICKETS/Good,1.5
60077,/vol/tensusers8/aparikh/hf_cache/so/speechocean762/WAVE/SPEAKER0006/000060077.WAV,ANN ATE A LITTLE DOG,Excellent,Good,ANN/Excellent ATE/Excellent A/Excellent LITTLE/Excellent DOG/Excellent,ANN/Good ATE/Good A/Good LITTLE/Good DOG/Good,1.5
60081,/vol/tensusers8/aparikh/hf_cache/so/speechocean762/WAVE/SPEAKER0006/000060081.WAV,DOES LAYLA LIKE THE JAM,Excellent,Good,DOES/Excellent LAYLA/Excellent LIKE/Excellent THE/Excellent JAM/Excellent,DOES/Good LAYLA/Good LIKE/Good THE/Good JAM/Good,1.5
60082,/vol/tensusers8/aparikh/hf_cache/so/speechocean762/WAVE/SPEAKER0006/000060082.WAV,KATE LIKES LAMB,Excellent,Good,KATE/Excellent LIKES/Excellent LAMB/Excellent,KATE/Good LIKES/Good LAMB/Good,1.5
60083,/vol/tensusers8/aparikh/hf_cache/so/speechocean762/WAVE/SPEAKER0006/000060083.WAV,MARK GOT SOME NOODLES,Excellent,Good,MARK/Excellent GOT/Excellent SOME/Excellent NOODLES/Excellent,MARK/Good GOT/Good SOME/Good NOODLES/Good,1.5
60094,/vol/tensusers8/aparikh/hf_cache/so/speechocean762/WAVE/SPEAKER0006/000060094.WAV,TOM LIKES THE OLD SWEATER,Excellent,Good,TOM/Excellent LIKES/Excellent THE/Excellent OLD/Excellent SWEATER/Excellent,TOM/Good LIKES/Good THE/Good OLD/Good SWEATER/Good,1.5
60102,/vol/tensusers8/aparikh/hf_cache/so/speechocean762/WAVE/SPEAKER0006/000060102.WAV,BOB NEEDS NEW BOOTS,Excellent,Good,BOB/Excellent NEEDS/Excellent NEW/Excellent BOOTS/Excellent,BOB/Good NEEDS/Good NEW/Good BOOTS/Good,1.5
60106,/vol/tensusers8/aparikh/hf_cache/so/speechocean762/WAVE/SPEAKER0006/000060106.WAV,TOM CAN SEE THE MOTOR CYCLE,Excellent,Good,TOM/Excellent CAN/Excellent SEE/Excellent THE/Excellent MOTOR/Excellent CYCLE/Excellent,TOM/Good CAN/Good SEE/Good THE/Good MOTOR/Good CYCLE/Good,1.5
60111,/vol/tensusers8/aparikh/hf_cache/so/speechocean762/WAVE/SPEAKER0006/000060111.WAV,HE LEFT THE FRUIT STAND,Excellent,Good,HE/Excellent LEFT/Excellent THE/Excellent FRUIT/Excellent STAND/Excellent,HE/Good LEFT/Good THE/Good FRUIT/Good STAND/Good,1.5
60113,/vol/tensusers8/aparikh/hf_cache/so/speechocean762/WAVE/SPEAKER0006/000060113.WAV,LET'S GO TO THE GYM,Excellent,Good,LET'S/Excellent GO/Excellent TO/Excellent THE/Excellent GYM/Excellent,LET'S/Good GO/Good TO/Good THE/Good GYM/Good,1.5
60116,/vol/tensusers8/aparikh/hf_cache/so/speechocean762/WAVE/SPEAKER0006/000060116.WAV,SO MARK WHEN TO THE PET SHOP,Excellent,Good,SO/Excellent MARK/Excellent WHEN/Excellent TO/Excellent THE/Excellent PET/Excellent SHOP/Excellent,SO/Good MARK/Good WHEN/Good TO/Good THE/Good PET/Good SHOP/Good,1.5
60124,/vol/tensusers8/aparikh/hf_cache/so/speechocean762/WAVE/SPEAKER0006/000060124.WAV,SO ALICE WENT ON TO VILLAGE,Excellent,Good,SO/Excellent ALICE/Excellent WENT/Excellent ON/Excellent TO/Excellent VILLAGE/Excellent,SO/Good ALICE/Good WENT/Good ON/Good TO/Good VILLAGE/Good,1.5
60130,/vol/tensusers8/aparikh/hf_cache/so/speechocean762/WAVE/SPEAKER0006/000060130.WAV,NO THAT'S TOMATO,Excellent,Good,NO/Excellent THAT'S/Excellent TOMATO/Excellent,NO/Good THAT'S/Good TOMATO/Good,1.5
60136,/vol/tensusers8/aparikh/hf_cache/so/speechocean762/WAVE/SPEAKER0006/000060136.WAV,I'M NOT A ACTOR,Excellent,Good,I'M/Excellent NOT/Excellent A/Excellent ACTOR/Excellent,I'M/Good NOT/Good A/Good ACTOR/Good,1.5
60153,/vol/tensusers8/aparikh/hf_cache/so/speechocean762/WAVE/SPEAKER0006/000060153.WAV,WHAT LOVELY CLEAN TEETH,Excellent,Good,WHAT/Excellent LOVELY/Excellent CLEAN/Excellent TEETH/Excellent,WHAT/Good LOVELY/Good CLEAN/Good TEETH/Good,1.5
260001,/vol/tensusers8/aparikh/hf_cache/so/speechocean762/WAVE/SPEAKER0026/000260001.WAV,LAYLA LOVE BROWN,Average,Good,LAYLA/Average LOVE/Good BROWN/Excellent,LAYLA/Good LOVE/Average BROWN/Good,1.5
260011,/vol/tensusers8/aparikh/hf_cache/so/speechocean762/WAVE/SPEAKER0026/000260011.WAV,ANDY CAN SEE THE HEN,Good,Excellent,ANDY/Excellent CAN/Excellent SEE/Excellent THE/Excellent HEN/Excellent,ANDY/Good CAN/Good SEE/Good THE/Good HEN/Good,1.5
260015,/vol/tensusers8/aparikh/hf_cache/so/speechocean762/WAVE/SPEAKER0026/000260015.WAV,JOHN IS GOING TO SEE COW,Excellent,Good,JOHN/Excellent IS/Excellent GOING/Excellent TO/Excellent SEE/Excellent COW/Excellent,JOHN/Good IS/Good GOING/Good TO/Good SEE/Good COW/Good,1.5
260032,/vol/tensusers8/aparikh/hf_cache/so/speechocean762/WAVE/SPEAKER0026/000260032.WAV,ONE ONE ZERO EIGHT,Good,Average,ONE/Good ONE/Good ZERO/Excellent EIGHT/Excellent,ONE/Excellent ONE/Average ZERO/Good EIGHT/Good,1.5
260033,/vol/tensusers8/aparikh/hf_cache/so/speechocean762/WAVE/SPEAKER0026/000260033.WAV,THREE ONE SEVEN NINE,Excellent,Good,THREE/Excellent ONE/Good SEVEN/Excellent NINE/Excellent,THREE/Good ONE/Average SEVEN/Good NINE/Good,1.5
260039,/vol/tensusers8/aparikh/hf_cache/so/speechocean762/WAVE/SPEAKER0026/000260039.WAV,EIGHT ZERO SIX TWO,Excellent,Good,EIGHT/Excellent ZERO/Excellent SIX/Excellent TWO/Excellent,EIGHT/Good ZERO/Good SIX/Good TWO/Good,1.5
260048,/vol/tensusers8/aparikh/hf_cache/so/speechocean762/WAVE/SPEAKER0026/000260048.WAV,THREE ZERO EIGHT SEVEN,Excellent,Good,THREE/Excellent ZERO/Excellent EIGHT/Excellent SEVEN/Excellent,THREE/Good ZERO/Good EIGHT/Good SEVEN/Good,1.5
260050,/vol/tensusers8/aparikh/hf_cache/so/speechocean762/WAVE/SPEAKER0026/000260050.WAV,ZERO EIGHT THREE ONE,Excellent,Good,ZERO/Excellent EIGHT/Excellent THREE/Excellent ONE/Excellent,ZERO/Good EIGHT/Good THREE/Good ONE/Good,1.5
260052,/vol/tensusers8/aparikh/hf_cache/so/speechocean762/WAVE/SPEAKER0026/000260052.WAV,SIX EIGHT SIX SEVEN,Excellent,Good,SIX/Excellent EIGHT/Excellent SIX/Excellent SEVEN/Excellent,SIX/Good EIGHT/Good SIX/Good SEVEN/Good,1.5
260069,/vol/tensusers8/aparikh/hf_cache/so/speechocean762/WAVE/SPEAKER0026/000260069.WAV,TEDDY GIVES UP SHOOTING,Good,Average,TEDDY/Average GIVES/Excellent UP/Excellent SHOOTING/Excellent,TEDDY/Bad GIVES/Good UP/Good SHOOTING/Good,1.5
260075,/vol/tensusers8/aparikh/hf_cache/so/speechocean762/WAVE/SPEAKER0026/000260075.WAV,HE LIKES RACING,Excellent,Good,HE/Excellent LIKES/Excellent RACING/Excellent,HE/Good LIKES/Good RACING/Good,1.5
260091,/vol/tensusers8/aparikh/hf_cache/so/speechocean762/WAVE/SPEAKER0026/000260091.WAV,DORA LIKES YOUR RED JEANS,Good,Average,DORA/Excellent LIKES/Excellent YOUR/Excellent RED/Excellent JEANS/Excellent,DORA/Good LIKES/Good YOUR/Good RED/Good JEANS/Good,1.5
260095,/vol/tensusers8/aparikh/hf_cache/so/speechocean762/WAVE/SPEAKER0026/000260095.WAV,BOB LOVES THE NEW CLOTH,Good,Excellent,BOB/Excellent LOVES/Excellent THE/Excellent NEW/Excellent CLOTH/Good,BOB/Good LOVES/Good THE/Good NEW/Good CLOTH/Average,1.5
260096,/vol/tensusers8/aparikh/hf_cache/so/speechocean762/WAVE/SPEAKER0026/000260096.WAV,JOHN NEEDS NEW T SHIRT,Excellent,Good,JOHN/Excellent NEEDS/Excellent NEW/Excellent T/Excellent SHIRT/Excellent,JOHN/Good NEEDS/Good NEW/Good T/Good SHIRT/Good,1.5
260112,/vol/tensusers8/aparikh/hf_cache/so/speechocean762/WAVE/SPEAKER0026/000260112.WAV,THEN LILLY WALKS TO MUSIC ROOM,Excellent,Good,THEN/Excellent LILLY/Excellent WALKS/Excellent TO/Excellent MUSIC/Excellent ROOM/Excellent,THEN/Good LILLY/Good WALKS/Good TO/Good MUSIC/Good ROOM/Good,1.5
260115,/vol/tensusers8/aparikh/hf_cache/so/speechocean762/WAVE/SPEAKER0026/000260115.WAV,THEN TIM WALKS TO THEM PARK,Excellent,Good,THEN/Excellent TIM/Excellent WALKS/Excellent TO/Excellent THEM/Excellent PARK/Excellent,THEN/Good TIM/Good WALKS/Good TO/Good THEM/Good PARK/Good,1.5
260121,/vol/tensusers8/aparikh/hf_cache/so/speechocean762/WAVE/SPEAKER0026/000260121.WAV,THEN MANDY WALKS TO RESTROOM,Excellent,Good,THEN/Excellent MANDY/Excellent WALKS/Excellent TO/Excellent RESTROOM/Excellent,THEN/Good MANDY/Good WALKS/Good TO/Good RESTROOM/Good,1.5
260126,/vol/tensusers8/aparikh/hf_cache/so/speechocean762/WAVE/SPEAKER0026/000260126.WAV,DO YOU WANT THE PEA,Excellent,Good,DO/Excellent YOU/Excellent WANT/Excellent THE/Excellent PEA/Excellent,DO/Good YOU/Good WANT/Good THE/Good PEA/Good,1.5
260133,/vol/tensusers8/aparikh/hf_cache/so/speechocean762/WAVE/SPEAKER0026/000260133.WAV,ANDY GOT THE MUSHROOM,Excellent,Good,ANDY/Excellent GOT/Excellent THE/Excellent MUSHROOM/Excellent,ANDY/Good GOT/Good THE/Good MUSHROOM/Good,1.5
260166,/vol/tensusers8/aparikh/hf_cache/so/speechocean762/WAVE/SPEAKER0026/000260166.WAV,NOW FOR THE PARTY,Excellent,Good,NOW/Excellent FOR/Excellent THE/Excellent PARTY/Excellent,NOW/Good FOR/Good THE/Good PARTY/Good,1.5
360013,/vol/tensusers8/aparikh/hf_cache/so/speechocean762/WAVE/SPEAKER0036/000360013.WAV,IT'S JUST SO HARD TO PICTURE,Excellent,Good,IT'S/Excellent JUST/Excellent SO/Excellent HARD/Excellent TO/Excellent PICTURE/Excellent,IT'S/Good JUST/Good SO/Good HARD/Good TO/Good PICTURE/Good,1.5
360034,/vol/tensusers8/aparikh/hf_cache/so/speechocean762/WAVE/SPEAKER0036/000360034.WAV,WE SPEAK OUT WHEN WE FEEL WE SHOULD SPEAK OUT,Excellent,Good,WE/Excellent SPEAK/Excellent OUT/Excellent WHEN/Excellent WE/Excellent FEEL/Excellent WE/Excellent SHOULD/Excellent SPEAK/Excellent OUT/Excellent,WE/Good SPEAK/Good OUT/Good WHEN/Good WE/Good FEEL/Good WE/Good SHOULD/Good SPEAK/Good OUT/Good,1.5
360036,/vol/tensusers8/aparikh/hf_cache/so/speechocean762/WAVE/SPEAKER0036/000360036.WAV,I COULD DO WITH A BREAK,Excellent,Good,I/Excellent COULD/Excellent DO/Excellent WITH/Excellent A/Excellent BREAK/Excellent,I/Good COULD/Good DO/Good WITH/Good A/Good BREAK/Good,1.5
360132,/vol/tensusers8/aparikh/hf_cache/so/speechocean762/WAVE/SPEAKER0036/000360132.WAV,IT IS ALWAYS SO NICE TO SEE YOU,Excellent,Good,IT/Excellent IS/Excellent ALWAYS/Excellent SO/Excellent NICE/Excellent TO/Excellent SEE/Excellent YOU/Excellent,IT/Good IS/Good ALWAYS/Good SO/Good NICE/Good TO/Good SEE/Good YOU/Good,1.5
360133,/vol/tensusers8/aparikh/hf_cache/so/speechocean762/WAVE/SPEAKER0036/000360133.WAV,UNFORTUNATELY NO ONE IS ALLOW TO SAY,Good,Average,UNFORTUNATELY/Excellent NO/Excellent ONE/Excellent IS/Excellent ALLOW/Excellent TO/Excellent SAY/Excellent,UNFORTUNATELY/Good NO/Good ONE/Good IS/Good ALLOW/Good TO/Good SAY/Good,1.5
360161,/vol/tensusers8/aparikh/hf_cache/so/speechocean762/WAVE/SPEAKER0036/000360161.WAV,ALMOST TIME FOR A HAIRCUT,Good,Excellent,ALMOST/Excellent TIME/Excellent FOR/Excellent A/Excellent HAIRCUT/Excellent,ALMOST/Good TIME/Good FOR/Good A/Good HAIRCUT/Good,1.5
360190,/vol/tensusers8/aparikh/hf_cache/so/speechocean762/WAVE/SPEAKER0036/000360190.WAV,SO YOU WANT TO BE MORE PRODUCTIVE,Excellent,Good,SO/Excellent YOU/Excellent WANT/Excellent TO/Excellent BE/Excellent MORE/Excellent PRODUCTIVE/Excellent,SO/Good YOU/Good WANT/Good TO/Good BE/Good MORE/Good PRODUCTIVE/Good,1.5
360210,/vol/tensusers8/aparikh/hf_cache/so/speechocean762/WAVE/SPEAKER0036/000360210.WAV,STARTING CAN NOT BE BETTER THAN THIS,Excellent,Good,STARTING/Excellent CAN/Excellent NOT/Excellent BE/Excellent BETTER/Excellent THAN/Excellent THIS/Excellent,STARTING/Good CAN/Good NOT/Good BE/Good BETTER/Good THAN/Good THIS/Good,1.5
360223,/vol/tensusers8/aparikh/hf_cache/so/speechocean762/WAVE/SPEAKER0036/000360223.WAV,I KEEP IT TO BE AMUSED BY THE STUPIDITY,Good,Excellent,I/Excellent KEEP/Excellent IT/Excellent TO/Excellent BE/Excellent AMUSED/Average BY/Excellent THE/Excellent STUPIDITY/Excellent,I/Good KEEP/Good IT/Good TO/Good BE/Good AMUSED/Good BY/Good THE/Good STUPIDITY/Good,1.5
360241,/vol/tensusers8/aparikh/hf_cache/so/speechocean762/WAVE/SPEAKER0036/000360241.WAV,AFTER THAT I BE READY TO GO,Good,Excellent,AFTER/Excellent THAT/Excellent I/Excellent BE/Excellent READY/Excellent TO/Excellent GO/Excellent,AFTER/Good THAT/Good I/Good BE/Good READY/Good TO/Good GO/Good,1.5
360264,/vol/tensusers8/aparikh/hf_cache/so/speechocean762/WAVE/SPEAKER0036/000360264.WAV,I THANK YOU FOR YOUR SYMPATHY BECAUSE IT COUNTS,Good,Excellent,I/Excellent THANK/Excellent YOU/Excellent FOR/Excellent YOUR/Excellent SYMPATHY/Excellent BECAUSE/Excellent IT/Excellent COUNTS/Good,I/Good THANK/Good YOU/Good FOR/Good YOUR/Good SYMPATHY/Good BECAUSE/Good IT/Good COUNTS/Excellent,1.5
360283,/vol/tensusers8/aparikh/hf_cache/so/speechocean762/WAVE/SPEAKER0036/000360283.WAV,OFF THE CHAIN I BET,Good,Excellent,OFF/Excellent THE/Excellent CHAIN/Excellent I/Excellent BET/Good,OFF/Good THE/Good CHAIN/Good I/Good BET/Average,1.5
360313,/vol/tensusers8/aparikh/hf_cache/so/speechocean762/WAVE/SPEAKER0036/000360313.WAV,HE NODDED HIS HEAD AND SMILED,Good,Average,HE/Excellent NODDED/Average HIS/Excellent HEAD/Excellent AND/Excellent SMILED/Excellent,HE/Good NODDED/Bad HIS/Good HEAD/Good AND/Good SMILED/Good,1.5
360314,/vol/tensusers8/aparikh/hf_cache/so/speechocean762/WAVE/SPEAKER0036/000360314.WAV,BUT TELL ME THE TRUTH,Excellent,Good,BUT/Excellent TELL/Excellent ME/Excellent THE/Excellent TRUTH/Excellent,BUT/Good TELL/Good ME/Good THE/Good TRUTH/Good,1.5
360332,/vol/tensusers8/aparikh/hf_cache/so/speechocean762/WAVE/SPEAKER0036/000360332.WAV,THE FIRST QUESTION WAS AN OBVIOUS ONE,Excellent,Good,THE/Excellent FIRST/Excellent QUESTION/Excellent WAS/Good AN/Excellent OBVIOUS/Excellent ONE/Excellent,THE/Good FIRST/Good QUESTION/Good WAS/Excellent AN/Good OBVIOUS/Good ONE/Good,1.5
360334,/vol/tensusers8/aparikh/hf_cache/so/speechocean762/WAVE/SPEAKER0036/000360334.WAV,THE SHOCK WAS TOO MUCH FOR HIM,Excellent,Good,THE/Excellent SHOCK/Excellent WAS/Excellent TOO/Excellent MUCH/Excellent FOR/Excellent HIM/Excellent,THE/Good SHOCK/Good WAS/Good TOO/Good MUCH/Good FOR/Good HIM/Good,1.5
360339,/vol/tensusers8/aparikh/hf_cache/so/speechocean762/WAVE/SPEAKER0036/000360339.WAV,HE KNOWS HE'S ABOUT TO GET INTO FIGHT,Good,Excellent,HE/Excellent KNOWS/Excellent HE'S/Excellent ABOUT/Excellent TO/Excellent GET/Excellent INTO/Excellent FIGHT/Excellent,HE/Good KNOWS/Good HE'S/Good ABOUT/Good TO/Good GET/Good INTO/Good FIGHT/Good,1.5
360343,/vol/tensusers8/aparikh/hf_cache/so/speechocean762/WAVE/SPEAKER0036/000360343.WAV,HE WAS ALWAYS READY TO DO ANYTHING WHATEVER,Excellent,Good,HE/Excellent WAS/Excellent ALWAYS/Excellent READY/Excellent TO/Excellent DO/Excellent ANYTHING/Excellent WHATEVER/Good,HE/Good WAS/Good ALWAYS/Good READY/Good TO/Good DO/Good ANYTHING/Good WHATEVER/Average,1.5
360360,/vol/tensusers8/aparikh/hf_cache/so/speechocean762/WAVE/SPEAKER0036/000360360.WAV,THE LONG AND THE SHORT OF IT IS THIS,Good,Average,THE/Excellent LONG/Excellent AND/Excellent THE/Excellent SHORT/Excellent OF/Average IT/Excellent IS/Excellent THIS/Excellent,THE/Good LONG/Good AND/Good THE/Good SHORT/Good OF/Bad IT/Good IS/Good THIS/Good,1.5
360378,/vol/tensusers8/aparikh/hf_cache/so/speechocean762/WAVE/SPEAKER0036/000360378.WAV,YOU WANT TO BE LOVE,Excellent,Good,YOU/Excellent WANT/Excellent TO/Excellent BE/Excellent LOVE/Excellent,YOU/Good WANT/Good TO/Good BE/Good LOVE/Good,1.5
480010,/vol/tensusers8/aparikh/hf_cache/so/speechocean762/WAVE/SPEAKER0048/000480010.WAV,IT'S NOT FISH,Good,Average,IT'S/Excellent NOT/Excellent FISH/Excellent,IT'S/Good NOT/Good FISH/Good,1.5
480014,/vol/tensusers8/aparikh/hf_cache/so/speechocean762/WAVE/SPEAKER0048/000480014.WAV,JOHN CAN SEE THE SHEEP,Average,Good,JOHN/Excellent CAN/Excellent SEE/Excellent THE/Bad SHEEP/Bad,JOHN/Good CAN/Good SEE/Good THE/Average SHEEP/Good,1.5
480015,/vol/tensusers8/aparikh/hf_cache/so/speechocean762/WAVE/SPEAKER0048/000480015.WAV,LYNDA IS GOING TO SEE ELEPHANT,Good,Excellent,LYNDA/Average IS/Excellent GOING/Excellent TO/Excellent SEE/Excellent ELEPHANT/Excellent,LYNDA/Good IS/Good GOING/Good TO/Good SEE/Good ELEPHANT/Good,1.5
