id,audio_path,transcript,sentence_chosen,sentence_rejected,chosen,rejected,dpo_weight
24300131,/vol/tensusers8/aparikh/hf_cache/so/speechocean762/WAVE/SPEAKER2430/024300131.WAV,I MEAN IT WAS THE LAST SUPPER,Good,Excellent,I/Excellent MEAN/Excellent IT/Excellent WAS/Excellent THE/Excellent LAST/Excellent SUPPER/Average,I/Good MEAN/Good IT/Good WAS/Good THE/Good LAST/Good SUPPER/Good,1.5
24300132,/vol/tensusers8/aparikh/hf_cache/so/speechocean762/WAVE/SPEAKER2430/024300132.WAV,WELL THANKS FOR THE CONSIDERATION,Good,Average,WELL/Excellent THANKS/Excellent FOR/Excellent THE/Excellent CONSIDERATION/Excellent,WELL/Good THANKS/Good FOR/Good THE/Good CONSIDERATION/Good,1.5
24300135,/vol/tensusers8/aparikh/hf_cache/so/speechocean762/WAVE/SPEAKER2430/024300135.WAV,HE ALWAYS KNOWS HOW TO MAKE ME FEEL BETTER,Excellent,Good,HE/Excellent ALWAYS/Excellent KNOWS/Excellent HOW/Excellent TO/Excellent MAKE/Excellent ME/Excellent FEEL/Excellent BETTER/Excellent,HE/Good ALWAYS/Good KNOWS/Good HOW/Good TO/Good MAKE/Good ME/Good FEEL/Good BETTER/Good,1.5
24300189,/vol/tensusers8/aparikh/hf_cache/so/speechocean762/WAVE/SPEAKER2430/024300189.WAV,IT'S WEDNESDAY YOU KNOW THE DRILL,Good,Average,IT'S/Excellent WEDNESDAY/Excellent YOU/Excellent KNOW/Excellent THE/Excellent DRILL/Excellent,IT'S/Good WEDNESDAY/Good YOU/Good KNOW/Good THE/Good DRILL/Good,1.5
24300221,/vol/tensusers8/aparikh/hf_cache/so/speechocean762/WAVE/SPEAKER2430/024300221.WAV,ENOUGH OF THE TIME LOOP,Good,Average,ENOUGH/Excellent OF/Excellent THE/Excellent TIME/Excellent LOOP/Excellent,ENOUGH/Good OF/Good THE/Good TIME/Good LOOP/Good,1.5
24300270,/vol/tensusers8/aparikh/hf_cache/so/speechocean762/WAVE/SPEAKER2430/024300270.WAV,IT IS SUCH A GOOD FIRM,Good,Excellent,IT/Excellent IS/Excellent SUCH/Excellent A/Excellent GOOD/Excellent FIRM/Excellent,IT/Good IS/Good SUCH/Good A/Good GOOD/Good FIRM/Good,1.5
24300330,/vol/tensusers8/aparikh/hf_cache/so/speechocean762/WAVE/SPEAKER2430/024300330.WAV,AT FIRST HE COULD NOT SPEAK,Excellent,Good,AT/Excellent FIRST/Excellent HE/Excellent COULD/Excellent NOT/Excellent SPEAK/Excellent,AT/Good FIRST/Good HE/Good COULD/Good NOT/Good SPEAK/Good,1.5
24300345,/vol/tensusers8/aparikh/hf_cache/so/speechocean762/WAVE/SPEAKER2430/024300345.WAV,AND NOW I GO DOWN TO LOOK AT IT,Excellent,Good,AND/Excellent NOW/Excellent I/Excellent GO/Excellent DOWN/Excellent TO/Excellent LOOK/Excellent AT/Excellent IT/Excellent,AND/Good NOW/Good I/Good GO/Good DOWN/Good TO/Good LOOK/Good AT/Good IT/Good,1.5
24300360,/vol/tensusers8/aparikh/hf_cache/so/speechocean762/WAVE/SPEAKER2430/024300360.WAV,SHE WAS BROAD AT THIS SHOULDERS,Good,Average,SHE/Excellent WAS/Excellent BROAD/Excellent AT/Excellent THIS/Excellent SHOULDERS/Average,SHE/Good WAS/Good BROAD/Good AT/Good THIS/Good SHOULDERS/Good,1.5
24500006,/vol/tensusers8/aparikh/hf_cache/so/speechocean762/WAVE/SPEAKER2450/024500006.WAV,THREE AND FOUR ARE THE BEST,Excellent,Good,THREE/Excellent AND/Excellent FOUR/Excellent ARE/Excellent THE/Excellent BEST/Excellent,THREE/Good AND/Good FOUR/Good ARE/Good THE/Good BEST/Good,1.5
24500021,/vol/tensusers8/aparikh/hf_cache/so/speechocean762/WAVE/SPEAKER2450/024500021.WAV,HE AND HIS PARENTS SAY THEY ARE NO LONGER SPEAKING,Good,Excellent,HE/Excellent AND/Excellent HIS/Excellent PARENTS/Excellent SAY/Excellent THEY/Excellent ARE/Excellent NO/Excellent LONGER/Excellent SPEAKING/Excellent,HE/Good AND/Good HIS/Good PARENTS/Good SAY/Good THEY/Good ARE/Good NO/Good LONGER/Good SPEAKING/Good,1.5
24500033,/vol/tensusers8/aparikh/hf_cache/so/speechocean762/WAVE/SPEAKER2450/024500033.WAV,ENOUGH OF THE TECHNICAL STUFF,Excellent,Good,ENOUGH/Excellent OF/Excellent THE/Excellent TECHNICAL/Excellent STUFF/Excellent,ENOUGH/Good OF/Good THE/Good TECHNICAL/Good STUFF/Good,1.5
24500095,/vol/tensusers8/aparikh/hf_cache/so/speechocean762/WAVE/SPEAKER2450/024500095.WAV,WE ALL KNOW THIS IS A TOUGH RACE TRACK,Good,Average,WE/Excellent ALL/Excellent KNOW/Excellent THIS/Excellent IS/Excellent A/Excellent TOUGH/Excellent RACE/Excellent TRACK/Excellent,WE/Good ALL/Good KNOW/Good THIS/Good IS/Good A/Good TOUGH/Good RACE/Good TRACK/Good,1.5
24500126,/vol/tensusers8/aparikh/hf_cache/so/speechocean762/WAVE/SPEAKER2450/024500126.WAV,YOU MUST HAVE A LOT,Excellent,Good,YOU/Excellent MUST/Excellent HAVE/Excellent A/Excellent LOT/Excellent,YOU/Good MUST/Good HAVE/Good A/Good LOT/Good,1.5
24500139,/vol/tensusers8/aparikh/hf_cache/so/speechocean762/WAVE/SPEAKER2450/024500139.WAV,BUT I KNOW WHAT YOU ARE,Excellent,Good,BUT/Excellent I/Excellent KNOW/Excellent WHAT/Excellent YOU/Excellent ARE/Excellent,BUT/Good I/Good KNOW/Good WHAT/Good YOU/Good ARE/Good,1.5
24500141,/vol/tensusers8/aparikh/hf_cache/so/speechocean762/WAVE/SPEAKER2450/024500141.WAV,THIS WOULD BE A VERY BUSY DAY,Excellent,Good,THIS/Excellent WOULD/Excellent BE/Excellent A/Excellent VERY/Excellent BUSY/Excellent DAY/Excellent,THIS/Good WOULD/Good BE/Good A/Good VERY/Good BUSY/Good DAY/Good,1.5
24500147,/vol/tensusers8/aparikh/hf_cache/so/speechocean762/WAVE/SPEAKER2450/024500147.WAV,I COME FROM A FAMILY OF TEACHERS,Excellent,Good,I/Excellent COME/Excellent FROM/Excellent A/Excellent FAMILY/Excellent OF/Excellent TEACHERS/Excellent,I/Good COME/Good FROM/Good A/Good FAMILY/Good OF/Good TEACHERS/Good,1.5
24500151,/vol/tensusers8/aparikh/hf_cache/so/speechocean762/WAVE/SPEAKER2450/024500151.WAV,SORRY FOR BEING A PLASTIC,Excellent,Good,SORRY/Excellent FOR/Excellent BEING/Excellent A/Excellent PLASTIC/Excellent,SORRY/Good FOR/Good BEING/Good A/Good PLASTIC/Good,1.5
24500156,/vol/tensusers8/aparikh/hf_cache/so/speechocean762/WAVE/SPEAKER2450/024500156.WAV,WHAT DO YOU SAY THE MOST,Excellent,Good,WHAT/Excellent DO/Excellent YOU/Excellent SAY/Excellent THE/Excellent MOST/Excellent,WHAT/Good DO/Good YOU/Good SAY/Good THE/Good MOST/Good,1.5
24500164,/vol/tensusers8/aparikh/hf_cache/so/speechocean762/WAVE/SPEAKER2450/024500164.WAV,WHAT AND HOW DO YOU SING,Excellent,Good,WHAT/Excellent AND/Excellent HOW/Excellent DO/Excellent YOU/Excellent SING/Excellent,WHAT/Good AND/Good HOW/Good DO/Good YOU/Good SING/Good,1.5
24500228,/vol/tensusers8/aparikh/hf_cache/so/speechocean762/WAVE/SPEAKER2450/024500228.WAV,WHERE ARE YOU GOING TO BE READY TO PLAY,Excellent,Good,WHERE/Excellent ARE/Excellent YOU/Excellent GOING/Excellent TO/Excellent BE/Excellent READY/Excellent TO/Excellent PLAY/Excellent,WHERE/Good ARE/Good YOU/Good GOING/Good TO/Good BE/Good READY/Good TO/Good PLAY/Good,1.5
24500250,/vol/tensusers8/aparikh/hf_cache/so/speechocean762/WAVE/SPEAKER2450/024500250.WAV,DO YOU LIKE THE COLOR OF THE SKY,Excellent,Good,DO/Excellent YOU/Excellent LIKE/Excellent THE/Excellent COLOR/Excellent OF/Excellent THE/Excellent SKY/Excellent,DO/Good YOU/Good LIKE/Good THE/Good COLOR/Good OF/Good THE/Good SKY/Good,1.5
24500268,/vol/tensusers8/aparikh/hf_cache/so/speechocean762/WAVE/SPEAKER2450/024500268.WAV,WHY IN THE WORLD AM I NOT IN THE BED,Excellent,Good,WHY/Excellent IN/Excellent THE/Excellent WORLD/Excellent AM/Average I/Excellent NOT/Excellent IN/Excellent THE/Excellent BED/Excellent,WHY/Good IN/Good THE/Good WORLD/Good AM/Good I/Good NOT/Good IN/Good THE/Good BED/Good,1.5
24500284,/vol/tensusers8/aparikh/hf_cache/so/speechocean762/WAVE/SPEAKER2450/024500284.WAV,IT'S SUNDAY NIGHT NOT THE END OF THE WORLD,Good,Average,IT'S/Excellent SUNDAY/Excellent NIGHT/Excellent NOT/Excellent THE/Excellent END/Excellent OF/Excellent THE/Excellent WORLD/Excellent,IT'S/Good SUNDAY/Good NIGHT/Good NOT/Good THE/Good END/Good OF/Good THE/Good WORLD/Good,1.5
24500317,/vol/tensusers8/aparikh/hf_cache/so/speechocean762/WAVE/SPEAKER2450/024500317.WAV,AND IN A SENSE YOU WERE RIGHT,Excellent,Good,AND/Excellent IN/Excellent A/Excellent SENSE/Excellent YOU/Excellent WERE/Excellent RIGHT/Excellent,AND/Good IN/Good A/Good SENSE/Good YOU/Good WERE/Good RIGHT/Good,1.5
24500327,/vol/tensusers8/aparikh/hf_cache/so/speechocean762/WAVE/SPEAKER2450/024500327.WAV,AND IT IS MY OWN HAND,Good,Excellent,AND/Excellent IT/Excellent IS/Excellent MY/Excellent OWN/Bad HAND/Average,AND/Good IT/Good IS/Good MY/Good OWN/Average HAND/Good,1.5
24500333,/vol/tensusers8/aparikh/hf_cache/so/speechocean762/WAVE/SPEAKER2450/024500333.WAV,AS FOR THE FINAL THREE,Good,Average,AS/Excellent FOR/Excellent THE/Excellent FINAL/Excellent THREE/Excellent,AS/Good FOR/Good THE/Good FINAL/Good THREE/Good,1.5
24500350,/vol/tensusers8/aparikh/hf_cache/so/speechocean762/WAVE/SPEAKER2450/024500350.WAV,HE STARED AT THE STUDENTS,Good,Average,HE/Excellent STARED/Bad AT/Excellent THE/Excellent STUDENTS/Excellent,HE/Good STARED/Average AT/Good THE/Good STUDENTS/Good,1.5
24500363,/vol/tensusers8/aparikh/hf_cache/so/speechocean762/WAVE/SPEAKER2450/024500363.WAV,THERE'S NOTHING TO DO BUT GET DRUNK,Good,Excellent,THERE'S/Good NOTHING/Excellent TO/Excellent DO/Excellent BUT/Excellent GET/Excellent DRUNK/Good,THERE'S/Excellent NOTHING/Good TO/Good DO/Good BUT/Good GET/Good DRUNK/Excellent,1.5
26210005,/vol/tensusers8/aparikh/hf_cache/so/speechocean762/WAVE/SPEAKER2621/026210005.WAV,THANK YOU AND GOD BLESS YOU ALL,Good,Average,THANK/Excellent YOU/Excellent AND/Excellent GOD/Excellent BLESS/Excellent YOU/Excellent ALL/Bad,THANK/Good YOU/Good AND/Good GOD/Good BLESS/Good YOU/Good ALL/Average,1.5
26210047,/vol/tensusers8/aparikh/hf_cache/so/speechocean762/WAVE/SPEAKER2621/026210047.WAV,YOU TRY NOT TO THINK ABOUT THOSE KIND OF THINGS,Good,Excellent,YOU/Excellent TRY/Excellent NOT/Excellent TO/Excellent THINK/Excellent ABOUT/Excellent THOSE/Excellent KIND/Excellent OF/Excellent THINGS/Excellent,YOU/Good TRY/Good NOT/Good TO/Good THINK/Good ABOUT/Good THOSE/Good KIND/Good OF/Good THINGS/Good,1.5
26210096,/vol/tensusers8/aparikh/hf_cache/so/speechocean762/WAVE/SPEAKER2621/026210096.WAV,IT'S A VICTORY LAP FOR ME,Excellent,Good,IT'S/Excellent A/Excellent VICTORY/Excellent LAP/Excellent FOR/Excellent ME/Excellent,IT'S/Good A/Good VICTORY/Good LAP/Good FOR/Good ME/Good,1.5
26210123,/vol/tensusers8/aparikh/hf_cache/so/speechocean762/WAVE/SPEAKER2621/026210123.WAV,JUST WONDERING WHAT TO DO WITH THE CAT,Good,Average,JUST/Excellent WONDERING/Excellent WHAT/Excellent TO/Excellent DO/Excellent WITH/Excellent THE/Excellent CAT/Excellent,JUST/Good WONDERING/Good WHAT/Good TO/Good DO/Good WITH/Good THE/Good CAT/Good,1.5
26210132,/vol/tensusers8/aparikh/hf_cache/so/speechocean762/WAVE/SPEAKER2621/026210132.WAV,AND WHAT HAVE YOU LEARNED SO FAR,Excellent,Good,AND/Excellent WHAT/Excellent HAVE/Excellent YOU/Excellent LEARNED/Excellent SO/Excellent FAR/Excellent,AND/Good WHAT/Good HAVE/Good YOU/Good LEARNED/Good SO/Good FAR/Good,1.5
26210135,/vol/tensusers8/aparikh/hf_cache/so/speechocean762/WAVE/SPEAKER2621/026210135.WAV,COULD NOT BE SO PROUD,Good,Average,COULD/Excellent NOT/Excellent BE/Excellent SO/Excellent PROUD/Excellent,COULD/Good NOT/Good BE/Good SO/Good PROUD/Good,1.5
26210136,/vol/tensusers8/aparikh/hf_cache/so/speechocean762/WAVE/SPEAKER2621/026210136.WAV,LET'S TAKE A LOOK AT THAT,Good,Average,LET'S/Excellent TAKE/Excellent A/Excellent LOOK/Excellent AT/Excellent THAT/Excellent,LET'S/Good TAKE/Good A/Good LOOK/Good AT/Good THAT/Good,1.5
26210141,/vol/tensusers8/aparikh/hf_cache/so/speechocean762/WAVE/SPEAKER2621/026210141.WAV,LOT MORE TO LIFE THAN FOOTBALL,Good,Excellent,LOT/Excellent MORE/Excellent TO/Excellent LIFE/Excellent THAN/Excellent FOOTBALL/Excellent,LOT/Good MORE/Good TO/Good LIFE/Good THAN/Good FOOTBALL/Good,1.5
26210157,/vol/tensusers8/aparikh/hf_cache/so/speechocean762/WAVE/SPEAKER2621/026210157.WAV,HI ANGEL YOU NEVER KNOW WHAT WILL HAPPEN,Good,Average,HI/Bad ANGEL/Excellent YOU/Excellent NEVER/Excellent KNOW/Excellent WHAT/Excellent WILL/Excellent HAPPEN/Average,HI/Average ANGEL/Good YOU/Good NEVER/Good KNOW/Good WHAT/Good WILL/Good HAPPEN/Good,1.5
26210177,/vol/tensusers8/aparikh/hf_cache/so/speechocean762/WAVE/SPEAKER2621/026210177.WAV,WAIT YOU CAN SEE THAT CAN YOU,Good,Excellent,WAIT/Excellent YOU/Excellent CAN/Excellent SEE/Excellent THAT/Excellent CAN/Excellent YOU/Excellent,WAIT/Good YOU/Good CAN/Good SEE/Good THAT/Good CAN/Good YOU/Good,1.5
26210185,/vol/tensusers8/aparikh/hf_cache/so/speechocean762/WAVE/SPEAKER2621/026210185.WAV,HOPELESSNESS IS A GREAT SIGH,Good,Excellent,HOPELESSNESS/Excellent IS/Excellent A/Excellent GREAT/Excellent SIGH/Good,HOPELESSNESS/Good IS/Good A/Good GREAT/Good SIGH/Excellent,1.5
26210203,/vol/tensusers8/aparikh/hf_cache/so/speechocean762/WAVE/SPEAKER2621/026210203.WAV,IT WAS SO GREAT TO SEE EVERYONE,Good,Average,IT/Excellent WAS/Excellent SO/Excellent GREAT/Excellent TO/Excellent SEE/Excellent EVERYONE/Excellent,IT/Good WAS/Good SO/Good GREAT/Good TO/Good SEE/Good EVERYONE/Good,1.5
26210213,/vol/tensusers8/aparikh/hf_cache/so/speechocean762/WAVE/SPEAKER2621/026210213.WAV,THEY TALK A LOT OF SENSE,Good,Excellent,THEY/Excellent TALK/Excellent A/Excellent LOT/Excellent OF/Excellent SENSE/Excellent,THEY/Good TALK/Good A/Good LOT/Good OF/Good SENSE/Good,1.5
26210220,/vol/tensusers8/aparikh/hf_cache/so/speechocean762/WAVE/SPEAKER2621/026210220.WAV,IT'S NOT AS SWEET WHEN YOU HAVE TO SHARE,Good,Average,IT'S/Excellent NOT/Excellent AS/Excellent SWEET/Excellent WHEN/Excellent YOU/Excellent HAVE/Excellent TO/Excellent SHARE/Bad,IT'S/Good NOT/Good AS/Good SWEET/Good WHEN/Good YOU/Good HAVE/Good TO/Good SHARE/Good,1.5
26210231,/vol/tensusers8/aparikh/hf_cache/so/speechocean762/WAVE/SPEAKER2621/026210231.WAV,A LIGHT IN THE SHADOW,Excellent,Good,A/Excellent LIGHT/Excellent IN/Excellent THE/Excellent SHADOW/Excellent,A/Good LIGHT/Good IN/Good THE/Good SHADOW/Good,1.5
26210242,/vol/tensusers8/aparikh/hf_cache/so/speechocean762/WAVE/SPEAKER2621/026210242.WAV,HOPE TO SEE MUCH MORE OF YOU,Excellent,Good,HOPE/Excellent TO/Excellent SEE/Excellent MUCH/Excellent MORE/Excellent OF/Excellent YOU/Excellent,HOPE/Good TO/Good SEE/Good MUCH/Good MORE/Good OF/Good YOU/Good,1.5
26210262,/vol/tensusers8/aparikh/hf_cache/so/speechocean762/WAVE/SPEAKER2621/026210262.WAV,GREAT FIRST GAME OF THE SEASON,Good,Average,GREAT/Excellent FIRST/Excellent GAME/Excellent OF/Excellent THE/Excellent SEASON/Excellent,GREAT/Good FIRST/Good GAME/Good OF/Good THE/Good SEASON/Good,1.5
26210287,/vol/tensusers8/aparikh/hf_cache/so/speechocean762/WAVE/SPEAKER2621/026210287.WAV,IT USED TO BE CALLED A HAPPY ENDING,Good,Average,IT/Excellent USED/Excellent TO/Excellent BE/Excellent CALLED/Excellent A/Excellent HAPPY/Excellent ENDING/Excellent,IT/Good USED/Good TO/Good BE/Good CALLED/Good A/Good HAPPY/Good ENDING/Good,1.5
26210299,/vol/tensusers8/aparikh/hf_cache/so/speechocean762/WAVE/SPEAKER2621/026210299.WAV,AND I GET TO HEAR A LOT OF IT,Excellent,Good,AND/Excellent I/Excellent GET/Excellent TO/Excellent HEAR/Excellent A/Excellent LOT/Excellent OF/Excellent IT/Excellent,AND/Good I/Good GET/Good TO/Good HEAR/Good A/Good LOT/Good OF/Good IT/Good,1.5
26210302,/vol/tensusers8/aparikh/hf_cache/so/speechocean762/WAVE/SPEAKER2621/026210302.WAV,IT WAS A GREAT FUN,Good,Average,IT/Excellent WAS/Excellent A/Excellent GREAT/Excellent FUN/Good,IT/Good WAS/Good A/Good GREAT/Good FUN/Excellent,1.5
27990028,/vol/tensusers8/aparikh/hf_cache/so/speechocean762/WAVE/SPEAKER2799/027990028.WAV,HE RUNS HE BLOCKS HE CATCHES THE BALL,Good,Average,HE/Excellent RUNS/Excellent HE/Excellent BLOCKS/Excellent HE/Excellent CATCHES/Excellent THE/Excellent BALL/Excellent,HE/Good RUNS/Good HE/Good BLOCKS/Good HE/Good CATCHES/Good THE/Good BALL/Good,1.5
27990046,/vol/tensusers8/aparikh/hf_cache/so/speechocean762/WAVE/SPEAKER2799/027990046.WAV,WE HAVE THE EARLY SIGNS,Good,Excellent,WE/Excellent HAVE/Excellent THE/Excellent EARLY/Excellent SIGNS/Good,WE/Good HAVE/Good THE/Good EARLY/Good SIGNS/Excellent,1.5
27990056,/vol/tensusers8/aparikh/hf_cache/so/speechocean762/WAVE/SPEAKER2799/027990056.WAV,ON SUNDAY NONE OF THAT COUNTED FOR ANYTHING,Good,Excellent,ON/Excellent SUNDAY/Average NONE/Excellent OF/Excellent THAT/Excellent COUNTED/Excellent FOR/Excellent ANYTHING/Excellent,ON/Good SUNDAY/Good NONE/Good OF/Good THAT/Good COUNTED/Good FOR/Good ANYTHING/Good,1.5
27990059,/vol/tensusers8/aparikh/hf_cache/so/speechocean762/WAVE/SPEAKER2799/027990059.WAV,PEOPLE ARE GETTING BACK TO WORK,Good,Excellent,PEOPLE/Excellent ARE/Excellent GETTING/Excellent BACK/Excellent TO/Excellent WORK/Excellent,PEOPLE/Good ARE/Good GETTING/Good BACK/Good TO/Good WORK/Good,1.5
27990066,/vol/tensusers8/aparikh/hf_cache/so/speechocean762/WAVE/SPEAKER2799/027990066.WAV,IT SHOW THE WEAKNESS OF THE MOVEMENTS,Good,Average,IT/Excellent SHOW/Excellent THE/Excellent WEAKNESS/Good OF/Excellent THE/Excellent MOVEMENTS/Excellent,IT/Good SHOW/Good THE/Good WEAKNESS/Excellent OF/Good THE/Good MOVEMENTS/Good,1.5
27990153,/vol/tensusers8/aparikh/hf_cache/so/speechocean762/WAVE/SPEAKER2799/027990153.WAV,IN A WORLD CUP GAIN,Excellent,Good,IN/Excellent A/Excellent WORLD/Excellent CUP/Excellent GAIN/Excellent,IN/Good A/Good WORLD/Good CUP/Good GAIN/Good,1.5
27990156,/vol/tensusers8/aparikh/hf_cache/so/speechocean762/WAVE/SPEAKER2799/027990156.WAV,LOOKING FORWARD TO SEEING WHAT YOU HAVE TO OFFER,Good,Average,LOOKING/Excellent FORWARD/Excellent TO/Excellent SEEING/Excellent WHAT/Excellent YOU/Excellent HAVE/Excellent TO/Excellent OFFER/Average,LOOKING/Good FORWARD/Good TO/Good SEEING/Good WHAT/Good YOU/Good HAVE/Good TO/Good OFFER/Good,1.5
27990160,/vol/tensusers8/aparikh/hf_cache/so/speechocean762/WAVE/SPEAKER2799/027990160.WAV,I HAVE A NEW THING ON THE FRIDGE,Excellent,Good,I/Excellent HAVE/Excellent A/Excellent NEW/Excellent THING/Excellent ON/Excellent THE/Excellent FRIDGE/Excellent,I/Good HAVE/Good A/Good NEW/Good THING/Good ON/Good THE/Good FRIDGE/Good,1.5
27990162,/vol/tensusers8/aparikh/hf_cache/so/speechocean762/WAVE/SPEAKER2799/027990162.WAV,TIME TO THINK ABOUT SOMETHING ELSE FOR A WHILE,Good,Excellent,TIME/Excellent TO/Excellent THINK/Excellent ABOUT/Excellent SOMETHING/Excellent ELSE/Excellent FOR/Excellent A/Excellent WHILE/Excellent,TIME/Good TO/Good THINK/Good ABOUT/Good SOMETHING/Good ELSE/Good FOR/Good A/Good WHILE/Good,1.5
27990167,/vol/tensusers8/aparikh/hf_cache/so/speechocean762/WAVE/SPEAKER2799/027990167.WAV,YOU TALKED YOU CAUGHT YOU SCORED,Excellent,Good,YOU/Excellent TALKED/Excellent YOU/Excellent CAUGHT/Excellent YOU/Excellent SCORED/Excellent,YOU/Good TALKED/Good YOU/Good CAUGHT/Good YOU/Good SCORED/Good,1.5
27990201,/vol/tensusers8/aparikh/hf_cache/so/speechocean762/WAVE/SPEAKER2799/027990201.WAV,WHAT TO EAT IF YOU HAVE NO MONEY,Excellent,Good,WHAT/Excellent TO/Excellent EAT/Excellent IF/Excellent YOU/Excellent HAVE/Excellent NO/Excellent MONEY/Excellent,WHAT/Good TO/Good EAT/Good IF/Good YOU/Good HAVE/Good NO/Good MONEY/Good,1.5
27990232,/vol/tensusers8/aparikh/hf_cache/so/speechocean762/WAVE/SPEAKER2799/027990232.WAV,YOU SHOULD KEEP AN EYE OUT FOR THEM,Excellent,Good,YOU/Excellent SHOULD/Excellent KEEP/Excellent AN/Excellent EYE/Excellent OUT/Excellent FOR/Excellent THEM/Excellent,YOU/Good SHOULD/Good KEEP/Good AN/Good EYE/Good OUT/Good FOR/Good THEM/Good,1.5
27990242,/vol/tensusers8/aparikh/hf_cache/so/speechocean762/WAVE/SPEAKER2799/027990242.WAV,LOOKING FOR A GOOD GIFTS,Excellent,Good,LOOKING/Excellent FOR/Excellent A/Excellent GOOD/Excellent GIFTS/Excellent,LOOKING/Good FOR/Good A/Good GOOD/Good GIFTS/Good,1.5
27990247,/vol/tensusers8/aparikh/hf_cache/so/speechocean762/WAVE/SPEAKER2799/027990247.WAV,JOY CAN BE HARD TO FIND SOMETIMES,Good,Excellent,JOY/Excellent CAN/Excellent BE/Excellent HARD/Excellent TO/Excellent FIND/Excellent SOMETIMES/Good,JOY/Good CAN/Good BE/Good HARD/Good TO/Good FIND/Good SOMETIMES/Average,1.5
27990264,/vol/tensusers8/aparikh/hf_cache/so/speechocean762/WAVE/SPEAKER2799/027990264.WAV,I WILL NOT HESITATE TO CALL THE POLICE,Excellent,Good,I/Excellent WILL/Excellent NOT/Excellent HESITATE/Excellent TO/Excellent CALL/Excellent THE/Excellent POLICE/Excellent,I/Good WILL/Good NOT/Good HESITATE/Good TO/Good CALL/Good THE/Good POLICE/Good,1.5
27990309,/vol/tensusers8/aparikh/hf_cache/so/speechocean762/WAVE/SPEAKER2799/027990309.WAV,THE HOUSE WAS TOO BIG,Excellent,Good,THE/Excellent HOUSE/Excellent WAS/Excellent TOO/Excellent BIG/Excellent,THE/Good HOUSE/Good WAS/Good TOO/Good BIG/Good,1.5
27990328,/vol/tensusers8/aparikh/hf_cache/so/speechocean762/WAVE/SPEAKER2799/027990328.WAV,THE TOP OF ITS HEAD WAS STILL OPEN,Good,Average,THE/Excellent TOP/Excellent OF/Excellent ITS/Excellent HEAD/Excellent WAS/Excellent STILL/Excellent OPEN/Excellent,THE/Good TOP/Good OF/Good ITS/Good HEAD/Good WAS/Good STILL/Good OPEN/Good,1.5
27990330,/vol/tensusers8/aparikh/hf_cache/so/speechocean762/WAVE/SPEAKER2799/027990330.WAV,THE DOOR WAS OPENED WITH DIFFICULTY,Good,Average,THE/Excellent DOOR/Excellent WAS/Excellent OPENED/Average WITH/Excellent DIFFICULTY/Excellent,THE/Good DOOR/Good WAS/Good OPENED/Bad WITH/Good DIFFICULTY/Good,1.5
27990341,/vol/tensusers8/aparikh/hf_cache/so/speechocean762/WAVE/SPEAKER2799/027990341.WAV,HE MARKED THEIR PROGRESS ON THE CHART,Excellent,Good,HE/Excellent MARKED/Excellent THEIR/Excellent PROGRESS/Excellent ON/Excellent THE/Excellent CHART/Excellent,HE/Good MARKED/Good THEIR/Good PROGRESS/Good ON/Good THE/Good CHART/Good,1.5
27990358,/vol/tensusers8/aparikh/hf_cache/so/speechocean762/WAVE/SPEAKER2799/027990358.WAV,BUT PERHAPS FOR HIM IT WAS NOT TOO LATE,Good,Average,BUT/Excellent PERHAPS/Excellent FOR/Excellent HIM/Good IT/Excellent WAS/Excellent NOT/Excellent TOO/Excellent LATE/Excellent,BUT/Good PERHAPS/Good FOR/Good HIM/Average IT/Good WAS/Good NOT/Good TOO/Good LATE/Good,1.5
29810020,/vol/tensusers8/aparikh/hf_cache/so/speechocean762/WAVE/SPEAKER2981/029810020.WAV,IT WOULD BE QUITE A CHALLENGE,Excellent,Good,IT/Excellent WOULD/Excellent BE/Excellent QUITE/Excellent A/Excellent CHALLENGE/Excellent,IT/Good WOULD/Good BE/Good QUITE/Good A/Good CHALLENGE/Good,1.5
29810027,/vol/tensusers8/aparikh/hf_cache/so/speechocean762/WAVE/SPEAKER2981/029810027.WAV,IT'S SORT A BIT A LITTLE BIT FORWARD AND BACK,Good,Excellent,IT'S/Excellent SORT/Excellent A/Excellent BIT/Excellent A/Excellent LITTLE/Excellent BIT/Excellent FORWARD/Excellent AND/Excellent BACK/Excellent,IT'S/Good SORT/Good A/Good BIT/Good A/Good LITTLE/Good BIT/Good FORWARD/Good AND/Good BACK/Good,1.5
29810135,/vol/tensusers8/aparikh/hf_cache/so/speechocean762/WAVE/SPEAKER2981/029810135.WAV,AND THANK YOU FOR BEING SO STRONG,Excellent,Good,AND/Excellent THANK/Excellent YOU/Excellent FOR/Excellent BEING/Excellent SO/Excellent STRONG/Excellent,AND/Good THANK/Good YOU/Good FOR/Good BEING/Good SO/Good STRONG/Good,1.5
29810139,/vol/tensusers8/aparikh/hf_cache/so/speechocean762/WAVE/SPEAKER2981/029810139.WAV,FOUND THIS IN THE COLLECTION,Good,Excellent,FOUND/Excellent THIS/Excellent IN/Excellent THE/Excellent COLLECTION/Excellent,FOUND/Good THIS/Good IN/Good THE/Good COLLECTION/Good,1.5
29810147,/vol/tensusers8/aparikh/hf_cache/so/speechocean762/WAVE/SPEAKER2981/029810147.WAV,HE IS IN THE HOSPITAL,Good,Excellent,HE/Excellent IS/Excellent IN/Excellent THE/Excellent HOSPITAL/Excellent,HE/Good IS/Good IN/Good THE/Good HOSPITAL/Good,1.5
29810158,/vol/tensusers8/aparikh/hf_cache/so/speechocean762/WAVE/SPEAKER2981/029810158.WAV,PROOF WE HAVE A GOOD TIME,Excellent,Good,PROOF/Excellent WE/Excellent HAVE/Excellent A/Excellent GOOD/Excellent TIME/Excellent,PROOF/Good WE/Good HAVE/Good A/Good GOOD/Good TIME/Good,1.5
29810200,/vol/tensusers8/aparikh/hf_cache/so/speechocean762/WAVE/SPEAKER2981/029810200.WAV,VIA WHAT DO YOU THINK,Good,Average,VIA/Excellent WHAT/Excellent DO/Excellent YOU/Excellent THINK/Excellent,VIA/Good WHAT/Good DO/Good YOU/Good THINK/Good,1.5
29810204,/vol/tensusers8/aparikh/hf_cache/so/speechocean762/WAVE/SPEAKER2981/029810204.WAV,IT'S ALL ABOUT THE CHOCOLATE,Good,Excellent,IT'S/Excellent ALL/Excellent ABOUT/Excellent THE/Good CHOCOLATE/Good,IT'S/Good ALL/Good ABOUT/Good THE/Average CHOCOLATE/Average,1.5
29810216,/vol/tensusers8/aparikh/hf_cache/so/speechocean762/WAVE/SPEAKER2981/029810216.WAV,I WOULD LIKE TO KNOW YOU,Excellent,Good,I/Excellent WOULD/Excellent LIKE/Excellent TO/Excellent KNOW/Excellent YOU/Excellent,I/Good WOULD/Good LIKE/Good TO/Good KNOW/Good YOU/Good,1.5
29810221,/vol/tensusers8/aparikh/hf_cache/so/speechocean762/WAVE/SPEAKER2981/029810221.WAV,WEIGHT IS THE ENEMY OF PERFORMANCE,Good,Excellent,WEIGHT/Excellent IS/Excellent THE/Excellent ENEMY/Good OF/Excellent PERFORMANCE/Excellent,WEIGHT/Good IS/Good THE/Good ENEMY/Average OF/Good PERFORMANCE/Good,1.5
29810234,/vol/tensusers8/aparikh/hf_cache/so/speechocean762/WAVE/SPEAKER2981/029810234.WAV,WHATEVER THE DIFFICULTY THERE'S A SOLUTION,Good,Average,WHATEVER/Excellent THE/Excellent DIFFICULTY/Excellent THERE'S/Excellent A/Excellent SOLUTION/Excellent,WHATEVER/Good THE/Good DIFFICULTY/Good THERE'S/Good A/Good SOLUTION/Good,1.5
29810235,/vol/tensusers8/aparikh/hf_cache/so/speechocean762/WAVE/SPEAKER2981/029810235.WAV,PRAYER IS A SOURCE OF STRENGTH AND SPIRIT,Good,Average,PRAYER/Excellent IS/Excellent A/Excellent SOURCE/Excellent OF/Excellent STRENGTH/Excellent AND/Excellent SPIRIT/Excellent,PRAYER/Good IS/Good A/Good SOURCE/Good OF/Good STRENGTH/Good AND/Good SPIRIT/Good,1.5
29810243,/vol/tensusers8/aparikh/hf_cache/so/speechocean762/WAVE/SPEAKER2981/029810243.WAV,I KNOW HOW TO DO ALL OF THEM,Good,Excellent,I/Excellent KNOW/Excellent HOW/Excellent TO/Excellent DO/Excellent ALL/Excellent OF/Excellent THEM/Excellent,I/Good KNOW/Good HOW/Good TO/Good DO/Good ALL/Good OF/Good THEM/Good,1.5
29810283,/vol/tensusers8/aparikh/hf_cache/so/speechocean762/WAVE/SPEAKER2981/029810283.WAV,BUT LOOK AT MY PARENTS,Good,Average,BUT/Excellent LOOK/Excellent AT/Excellent MY/Excellent PARENTS/Excellent,BUT/Good LOOK/Good AT/Good MY/Good PARENTS/Good,1.5
29810294,/vol/tensusers8/aparikh/hf_cache/so/speechocean762/WAVE/SPEAKER2981/029810294.WAV,TEXT ME IF YOU SINGLE SINGE,Good,Excellent,TEXT/Excellent ME/Excellent IF/Excellent YOU/Excellent SINGLE/Excellent SINGE/Excellent,TEXT/Good ME/Good IF/Good YOU/Good SINGLE/Good SINGE/Good,1.5
