audiofilepath,transcript,phoneme_scores
/vol/tensusers8/aparikh/hf_cache/so/speechocean762/WAVE/SPEAKER6010/060100100.WAV,WOMEN SAY THOSE THINGS BUT NEVER DO THEM,w/2.0 ɪ/2.0 m/2.0 ɪ/2.0 n/2.0 s/2.0 eɪ/1.8 ð/1.2 oʊ/1.6 z/1.4 θ/1.4 ɪ/2.0 ŋ/2.0 z/1.8 b/2.0 ə/2.0 t/1.8 n/2.0 ɛ/1.2 v/2.0 ɚ/2.0 d/2.0 ʊ/1.6 ð/2.0 ə/1.4 m/1.8
/vol/tensusers8/aparikh/hf_cache/so/speechocean762/WAVE/SPEAKER6010/060100101.WAV,THESE VISITED SHE RETURNED,ð/2.0 i/2.0 z/1.6 v/1.8 ɪ/2.0 z/2.0 ɪ/2.0 t/2.0 ɪ/2.0 d/2.0 ʃ/2.0 i/1.8 ɹ/2.0 ɪ/2.0 t/2.0 ɜː/2.0 n/2.0 d/2.0
/vol/tensusers8/aparikh/hf_cache/so/speechocean762/WAVE/SPEAKER6010/060100105.WAV,IT IS SO NATURE IS MADE,ɪ/2.0 t/2.0 ɪ/2.0 z/2.0 s/2.0 oʊ/2.0 n/2.0 eɪ/2.0 tʃ/2.0 ɚ/2.0 ɪ/2.0 z/2.0 m/2.0 eɪ/2.0 d/2.0
/vol/tensusers8/aparikh/hf_cache/so/speechocean762/WAVE/SPEAKER6010/060100124.WAV,AS I COULD,æ/2.0 z/2.0 aɪ/2.0 k/2.0 ʊ/2.0 d/2.0
/vol/tensusers8/aparikh/hf_cache/so/speechocean762/WAVE/SPEAKER6010/060100128.WAV,SOME OF THE MEN WHERE TALKING AWAY THE TABLES,s/2.0 ə/2.0 m/2.0 ə/2.0 v/1.6 ð/2.0 ə/2.0 m/2.0 ɛ/2.0 n/2.0 w/2.0 ɛ/2.0 ɹ/2.0 t/2.0 ɔː/2.0 k/2.0 ɪ/2.0 ŋ/2.0 ə/2.0 w/2.0 eɪ/2.0 ð/1.6 ə/2.0 t/2.0 eɪ/2.0 b/2.0 l/2.0 z/1.8
/vol/tensusers8/aparikh/hf_cache/so/speechocean762/WAVE/SPEAKER6010/060100132.WAV,MY DAUGHTER YOU MUST RETURN TO YOUR PLACE,m/2.0 aɪ/2.0 d/1.6 ɔː/2.0 t/2.0 ɚ/2.0 j/2.0 u/2.0 m/2.0 ə/2.0 s/2.0 t/1.8 ɹ/2.0 ɪ/2.0 t/2.0 ɜː/2.0 n/2.0 t/2.0 u/1.8 j/2.0 ɔ/2.0 p/2.0 l/2.0 eɪ/2.0 s/2.0
/vol/tensusers8/aparikh/hf_cache/so/speechocean762/WAVE/SPEAKER6010/060100147.WAV,IT WAS MY LAST WEEK THERE,ɪ/2.0 t/2.0 w/2.0 ə/2.0 z/1.6 m/2.0 aɪ/2.0 l/2.0 ɑ/2.0 s/2.0 t/2.0 w/2.0 i/2.0 k/2.0 ð/2.0 ɛ/2.0 ɹ/2.0
/vol/tensusers8/aparikh/hf_cache/so/speechocean762/WAVE/SPEAKER6010/060100154.WAV,HE LOOKED AROUND HIM AND BEGAN,h/2.0 i/1.8 l/2.0 ʊ/2.0 k/2.0 t/2.0 ə/2.0 ɹ/2.0 aʊ/2.0 n/2.0 d/2.0 h/2.0 ɪ/2.0 m/2.0 æ/2.0 n/2.0 d/2.0 b/2.0 ɪ/2.0 ɡ/2.0 æ/1.8 n/2.0
/vol/tensusers8/aparikh/hf_cache/so/speechocean762/WAVE/SPEAKER6010/060100159.WAV,THE OTHER HAVE ALL RETURN,ð/2.0 i/2.0 ʌ/2.0 ð/2.0 ɚ/2.0 h/2.0 æ/2.0 v/2.0 ɔ/2.0 l/2.0 ɹ/2.0 ɪ/2.0 t/2.0 ɜː/2.0 n/2.0
/vol/tensusers8/aparikh/hf_cache/so/speechocean762/WAVE/SPEAKER6010/060100164.WAV,AND HE WENT BACK FOR MORE,æ/2.0 n/2.0 d/2.0 h/2.0 i/2.0 w/2.0 ɛ/2.0 n/2.0 t/2.0 b/2.0 æ/2.0 k/2.0 f/2.0 ɔ/2.0 m/2.0 ɔ/2.0 ɹ/2.0
/vol/tensusers8/aparikh/hf_cache/so/speechocean762/WAVE/SPEAKER6048/060480005.WAV,FOR THESE HE TOOK THE MONEY,f/2.0 ɔ/2.0 ð/2.0 i/2.0 z/1.8 h/2.0 i/2.0 t/2.0 ʊ/2.0 k/2.0 ð/2.0 ə/2.0 m/2.0 ʌ/2.0 n/2.0 i/2.0
/vol/tensusers8/aparikh/hf_cache/so/speechocean762/WAVE/SPEAKER6048/060480008.WAV,WHAT DID YOU NOT LET ASK KNOW,w/2.0 ə/2.0 t/2.0 d/2.0 ɪ/2.0 d/2.0 j/2.0 u/1.8 n/2.0 ə/2.0 t/2.0 l/2.0 ɛ/2.0 t/2.0 ɑ/2.0 s/2.0 k/2.0 n/2.0 oʊ/2.0
/vol/tensusers8/aparikh/hf_cache/so/speechocean762/WAVE/SPEAKER6048/060480012.WAV,IT OFTEN HAPPENS SO IN LIFE,ɪ/2.0 t/2.0 ʌ/2.0 f/2.0 n/2.0 h/2.0 æ/2.0 p/2.0 ə/2.0 n/2.0 z/1.6 s/2.0 oʊ/2.0 ɪ/2.0 n/2.0 l/2.0 aɪ/2.0 f/2.0
/vol/tensusers8/aparikh/hf_cache/so/speechocean762/WAVE/SPEAKER6048/060480018.WAV,BUT YOU SIDE JUST NOW,b/2.0 ə/2.0 t/2.0 j/2.0 u/1.8 s/2.0 aɪ/2.0 d/1.6 dʒ/2.0 ə/2.0 s/2.0 t/2.0 n/2.0 aʊ/2.0
/vol/tensusers8/aparikh/hf_cache/so/speechocean762/WAVE/SPEAKER6048/060480037.WAV,WHAT IS THERE SUCH A PLACE,w/2.0 ə/1.8 t/2.0 ɪ/2.0 z/2.0 ð/2.0 ɛ/2.0 ɹ/2.0 s/2.0 ə/2.0 tʃ/2.0 ə/2.0 p/2.0 l/2.0 eɪ/2.0 s/2.0
/vol/tensusers8/aparikh/hf_cache/so/speechocean762/WAVE/SPEAKER6048/060480050.WAV,I HAD HIT HIM AT LEST,aɪ/2.0 h/2.0 æ/2.0 d/1.6 h/2.0 ɪ/2.0 t/2.0 h/2.0 ɪ/2.0 m/2.0 æ/1.6 t/2.0 l/2.0 ɛ/2.0 s/2.0 t/1.8
/vol/tensusers8/aparikh/hf_cache/so/speechocean762/WAVE/SPEAKER6048/060480082.WAV,LET US GO SET SHOE,l/2.0 ɛ/2.0 t/2.0 ə/2.0 s/2.0 ɡ/2.0 oʊ/2.0 s/2.0 ɛ/2.0 t/2.0 ʃ/2.0 u/0.8
/vol/tensusers8/aparikh/hf_cache/so/speechocean762/WAVE/SPEAKER6048/060480084.WAV,HE STOPPED IN HIS WALK AND LOOKED AROUND,h/2.0 i/2.0 s/2.0 t/2.0 ə/2.0 p/2.0 t/2.0 ɪ/2.0 n/2.0 h/2.0 ɪ/2.0 z/1.6 w/2.0 ɔ/2.0 k/2.0 æ/2.0 n/2.0 d/2.0 l/2.0 ʊ/2.0 k/2.0 t/2.0 ə/2.0 ɹ/2.0 aʊ/2.0 n/2.0 d/1.8
/vol/tensusers8/aparikh/hf_cache/so/speechocean762/WAVE/SPEAKER6048/060480090.WAV,SHE CAME UP TO MY WITH MY SISTER,ʃ/2.0 i/2.0 k/2.0 eɪ/2.0 m/2.0 ə/2.0 p/2.0 t/2.0 u/1.8 m/2.0 aɪ/2.0 w/2.0 ɪ/2.0 ð/1.8 m/2.0 aɪ/2.0 s/2.0 ɪ/2.0 s/2.0 t/2.0 ɚ/2.0
/vol/tensusers8/aparikh/hf_cache/so/speechocean762/WAVE/SPEAKER6048/060480094.WAV,SHE DID EVERYTHING SO WELL,ʃ/2.0 i/1.8 d/2.0 ɪ/2.0 d/2.0 ɛ/2.0 v/2.0 ɹ/2.0 i/2.0 θ/1.8 ɪ/2.0 ŋ/2.0 s/2.0 oʊ/2.0 w/2.0 ɛ/2.0 l/2.0
/vol/tensusers8/aparikh/hf_cache/so/speechocean762/WAVE/SPEAKER6048/060480102.WAV,HE THEN WENT AWAY,h/2.0 i/2.0 ð/1.6 ɛ/2.0 n/2.0 w/2.0 ɛ/2.0 n/2.0 t/2.0 ə/2.0 w/2.0 eɪ/2.0
/vol/tensusers8/aparikh/hf_cache/so/speechocean762/WAVE/SPEAKER6048/060480104.WAV,AND SO HER LIFE WAS ONE OF LOVE,æ/2.0 n/2.0 d/2.0 s/2.0 oʊ/2.0 h/2.0 ɚ/2.0 l/2.0 aɪ/2.0 f/2.0 w/2.0 ə/2.0 z/2.0 w/2.0 ə/2.0 n/2.0 ə/2.0 v/1.6 l/2.0 ə/2.0 v/1.8
/vol/tensusers8/aparikh/hf_cache/so/speechocean762/WAVE/SPEAKER6048/060480131.WAV,LITTLE BY LITTLE THE BOYS BEGAN TALKING AGAIN,l/2.0 ɪ/2.0 t/2.0 l/2.0 b/2.0 aɪ/2.0 l/2.0 ɪ/2.0 t/2.0 l/2.0 ð/2.0 ə/2.0 b/2.0 ɔɪ/2.0 z/1.6 b/2.0 ɪ/2.0 ɡ/2.0 æ/2.0 n/2.0 t/2.0 ɔː/2.0 k/2.0 ɪ/2.0 ŋ/2.0 ə/2.0 ɡ/2.0 ɛ/1.6 n/2.0
/vol/tensusers8/aparikh/hf_cache/so/speechocean762/WAVE/SPEAKER6048/060480134.WAV,SHE MAY BE PHONE,ʃ/2.0 i/1.6 m/2.0 eɪ/2.0 b/2.0 i/2.0 f/2.0 oʊ/1.4 n/2.0
/vol/tensusers8/aparikh/hf_cache/so/speechocean762/WAVE/SPEAKER6048/060480135.WAV,SHE WENT BACK INTO THE LIE LIBRARY,ʃ/2.0 i/1.8 w/2.0 ɛ/2.0 n/2.0 t/2.0 b/2.0 æ/2.0 k/2.0 ɪ/2.0 n/2.0 t/2.0 u/1.8 ð/2.0 ə/2.0 l/2.0 aɪ/2.0 l/2.0 aɪ/2.0 b/2.0 ɹ/1.6 ɚ/2.0 i/2.0
/vol/tensusers8/aparikh/hf_cache/so/speechocean762/WAVE/SPEAKER6048/060480145.WAV,WHAT DID YOU WANT TO SEE ME ABOUT,w/2.0 ə/2.0 t/1.8 d/2.0 ɪ/2.0 d/2.0 j/2.0 u/1.8 w/2.0 ɑ/2.0 n/2.0 t/1.8 t/2.0 u/1.8 s/2.0 i/2.0 m/2.0 i/2.0 ə/2.0 b/2.0 aʊ/2.0 t/2.0
/vol/tensusers8/aparikh/hf_cache/so/speechocean762/WAVE/SPEAKER6048/060480147.WAV,WERE STAY AT NINE,w/2.0 ɚ/1.6 s/2.0 t/2.0 eɪ/2.0 æ/2.0 t/2.0 n/2.0 aɪ/2.0 n/1.8
/vol/tensusers8/aparikh/hf_cache/so/speechocean762/WAVE/SPEAKER6048/060480148.WAV,DECIDE IT WHO CAN I CANNOT,d/2.0 ɪ/2.0 s/2.0 aɪ/2.0 d/2.0 ɪ/2.0 t/2.0 h/2.0 u/2.0 k/2.0 æ/2.0 n/2.0 aɪ/2.0 k/2.0 æ/2.0 n/2.0 ə/2.0 t/2.0
/vol/tensusers8/aparikh/hf_cache/so/speechocean762/WAVE/SPEAKER6048/060480168.WAV,HE KIT ME BY THE ARM,h/2.0 i/1.8 k/2.0 ɪ/2.0 t/2.0 m/2.0 i/2.0 b/2.0 aɪ/2.0 ð/2.0 ə/1.6 ɑ/2.0 ɹ/2.0 m/2.0
/vol/tensusers8/aparikh/hf_cache/so/speechocean762/WAVE/SPEAKER6048/060480169.WAV,FOURTEEN FEEL AWAY AND THAT LEFT ONE,f/2.0 ɔː/2.0 ɹ/2.0 t/2.0 iː/2.0 n/2.0 f/2.0 i/1.8 l/2.0 ə/2.0 w/2.0 eɪ/2.0 æ/2.0 n/2.0 d/2.0 ð/2.0 æ/2.0 t/2.0 l/2.0 ɛ/1.4 f/2.0 t/2.0 w/2.0 ə/2.0 n/2.0
/vol/tensusers8/aparikh/hf_cache/so/speechocean762/WAVE/SPEAKER6121/061210013.WAV,HOW COULD SHE HAVE THOUGHT THEM,h/2.0 aʊ/2.0 k/2.0 ʊ/2.0 d/2.0 ʃ/2.0 i/2.0 h/2.0 æ/2.0 v/2.0 θ/2.0 ɔ/2.0 t/1.8 ð/1.6 ə/2.0 m/1.8
/vol/tensusers8/aparikh/hf_cache/so/speechocean762/WAVE/SPEAKER6121/061210031.WAV,NOW IT CAME TO ME,n/2.0 aʊ/2.0 ɪ/2.0 t/2.0 k/2.0 eɪ/2.0 m/2.0 t/2.0 u/1.8 m/2.0 i/1.8
/vol/tensusers8/aparikh/hf_cache/so/speechocean762/WAVE/SPEAKER6121/061210059.WAV,BUT HE THOUGHT BETTER OF IT,b/2.0 ə/2.0 t/2.0 h/2.0 i/2.0 θ/1.6 ɔ/2.0 t/2.0 b/2.0 ɛ/2.0 t/2.0 ɚ/2.0 ə/2.0 v/1.8 ɪ/2.0 t/2.0
/vol/tensusers8/aparikh/hf_cache/so/speechocean762/WAVE/SPEAKER6121/061210060.WAV,THEY HAD NO ENOUGH SPORT FOR ONE DAY,ð/2.0 eɪ/2.0 h/2.0 æ/2.0 d/2.0 n/2.0 oʊ/2.0 ɪ/2.0 n/2.0 ʌ/2.0 f/2.0 s/2.0 p/2.0 ɔ/2.0 t/2.0 f/2.0 ɔ/1.8 w/1.6 ə/2.0 n/2.0 d/2.0 eɪ/2.0
/vol/tensusers8/aparikh/hf_cache/so/speechocean762/WAVE/SPEAKER6121/061210063.WAV,VERY WELL I HAVE NO MORE QUESTIONS TO ASK,v/2.0 ɛ/2.0 ɹ/2.0 i/2.0 w/2.0 ɛ/2.0 l/2.0 aɪ/2.0 h/2.0 æ/2.0 v/1.6 n/2.0 oʊ/2.0 m/2.0 ɔ/2.0 ɹ/2.0 k/2.0 w/2.0 ɛ/2.0 s/2.0 tʃ/2.0 ə/2.0 n/2.0 z/1.8 t/2.0 u/1.8 ɑ/2.0 s/2.0 k/2.0
/vol/tensusers8/aparikh/hf_cache/so/speechocean762/WAVE/SPEAKER6121/061210068.WAV,I TOOK MY HEAD IN MY HANDS AND THOUGHT,aɪ/2.0 t/2.0 ʊ/2.0 k/2.0 m/2.0 aɪ/2.0 h/2.0 ɛ/2.0 d/1.6 ɪ/2.0 n/2.0 m/2.0 aɪ/2.0 h/2.0 æ/2.0 n/2.0 d/2.0 z/2.0 ɑː/1.2 n/1.2 æ/2.0 n/2.0 d/2.0 θ/1.8 ɔ/2.0 t/2.0
/vol/tensusers8/aparikh/hf_cache/so/speechocean762/WAVE/SPEAKER6121/061210069.WAV,AFTER A TIME HE TOOK UP HIS STORY,ɑː/2.0 f/2.0 t/2.0 ə/2.0 ə/2.0 t/2.0 aɪ/2.0 m/2.0 h/2.0 i/2.0 t/2.0 ʊ/2.0 k/2.0 ə/2.0 p/2.0 h/2.0 ɪ/2.0 z/1.6 s/2.0 t/2.0 ɔː/2.0 ɹ/2.0 i/2.0
/vol/tensusers8/aparikh/hf_cache/so/speechocean762/WAVE/SPEAKER6121/061210071.WAV,WHAT MORE DID SHE SAY,w/2.0 ə/2.0 t/2.0 m/2.0 ɔ/2.0 ɹ/2.0 d/2.0 ɪ/2.0 d/1.6 ʃ/2.0 i/1.8 s/2.0 eɪ/2.0
/vol/tensusers8/aparikh/hf_cache/so/speechocean762/WAVE/SPEAKER6121/061210075.WAV,GOT THAT HAVE YOU,ɡ/2.0 ə/2.0 t/1.6 ð/1.6 æ/2.0 t/2.0 h/2.0 æ/2.0 v/2.0 j/2.0 u/2.0
/vol/tensusers8/aparikh/hf_cache/so/speechocean762/WAVE/SPEAKER6121/061210086.WAV,HE DID IT FOR ME,h/2.0 i/2.0 d/2.0 ɪ/2.0 d/2.0 ɪ/2.0 t/2.0 f/2.0 ɔ/2.0 m/2.0 i/1.8
/vol/tensusers8/aparikh/hf_cache/so/speechocean762/WAVE/SPEAKER6121/061210095.WAV,THAT MADE ALL THE DIFFERENCE,ð/1.8 æ/2.0 t/2.0 m/2.0 eɪ/2.0 d/2.0 ɔ/2.0 l/2.0 ð/2.0 ə/2.0 d/2.0 ɪ/2.0 f/2.0 ɹ/2.0 ə/2.0 n/2.0 s/2.0
/vol/tensusers8/aparikh/hf_cache/so/speechocean762/WAVE/SPEAKER6121/061210109.WAV,I PASS HALF MY LIFE IN THE WOODS,aɪ/2.0 p/2.0 ɑ/2.0 s/2.0 h/2.0 ɑ/2.0 f/2.0 m/2.0 aɪ/2.0 l/2.0 aɪ/2.0 f/2.0 ɪ/2.0 n/2.0 ð/1.6 ə/2.0 w/2.0 ʊ/2.0 d/2.0 z/2.0
/vol/tensusers8/aparikh/hf_cache/so/speechocean762/WAVE/SPEAKER6121/061210128.WAV,DO I NEED TO TELL YOU THAT I WONDER,d/2.0 ʊ/1.8 aɪ/2.0 n/2.0 i/2.0 d/2.0 t/2.0 u/2.0 t/2.0 ɛ/2.0 l/2.0 j/2.0 u/2.0 ð/1.8 æ/2.0 t/2.0 aɪ/2.0 w/2.0 ʌ/2.0 n/2.0 d/2.0 ɚ/2.0
/vol/tensusers8/aparikh/hf_cache/so/speechocean762/WAVE/SPEAKER6121/061210129.WAV,OF COURSE I KNOW THAT ALL THIS IS VERY SERIOUS,ə/2.0 v/1.8 k/2.0 ɔ/2.0 ɹ/2.0 s/2.0 aɪ/2.0 n/2.0 oʊ/2.0 ð/2.0 æ/2.0 t/2.0 ɔ/2.0 l/2.0 ð/2.0 ɪ/2.0 s/2.0 ɪ/2.0 z/1.8 v/2.0 ɛ/2.0 ɹ/2.0 i/2.0 s/2.0 ɪ/2.0 ʌ/2.0 ɹ/2.0 ɪ/2.0 ə/2.0 s/2.0
/vol/tensusers8/aparikh/hf_cache/so/speechocean762/WAVE/SPEAKER6121/061210140.WAV,HISTORY IT IS NOT,h/2.0 ɪ/2.0 s/2.0 t/2.0 ɹ/2.0 i/2.0 ɪ/2.0 t/2.0 ɪ/2.0 z/2.0 n/2.0 ə/2.0 t/2.0
/vol/tensusers8/aparikh/hf_cache/so/speechocean762/WAVE/SPEAKER6121/061210141.WAV,THE PRETTY NURSE LOOKED QUITE SORRY,ð/2.0 ə/2.0 p/2.0 ɹ/2.0 ɪ/2.0 t/2.0 i/2.0 n/2.0 ɚ/2.0 s/2.0 l/2.0 ʊ/2.0 k/2.0 t/2.0 k/2.0 w/2.0 aɪ/2.0 t/2.0 s/2.0 ʌ/2.0 ɹ/2.0 i/2.0
/vol/tensusers8/aparikh/hf_cache/so/speechocean762/WAVE/SPEAKER6121/061210142.WAV,HE TOOK UP A BOOK,h/2.0 i/2.0 t/2.0 ʊ/2.0 k/2.0 ə/2.0 p/2.0 ə/2.0 b/2.0 ʊ/2.0 k/2.0
/vol/tensusers8/aparikh/hf_cache/so/speechocean762/WAVE/SPEAKER6121/061210147.WAV,MEN HOPED AND WERE AFRAID TO HOPE,m/2.0 ɛ/2.0 n/2.0 h/2.0 oʊ/2.0 p/2.0 t/2.0 æ/2.0 n/2.0 d/1.8 w/2.0 ɚ/2.0 ə/2.0 f/2.0 ɹ/2.0 eɪ/2.0 d/2.0 t/2.0 u/1.8 h/2.0 oʊ/2.0 p/2.0
/vol/tensusers8/aparikh/hf_cache/so/speechocean762/WAVE/SPEAKER6121/061210148.WAV,AND DID YOU HEAR NOTHING,æ/2.0 n/2.0 d/1.8 d/2.0 ɪ/2.0 d/2.0 j/2.0 u/1.8 h/2.0 ɪ/2.0 ə/2.0 n/2.0 ʌ/2.0 θ/2.0 ɪ/2.0 ŋ/2.0
/vol/tensusers8/aparikh/hf_cache/so/speechocean762/WAVE/SPEAKER6121/061210174.WAV,EVERYONE STARTED WITH SURPRISE,ɛ/2.0 v/2.0 ɹ/2.0 i/2.0 w/2.0 ə/2.0 n/2.0 s/2.0 t/2.0 ɑː/2.0 ɹ/2.0 t/2.0 ɪ/2.0 d/1.6 w/2.0 ɪ/2.0 ð/1.8 s/2.0 ə/2.0 p/2.0 ɹ/2.0 aɪ/2.0 z/1.6
/vol/tensusers8/aparikh/hf_cache/so/speechocean762/WAVE/SPEAKER6401/064010049.WAV,WHY BREAK EVERY TIE,w/2.0 aɪ/2.0 b/2.0 ɹ/2.0 eɪ/1.2 k/2.0 ɛ/2.0 v/2.0 ɹ/1.4 i/2.0 t/2.0 aɪ/2.0
/vol/tensusers8/aparikh/hf_cache/so/speechocean762/WAVE/SPEAKER6401/064010056.WAV,THE CHILDREN PRESENTLY RETURNED,ð/1.8 ə/2.0 tʃ/2.0 ɪ/2.0 l/2.0 d/1.4 ɹ/1.4 ə/1.8 n/2.0 p/2.0 ɹ/2.0 ɛ/2.0 z/1.4 n/2.0 t/2.0 l/2.0 i/2.0 ɹ/2.0 ɪ/2.0 t/2.0 ɜː/2.0 n/2.0 d/1.8
/vol/tensusers8/aparikh/hf_cache/so/speechocean762/WAVE/SPEAKER6401/064010057.WAV,THE GIRL STOPED SHORT,ð/2.0 ə/2.0 ɡ/2.0 ɚ/2.0 l/2.0 s/2.0 t/2.0 oʊ/1.4 p/2.0 t/2.0 ʃ/2.0 ɔ/2.0 t/2.0
/vol/tensusers8/aparikh/hf_cache/so/speechocean762/WAVE/SPEAKER6401/064010066.WAV,OR WHY DID NOT JOB GO,ɔ/2.0 w/2.0 aɪ/2.0 d/2.0 ɪ/1.6 d/1.6 n/2.0 ə/2.0 t/2.0 dʒ/2.0 ə/2.0 b/1.6 ɡ/2.0 oʊ/1.8
/vol/tensusers8/aparikh/hf_cache/so/speechocean762/WAVE/SPEAKER6401/064010067.WAV,THE HAND JUST WHERE HE WISHED,ð/1.6 ə/2.0 h/2.0 æ/2.0 n/2.0 d/2.0 dʒ/2.0 ə/2.0 s/2.0 t/2.0 w/2.0 ɛ/2.0 ɹ/2.0 h/2.0 i/2.0 w/2.0 ɪ/2.0 ʃ/2.0 t/2.0
/vol/tensusers8/aparikh/hf_cache/so/speechocean762/WAVE/SPEAKER6401/064010086.WAV,PROUD OLD FAMILIES I GUESS,p/2.0 ɹ/2.0 aʊ/1.2 d/2.0 oʊ/2.0 l/2.0 d/2.0 f/2.0 æ/2.0 m/2.0 ɪ/2.0 l/2.0 ɪ/2.0 z/1.6 aɪ/2.0 ɡ/2.0 ɛ/2.0 s/2.0
/vol/tensusers8/aparikh/hf_cache/so/speechocean762/WAVE/SPEAKER6401/064010092.WAV,CAMPED AT OUR OLD PLACE,k/2.0 æ/2.0 m/2.0 p/1.6 t/2.0 æ/2.0 t/2.0 aʊ/2.0 ɚ/2.0 oʊ/2.0 l/2.0 d/2.0 p/2.0 l/2.0 eɪ/2.0 s/2.0
/vol/tensusers8/aparikh/hf_cache/so/speechocean762/WAVE/SPEAKER6401/064010093.WAV,AND THEN MY AUNT USE TO CRY,æ/2.0 n/2.0 d/1.4 ð/2.0 ɛ/2.0 n/2.0 m/2.0 aɪ/2.0 æ/2.0 n/2.0 t/1.6 j/2.0 u/2.0 z/2.0 t/2.0 u/1.8 k/2.0 ɹ/2.0 aɪ/2.0
/vol/tensusers8/aparikh/hf_cache/so/speechocean762/WAVE/SPEAKER6401/064010103.WAV,SHE STAMPS HER FOOT,ʃ/2.0 i/2.0 s/2.0 t/2.0 æ/2.0 m/2.0 p/1.4 s/1.8 h/2.0 ɚ/2.0 f/2.0 ʊ/2.0 t/2.0
/vol/tensusers8/aparikh/hf_cache/so/speechocean762/WAVE/SPEAKER6401/064010107.WAV,OUR TRIP BEGAN BADLY,aʊ/2.0 ə/2.0 t/1.8 ɹ/1.8 ɪ/1.4 p/2.0 b/2.0 ɪ/2.0 ɡ/2.0 æ/2.0 n/2.0 b/2.0 æ/2.0 d/2.0 l/2.0 i/2.0
/vol/tensusers8/aparikh/hf_cache/so/speechocean762/WAVE/SPEAKER6401/064010109.WAV,WOULD SHE WIN HIM,w/2.0 ʊ/2.0 d/2.0 ʃ/2.0 i/1.8 w/2.0 ɪ/2.0 n/2.0 h/2.0 ɪ/2.0 m/2.0
/vol/tensusers8/aparikh/hf_cache/so/speechocean762/WAVE/SPEAKER6401/064010120.WAV,KNOWING CAME BY SEEING,n/2.0 oʊ/2.0 ɪ/2.0 ŋ/2.0 k/2.0 eɪ/1.6 m/1.6 b/1.8 aɪ/2.0 s/2.0 iː/1.2 ɪ/1.6 ŋ/1.6
/vol/tensusers8/aparikh/hf_cache/so/speechocean762/WAVE/SPEAKER6401/064010123.WAV,PRESENTLY THE SNOW CAME,p/2.0 ɹ/2.0 ɛ/0.8 z/1.0 n/2.0 t/2.0 l/2.0 i/2.0 ð/2.0 ə/2.0 s/2.0 n/2.0 oʊ/2.0 k/2.0 eɪ/2.0 m/1.8
/vol/tensusers8/aparikh/hf_cache/so/speechocean762/WAVE/SPEAKER6401/064010135.WAV,LIVELY NOW LIVELY MEN,l/2.0 aɪ/0.4 v/2.0 l/2.0 i/2.0 n/2.0 aʊ/2.0 l/2.0 aɪ/0.4 v/2.0 l/2.0 i/2.0 m/2.0 ɛ/2.0 n/2.0
/vol/tensusers8/aparikh/hf_cache/so/speechocean762/WAVE/SPEAKER6401/064010141.WAV,THREE MEN IN RED COAT CAME,θ/1.8 ɹ/2.0 i/2.0 m/2.0 ɛ/2.0 n/2.0 ɪ/2.0 n/2.0 ɹ/1.6 ɛ/2.0 d/2.0 k/2.0 oʊ/2.0 t/2.0 k/2.0 eɪ/2.0 m/2.0
/vol/tensusers8/aparikh/hf_cache/so/speechocean762/WAVE/SPEAKER6401/064010150.WAV,THE BOX WAS LARGE AND IMPORTANT NEAR THE STAGE,ð/1.8 ə/2.0 b/2.0 ə/2.0 k/2.0 s/2.0 w/2.0 ə/2.0 z/1.8 l/2.0 ɑ/2.0 ɹ/2.0 dʒ/2.0 æ/2.0 n/2.0 d/1.6 ɪ/2.0 m/1.8 p/2.0 ɔː/2.0 ɹ/2.0 t/2.0 n/2.0 t/2.0 n/2.0 ɪ/2.0 ə/2.0 ð/1.4 ə/2.0 s/1.6 t/0.4 eɪ/0.8 dʒ/1.6
/vol/tensusers8/aparikh/hf_cache/so/speechocean762/WAVE/SPEAKER6401/064010161.WAV,I WENT TO THE SEA WORLD TO SEE BEAUTIFUL FISHES,aɪ/2.0 w/2.0 ɛ/2.0 n/2.0 t/2.0 t/2.0 u/1.8 ð/1.8 ə/2.0 s/2.0 i/2.0 w/2.0 ɚ/2.0 l/1.6 d/1.8 t/2.0 u/1.8 s/2.0 i/2.0 b/2.0 j/2.0 uː/2.0 t/2.0 ɪ/1.6 f/2.0 l/2.0 f/2.0 ɪ/2.0 ʃ/2.0 ɪ/1.6 z/1.6
/vol/tensusers8/aparikh/hf_cache/so/speechocean762/WAVE/SPEAKER6401/064010164.WAV,ALL MEN JUMPPED THEIR HANDS,ɔ/2.0 l/2.0 m/2.0 ɛ/2.0 n/2.0 dʒ/2.0 ə/2.0 m/2.0 p/1.6 t/2.0 ð/1.8 ɛ/2.0 ɹ/2.0 h/2.0 æ/2.0 n/2.0 d/2.0 z/2.0 ɑː/1.2 n/1.2
/vol/tensusers8/aparikh/hf_cache/so/speechocean762/WAVE/SPEAKER6401/064010172.WAV,AN EXAMPLE MUST BE MADE,ə/2.0 n/2.0 ɪ/2.0 ɡ/1.8 z/1.4 æ/2.0 m/2.0 p/2.0 l/1.8 m/2.0 ə/2.0 s/2.0 t/2.0 b/2.0 i/1.8 m/2.0 eɪ/2.0 d/2.0
/vol/tensusers8/aparikh/hf_cache/so/speechocean762/WAVE/SPEAKER6401/064010173.WAV,MINUTE AFTER MINUTE WENT BY,m/2.0 ɪ/2.0 n/2.0 ɪ/2.0 t/1.0 ɑː/2.0 f/2.0 t/2.0 ə/2.0 m/2.0 ɪ/2.0 n/2.0 ɪ/2.0 t/1.0 w/2.0 ɛ/2.0 n/2.0 t/2.0 b/1.6 aɪ/1.2
/vol/tensusers8/aparikh/hf_cache/so/speechocean762/WAVE/SPEAKER6504/065040005.WAV,WE CANNOT TAKE FROM THEM WHAT THEY HAVE NOT GOT,w/2.0 i/1.8 k/2.0 æ/2.0 n/2.0 ə/2.0 t/2.0 t/2.0 eɪ/2.0 k/2.0 f/2.0 ɹ/2.0 ə/1.8 m/2.0 ð/2.0 ə/2.0 m/2.0 w/2.0 ə/1.8 t/2.0 ð/2.0 eɪ/2.0 h/2.0 æ/2.0 v/2.0 n/2.0 ə/2.0 t/2.0 ɡ/2.0 ə/2.0 t/2.0
/vol/tensusers8/aparikh/hf_cache/so/speechocean762/WAVE/SPEAKER6504/065040007.WAV,THEN SHE TURNED AND WENT,ð/2.0 ɛ/2.0 n/2.0 ʃ/2.0 i/2.0 t/2.0 ɚ/2.0 n/2.0 d/2.0 ə/2.0 n/2.0 d/2.0 w/2.0 ɛ/2.0 n/2.0 t/2.0
/vol/tensusers8/aparikh/hf_cache/so/speechocean762/WAVE/SPEAKER6504/065040009.WAV,THERE IS ALREADY A PRETTY LARGER COLLECTION,ð/2.0 ɛ/2.0 ɹ/2.0 ɪ/2.0 z/2.0 ɔ/2.0 l/2.0 ɹ/2.0 ɛ/2.0 d/2.0 i/2.0 ə/2.0 p/2.0 ɹ/2.0 ɪ/2.0 t/2.0 i/2.0 l/2.0 ɑː/2.0 ɹ/1.6 dʒ/2.0 ɚ/1.6 k/2.0 ə/2.0 l/2.0 ɛ/2.0 k/2.0 ʃ/2.0 n/2.0
/vol/tensusers8/aparikh/hf_cache/so/speechocean762/WAVE/SPEAKER6504/065040011.WAV,I DID NOT GO NEAR THE TREE,aɪ/2.0 d/2.0 ɪ/2.0 d/2.0 n/2.0 ə/2.0 t/2.0 ɡ/2.0 oʊ/2.0 n/2.0 ɪ/2.0 ə/2.0 ð/2.0 ə/2.0 t/2.0 ɹ/2.0 i/2.0
/vol/tensusers8/aparikh/hf_cache/so/speechocean762/WAVE/SPEAKER6504/065040028.WAV,I DO NOT WONDER AT HER FLYING FROM HIM,aɪ/2.0 d/2.0 ʊ/1.8 n/2.0 ə/2.0 t/2.0 w/2.0 ʌ/1.8 n/2.0 d/2.0 ɚ/2.0 æ/2.0 t/2.0 h/2.0 ɚ/2.0 f/2.0 l/2.0 aɪ/2.0 ɪ/2.0 ŋ/2.0 f/2.0 ɹ/2.0 ə/2.0 m/2.0 h/2.0 ɪ/2.0 m/2.0
/vol/tensusers8/aparikh/hf_cache/so/speechocean762/WAVE/SPEAKER6504/065040042.WAV,FOR YEARS THIS WENT ON,f/2.0 ɔ/2.0 j/2.0 ɪ/2.0 ə/2.0 ɹ/2.0 z/1.6 ð/2.0 ɪ/2.0 s/2.0 w/2.0 ɛ/2.0 n/2.0 t/2.0 ə/1.8 n/2.0
/vol/tensusers8/aparikh/hf_cache/so/speechocean762/WAVE/SPEAKER6504/065040044.WAV,YOUR MOTHER WILL RIDE HOME WITH ME,j/2.0 ɔ/1.8 m/2.0 ʌ/2.0 ð/2.0 ɚ/2.0 w/2.0 ɪ/2.0 l/1.8 ɹ/2.0 aɪ/2.0 d/2.0 h/2.0 oʊ/1.8 m/2.0 w/2.0 ɪ/2.0 ð/1.6 m/2.0 i/1.8
/vol/tensusers8/aparikh/hf_cache/so/speechocean762/WAVE/SPEAKER6504/065040045.WAV,SHE WENT OUT WITH DIRTY CAPS,ʃ/2.0 i/1.8 w/2.0 ɛ/2.0 n/2.0 t/2.0 aʊ/2.0 t/2.0 w/2.0 ɪ/2.0 ð/1.6 d/2.0 ɜː/2.0 t/2.0 i/2.0 k/2.0 æ/2.0 p/2.0 s/2.0
/vol/tensusers8/aparikh/hf_cache/so/speechocean762/WAVE/SPEAKER6504/065040049.WAV,YOU MUST DECIDE FOR YOURSELF,j/2.0 u/2.0 m/2.0 ə/2.0 s/2.0 t/2.0 d/2.0 ɪ/2.0 s/2.0 aɪ/2.0 d/2.0 f/2.0 ɔ/2.0 j/2.0 ɔ/2.0 s/2.0 ɛ/2.0 l/2.0 f/2.0
/vol/tensusers8/aparikh/hf_cache/so/speechocean762/WAVE/SPEAKER6504/065040077.WAV,SO THEY WENT INTO THE LIBRARY,s/2.0 oʊ/2.0 ð/2.0 eɪ/2.0 w/2.0 ɛ/2.0 n/2.0 t/2.0 ɪ/2.0 n/2.0 t/2.0 u/1.8 ð/2.0 ə/2.0 l/2.0 aɪ/2.0 b/2.0 ɹ/1.6 ɚ/1.6 i/2.0
/vol/tensusers8/aparikh/hf_cache/so/speechocean762/WAVE/SPEAKER6504/065040112.WAV,YOU FOLLOW MY MEANING,j/2.0 u/1.8 f/2.0 ʌ/2.0 l/2.0 oʊ/2.0 m/2.0 aɪ/2.0 m/2.0 iː/2.0 n/2.0 ɪ/2.0 ŋ/2.0
/vol/tensusers8/aparikh/hf_cache/so/speechocean762/WAVE/SPEAKER6504/065040118.WAV,HOW ON EARTH DID HE GET THERE,h/2.0 aʊ/2.0 ə/2.0 n/2.0 ɚ/2.0 θ/2.0 d/2.0 ɪ/2.0 d/2.0 h/2.0 i/1.8 ɡ/2.0 ɛ/2.0 t/2.0 ð/2.0 ɛ/2.0 ɹ/2.0
/vol/tensusers8/aparikh/hf_cache/so/speechocean762/WAVE/SPEAKER6504/065040124.WAV,THIS IS BECAUSE THEY EAT MEN,ð/1.8 ɪ/2.0 s/2.0 ɪ/2.0 z/1.8 b/2.0 ɪ/2.0 k/2.0 ɔː/2.0 z/1.6 ð/2.0 eɪ/2.0 i/2.0 t/2.0 m/2.0 ɛ/2.0 n/2.0
/vol/tensusers8/aparikh/hf_cache/so/speechocean762/WAVE/SPEAKER6504/065040125.WAV,I ASK FOR THE LAST TIME,aɪ/2.0 ɑ/2.0 s/2.0 k/2.0 f/2.0 ɔ/2.0 ð/2.0 ə/2.0 l/2.0 ɑ/2.0 s/2.0 t/1.8 t/2.0 aɪ/2.0 m/2.0
/vol/tensusers8/aparikh/hf_cache/so/speechocean762/WAVE/SPEAKER6504/065040126.WAV,I WENT UP TO HIM,aɪ/2.0 w/2.0 ɛ/2.0 n/2.0 t/2.0 ə/2.0 p/2.0 t/2.0 u/1.8 h/2.0 ɪ/2.0 m/2.0
/vol/tensusers8/aparikh/hf_cache/so/speechocean762/WAVE/SPEAKER6504/065040127.WAV,I TOOK THE BOOK FROM HER,aɪ/2.0 t/2.0 ʊ/2.0 k/2.0 ð/2.0 ə/2.0 b/2.0 ʊ/2.0 k/2.0 f/2.0 ɹ/2.0 ə/2.0 m/2.0 h/2.0 ɚ/2.0
/vol/tensusers8/aparikh/hf_cache/so/speechocean762/WAVE/SPEAKER6504/065040133.WAV,WITH THAT FOR A START ALL MAY BE LEARNED,w/2.0 ɪ/2.0 ð/2.0 ð/2.0 æ/2.0 t/2.0 f/2.0 ɔ/2.0 ə/1.8 s/2.0 t/2.0 ɑ/2.0 t/2.0 ɔ/2.0 l/2.0 m/2.0 eɪ/2.0 b/2.0 i/1.8 l/2.0 ɜː/2.0 n/2.0 ɪ/1.8 d/1.6
/vol/tensusers8/aparikh/hf_cache/so/speechocean762/WAVE/SPEAKER6504/065040134.WAV,SHE HAD TO CHOOSE WHAT TO SAY,ʃ/2.0 i/1.8 h/2.0 æ/2.0 d/2.0 t/2.0 u/1.8 tʃ/2.0 u/2.0 z/2.0 w/2.0 ə/2.0 t/2.0 t/2.0 u/1.8 s/2.0 eɪ/2.0
/vol/tensusers8/aparikh/hf_cache/so/speechocean762/WAVE/SPEAKER6504/065040137.WAV,SHE DID NOT KNOW WHAT TO SAY,ʃ/2.0 i/1.8 d/2.0 ɪ/2.0 d/2.0 n/2.0 ə/2.0 t/2.0 n/2.0 oʊ/2.0 w/2.0 ə/2.0 t/2.0 t/2.0 u/1.8 s/2.0 eɪ/2.0
/vol/tensusers8/aparikh/hf_cache/so/speechocean762/WAVE/SPEAKER6504/065040160.WAV,HE MADE IT HIS HOME,h/2.0 i/1.8 m/2.0 eɪ/2.0 d/2.0 ɪ/2.0 t/2.0 h/2.0 ɪ/2.0 z/1.8 h/2.0 oʊ/1.8 m/2.0
/vol/tensusers8/aparikh/hf_cache/so/speechocean762/WAVE/SPEAKER6912/069120003.WAV,AND SHE TURNED AND WENT AWAY WITHOUT A WORD,æ/2.0 n/2.0 d/2.0 ʃ/2.0 i/2.0 t/2.0 ɚ/2.0 n/2.0 d/2.0 æ/2.0 n/2.0 d/2.0 w/2.0 ɛ/2.0 n/2.0 t/2.0 ə/2.0 w/2.0 eɪ/2.0 w/2.0 ɪ/2.0 ð/2.0 aʊ/2.0 t/2.0 ə/2.0 w/2.0 ɚ/2.0 d/2.0
/vol/tensusers8/aparikh/hf_cache/so/speechocean762/WAVE/SPEAKER6912/069120014.WAV,WE ENTERED THE ROOM,w/0.8 i/0.0 ɛ/2.0 n/2.0 t/2.0 ə/1.8 d/1.4 ð/2.0 ə/2.0 ɹ/2.0 ʊ/2.0 m/1.6
/vol/tensusers8/aparikh/hf_cache/so/speechocean762/WAVE/SPEAKER6912/069120020.WAV,AFTER ALL WHAT DID IT MATTER,ɑː/2.0 f/2.0 t/2.0 ə/2.0 ɔ/2.0 l/2.0 w/2.0 ə/2.0 t/2.0 d/2.0 ɪ/2.0 d/2.0 ɪ/2.0 t/2.0 m/2.0 æ/2.0 t/2.0 ɚ/2.0
/vol/tensusers8/aparikh/hf_cache/so/speechocean762/WAVE/SPEAKER6912/069120025.WAV,BUT IT DID NOT COME,b/2.0 ə/2.0 t/2.0 ɪ/2.0 t/2.0 d/2.0 ɪ/2.0 d/2.0 n/2.0 ə/2.0 t/2.0 k/2.0 ə/2.0 m/2.0
/vol/tensusers8/aparikh/hf_cache/so/speechocean762/WAVE/SPEAKER6912/069120052.WAV,AND THEN WHAT DID SHE DO,æ/2.0 n/2.0 d/1.8 ð/2.0 ɛ/2.0 n/2.0 w/2.0 ə/2.0 t/1.8 d/2.0 ɪ/2.0 d/2.0 ʃ/2.0 i/1.8 d/2.0 ʊ/1.8
/vol/tensusers8/aparikh/hf_cache/so/speechocean762/WAVE/SPEAKER6912/069120059.WAV,THEY DID NOT SEE THEM ANY MORE,ð/2.0 eɪ/2.0 d/2.0 ɪ/2.0 d/1.6 n/2.0 ə/0.8 t/2.0 s/2.0 i/2.0 ð/2.0 ɛ/1.6 m/2.0 ɛ/2.0 n/2.0 i/1.6 m/2.0 ɔ/2.0
/vol/tensusers8/aparikh/hf_cache/so/speechocean762/WAVE/SPEAKER6912/069120061.WAV,HOW WELL DID I KNOW HER,h/2.0 aʊ/2.0 w/2.0 ɛ/1.6 l/2.0 d/2.0 ɪ/2.0 d/2.0 aɪ/2.0 n/2.0 oʊ/2.0 h/2.0 ɚ/2.0
/vol/tensusers8/aparikh/hf_cache/so/speechocean762/WAVE/SPEAKER6912/069120072.WAV,IT TURNED US TO SILK,ɪ/2.0 t/2.0 t/2.0 ɚ/2.0 n/2.0 d/1.6 ə/2.0 s/2.0 t/2.0 u/1.8 s/1.6 ɪ/0.0 l/0.0 k/0.0
/vol/tensusers8/aparikh/hf_cache/so/speechocean762/WAVE/SPEAKER6912/069120083.WAV,MY FRIENDS FOUND WATER,m/2.0 aɪ/2.0 f/2.0 ɹ/2.0 ɛ/2.0 n/2.0 d/2.0 z/2.0 f/2.0 aʊ/2.0 n/2.0 d/2.0 w/2.0 ɔː/1.8 t/2.0 ɚ/2.0
/vol/tensusers8/aparikh/hf_cache/so/speechocean762/WAVE/SPEAKER6912/069120087.WAV,SO PRETTY AND SO YOUNG,s/2.0 oʊ/2.0 p/2.0 ɹ/2.0 ɪ/2.0 t/2.0 i/2.0 æ/2.0 n/2.0 d/2.0 s/2.0 oʊ/2.0 j/2.0 ə/2.0 ŋ/2.0
/vol/tensusers8/aparikh/hf_cache/so/speechocean762/WAVE/SPEAKER6912/069120092.WAV,TOGETHER THEY HELD HIM UP,t/2.0 ə/2.0 ɡ/2.0 ɛ/2.0 ð/2.0 ɚ/2.0 ð/2.0 eɪ/2.0 h/2.0 ɛ/1.6 l/1.2 d/2.0 h/2.0 ɪ/2.0 m/2.0 ə/2.0 p/2.0
/vol/tensusers8/aparikh/hf_cache/so/speechocean762/WAVE/SPEAKER6912/069120093.WAV,I GOT UP AND CROSSED THE ROOM TO HIM,aɪ/2.0 ɡ/2.0 ə/2.0 t/2.0 ə/2.0 p/2.0 æ/2.0 n/2.0 d/2.0 k/2.0 ɹ/2.0 ə/2.0 s/2.0 t/2.0 ð/2.0 ə/2.0 ɹ/2.0 u/2.0 m/2.0 t/2.0 u/1.8 h/2.0 ɪ/2.0 m/1.8
/vol/tensusers8/aparikh/hf_cache/so/speechocean762/WAVE/SPEAKER6912/069120094.WAV,SHE WANTED TO QUESTION HIM,ʃ/2.0 i/1.8 w/2.0 ɑː/2.0 n/2.0 t/2.0 ɪ/2.0 d/1.6 t/2.0 u/1.8 k/2.0 w/2.0 ɛ/2.0 s/2.0 tʃ/2.0 ə/2.0 n/2.0 h/2.0 ɪ/2.0 m/2.0
/vol/tensusers8/aparikh/hf_cache/so/speechocean762/WAVE/SPEAKER6912/069120106.WAV,THEN I TOOK HIS CHILD THERE,ð/2.0 ɛ/2.0 n/2.0 aɪ/2.0 t/2.0 ʊ/2.0 k/2.0 h/2.0 ɪ/2.0 z/1.8 tʃ/2.0 aɪ/2.0 l/1.6 d/2.0 ð/2.0 ɛ/1.4 ɹ/1.4
/vol/tensusers8/aparikh/hf_cache/so/speechocean762/WAVE/SPEAKER6912/069120121.WAV,I WOULD NOT MYSELF SAY THAT IT IS SO,aɪ/2.0 w/2.0 ʊ/2.0 d/2.0 n/2.0 ə/2.0 t/2.0 m/2.0 aɪ/2.0 s/2.0 ɛ/2.0 l/2.0 f/2.0 s/2.0 eɪ/2.0 ð/2.0 æ/2.0 t/2.0 ɪ/2.0 t/2.0 ɪ/2.0 z/1.8 s/2.0 oʊ/2.0
/vol/tensusers8/aparikh/hf_cache/so/speechocean762/WAVE/SPEAKER6912/069120123.WAV,DID I PLEASE YOU,d/2.0 ɪ/2.0 d/2.0 aɪ/2.0 p/2.0 l/2.0 i/2.0 z/1.6 j/2.0 u/2.0
/vol/tensusers8/aparikh/hf_cache/so/speechocean762/WAVE/SPEAKER6912/069120140.WAV,HE STOOD AWAY FROM HER IN HIS SHAME,h/2.0 i/2.0 s/2.0 t/2.0 ʊ/2.0 d/2.0 ə/2.0 w/2.0 eɪ/2.0 f/2.0 ɹ/2.0 ə/1.8 m/2.0 h/2.0 ɚ/2.0 ɪ/2.0 n/2.0 h/2.0 ɪ/2.0 z/1.6 ʃ/2.0 eɪ/2.0 m/1.4
/vol/tensusers8/aparikh/hf_cache/so/speechocean762/WAVE/SPEAKER6912/069120151.WAV,SHE HELD HER HAND TO HIM,ʃ/2.0 i/2.0 h/2.0 ɛ/0.8 l/0.4 d/2.0 h/2.0 ɚ/2.0 h/2.0 æ/2.0 n/2.0 d/2.0 t/2.0 u/1.8 h/2.0 ɪ/2.0 m/2.0
/vol/tensusers8/aparikh/hf_cache/so/speechocean762/WAVE/SPEAKER6912/069120165.WAV,SHE MADE ME BETTER LAST NIGHT,ʃ/2.0 i/1.8 m/2.0 eɪ/2.0 d/2.0 m/2.0 i/2.0 b/2.0 ɛ/2.0 t/2.0 ɚ/2.0 l/2.0 ɑ/2.0 s/2.0 t/2.0 n/2.0 aɪ/2.0 t/2.0
/vol/tensusers8/aparikh/hf_cache/so/speechocean762/WAVE/SPEAKER6912/069120170.WAV,BUT WE HAVE LOST THE BEST OF MEN,b/2.0 ə/2.0 t/2.0 w/2.0 i/2.0 h/2.0 æ/2.0 v/0.4 l/2.0 ə/2.0 s/2.0 t/2.0 ð/2.0 ə/2.0 b/2.0 ɛ/2.0 s/2.0 t/2.0 ə/2.0 v/1.8 m/2.0 ɛ/2.0 n/2.0
/vol/tensusers8/aparikh/hf_cache/so/speechocean762/WAVE/SPEAKER7001/070010001.WAV,IT WAS GOOD FOR ME,ɪ/2.0 t/2.0 w/2.0 ə/2.0 z/1.6 ɡ/2.0 ʊ/0.0 d/2.0 f/2.0 ɔ/2.0 m/2.0 i/2.0
/vol/tensusers8/aparikh/hf_cache/so/speechocean762/WAVE/SPEAKER7001/070010002.WAV,WE HAVE CLIMBED ONE STEP UP THE LADDER,w/2.0 i/1.8 h/2.0 æ/2.0 v/2.0 k/2.0 l/2.0 aɪ/0.8 m/0.8 d/2.0 w/2.0 ə/2.0 n/2.0 s/2.0 t/2.0 ɛ/2.0 p/2.0 ə/2.0 p/2.0 ð/2.0 ə/2.0 l/2.0 æ/0.4 d/2.0 ə/1.8
