audiofilepath,transcript,phoneme_scores
/vol/tensusers8/aparikh/hf_cache/so/speechocean762/WAVE/SPEAKER2402/024020265.WAV,HANGING OUT AT THE BEACH,h/2.0 æ/1.8 ŋ/2.0 ɪ/2.0 ŋ/2.0 aʊ/2.0 t/2.0 æ/2.0 t/2.0 ð/2.0 ə/1.8 b/2.0 i/2.0 tʃ/2.0
/vol/tensusers8/aparikh/hf_cache/so/speechocean762/WAVE/SPEAKER2402/024020291.WAV,THE MOST BEAUTIFUL WOMAN IN THE UNIVERSE,ð/2.0 ə/2.0 m/2.0 oʊ/2.0 s/2.0 t/2.0 b/2.0 j/2.0 uː/2.0 t/2.0 ɪ/2.0 f/2.0 l/2.0 w/2.0 ʊ/2.0 m/2.0 ə/2.0 n/2.0 ɪ/2.0 n/2.0 ð/2.0 ə/2.0 j/2.0 uː/2.0 n/2.0 ɪ/2.0 v/2.0 ɚ/2.0 s/2.0
/vol/tensusers8/aparikh/hf_cache/so/speechocean762/WAVE/SPEAKER2402/024020321.WAV,IT IS NOW TWO O'CLOCK,ɪ/2.0 t/2.0 ɪ/2.0 z/1.8 n/2.0 aʊ/2.0 t/2.0 u/2.0 ə/2.0 k/2.0 l/2.0 ʌ/2.0 k/2.0
/vol/tensusers8/aparikh/hf_cache/so/speechocean762/WAVE/SPEAKER2402/024020328.WAV,HE WAS TWENTY WHEN HE LEARNED THE TRUTH ABOUT HIMSELF,h/2.0 i/1.8 w/2.0 ə/2.0 z/1.8 t/2.0 w/2.0 ɛ/2.0 n/2.0 t/2.0 i/2.0 w/2.0 ɛ/1.6 n/2.0 h/2.0 i/1.8 l/2.0 ɜː/2.0 n/2.0 ɪ/1.2 d/2.0 ð/2.0 ə/2.0 t/2.0 ɹ/2.0 u/2.0 θ/2.0 ə/2.0 b/2.0 aʊ/2.0 t/1.8 h/2.0 ɪ/2.0 m/2.0 s/2.0 ɛ/2.0 l/2.0 f/1.8
/vol/tensusers8/aparikh/hf_cache/so/speechocean762/WAVE/SPEAKER2402/024020337.WAV,I WISH YOU TO TAKE CARE OF THESE TWO LETTERS,aɪ/2.0 w/2.0 ɪ/2.0 ʃ/2.0 j/2.0 u/1.8 t/2.0 u/2.0 t/2.0 eɪ/2.0 k/2.0 k/2.0 ɛ/2.0 ɹ/2.0 ə/1.8 v/2.0 ð/2.0 i/2.0 z/1.8 t/2.0 u/2.0 l/2.0 ɛ/2.0 t/2.0 ə/2.0 z/1.8
/vol/tensusers8/aparikh/hf_cache/so/speechocean762/WAVE/SPEAKER2427/024270011.WAV,MORE SNOW WAS IN THE FORECAST FOR MONDAY NIGHT,m/2.0 ɔ/2.0 s/2.0 n/2.0 oʊ/2.0 w/2.0 ə/2.0 z/1.8 ɪ/2.0 n/2.0 ð/2.0 ə/2.0 f/2.0 ɔː/2.0 k/2.0 ɑ/2.0 s/2.0 t/2.0 f/2.0 ɔ/2.0 m/2.0 ʌ/1.8 n/1.8 d/2.0 eɪ/2.0 n/2.0 aɪ/2.0 t/2.0
/vol/tensusers8/aparikh/hf_cache/so/speechocean762/WAVE/SPEAKER2427/024270019.WAV,IN THIS CASE IT'S NOT NECESSARY,ɪ/2.0 n/2.0 ð/2.0 ɪ/2.0 s/2.0 k/2.0 eɪ/2.0 s/2.0 ɪ/2.0 t/2.0 s/2.0 n/2.0 ə/2.0 t/2.0 n/2.0 ɛ/2.0 s/2.0 ə/1.6 s/2.0 ɚ/2.0 i/2.0
/vol/tensusers8/aparikh/hf_cache/so/speechocean762/WAVE/SPEAKER2427/024270028.WAV,TODAY THEY ARE MORE DYNAMIC AND MORE HUMANE,t/2.0 ə/2.0 d/2.0 eɪ/2.0 ð/2.0 eɪ/2.0 ɑ/2.0 ɹ/2.0 m/2.0 ɔ/2.0 ɹ/2.0 d/2.0 aɪ/2.0 n/2.0 æ/2.0 m/2.0 ɪ/2.0 k/2.0 æ/2.0 n/2.0 d/2.0 m/2.0 ɔ/2.0 ɹ/2.0 h/2.0 j/2.0 u/2.0 m/2.0 eɪ/1.8 n/1.6
/vol/tensusers8/aparikh/hf_cache/so/speechocean762/WAVE/SPEAKER2427/024270051.WAV,OTHERS ARE NOT QUITE SO SURE HOWEVER,ə/2.0 ð/2.0 ɚ/2.0 z/1.6 ɑ/2.0 n/2.0 ə/2.0 t/2.0 k/2.0 w/2.0 aɪ/2.0 t/1.8 s/2.0 oʊ/2.0 ʃ/2.0 ʊ/2.0 ə/2.0 h/2.0 aʊ/2.0 ɛ/2.0 v/2.0 ɚ/2.0
/vol/tensusers8/aparikh/hf_cache/so/speechocean762/WAVE/SPEAKER2427/024270053.WAV,THEY ARE SO DEEP IN TALENT,ð/2.0 eɪ/2.0 ɑ/2.0 s/2.0 oʊ/2.0 d/2.0 i/2.0 p/2.0 ɪ/2.0 n/2.0 t/2.0 æ/2.0 l/2.0 ə/2.0 n/2.0 t/2.0
/vol/tensusers8/aparikh/hf_cache/so/speechocean762/WAVE/SPEAKER2427/024270057.WAV,EACH TEAM STARTS AT THE SAME TIME,i/2.0 tʃ/2.0 t/2.0 i/2.0 m/2.0 s/2.0 t/2.0 ɑ/2.0 ɹ/2.0 t/2.0 s/2.0 æ/2.0 t/2.0 ð/2.0 ə/2.0 s/2.0 eɪ/2.0 m/2.0 t/2.0 aɪ/2.0 m/1.4
/vol/tensusers8/aparikh/hf_cache/so/speechocean762/WAVE/SPEAKER2427/024270077.WAV,BUT I SAW IT AGAIN,b/2.0 ə/2.0 t/1.6 aɪ/2.0 s/2.0 ɔ/2.0 ɪ/2.0 t/2.0 ə/2.0 ɡ/2.0 ɛ/1.6 n/2.0
/vol/tensusers8/aparikh/hf_cache/so/speechocean762/WAVE/SPEAKER2427/024270127.WAV,WE WERE TALKING ABOUT SOCCER,w/2.0 i/2.0 w/2.0 ɚ/2.0 t/2.0 ɔː/2.0 k/2.0 ɪ/2.0 ŋ/2.0 ə/2.0 b/2.0 aʊ/2.0 t/1.8 s/2.0 ʌ/2.0 k/2.0 ə/2.0
/vol/tensusers8/aparikh/hf_cache/so/speechocean762/WAVE/SPEAKER2427/024270155.WAV,BACK AND AT JUST THE RIGHT TIME,b/2.0 æ/2.0 k/2.0 æ/2.0 n/2.0 d/1.8 æ/2.0 t/2.0 dʒ/2.0 ə/1.6 s/2.0 t/2.0 ð/1.2 ə/1.2 ɹ/2.0 aɪ/2.0 t/2.0 t/2.0 aɪ/2.0 m/1.4
/vol/tensusers8/aparikh/hf_cache/so/speechocean762/WAVE/SPEAKER2427/024270168.WAV,WHAT DO YOU THINK THOSE ARE,w/2.0 ə/1.8 t/2.0 d/2.0 ʊ/1.8 j/2.0 u/1.8 θ/2.0 ɪ/2.0 ŋ/2.0 k/2.0 ð/2.0 oʊ/2.0 z/1.8 ɑ/2.0 ɹ/2.0
/vol/tensusers8/aparikh/hf_cache/so/speechocean762/WAVE/SPEAKER2427/024270176.WAV,STILL WAITING FOR IT TO HAPPEN,s/2.0 t/2.0 ɪ/2.0 l/2.0 w/2.0 eɪ/2.0 t/2.0 ɪ/2.0 ŋ/2.0 f/2.0 ɔ/2.0 ɪ/2.0 t/1.8 t/2.0 u/2.0 h/2.0 æ/2.0 p/2.0 ə/2.0 n/2.0
/vol/tensusers8/aparikh/hf_cache/so/speechocean762/WAVE/SPEAKER2427/024270178.WAV,LOOKS TO BE WORTH THE WAIT,l/2.0 ʊ/0.0 k/2.0 s/2.0 t/2.0 u/1.8 b/2.0 i/2.0 w/2.0 ɚ/2.0 θ/2.0 ð/2.0 ə/2.0 w/2.0 eɪ/2.0 t/2.0
/vol/tensusers8/aparikh/hf_cache/so/speechocean762/WAVE/SPEAKER2427/024270183.WAV,FEELS SO GOOD TO BE BACK TOGETHER,f/2.0 i/2.0 l/2.0 z/1.8 s/2.0 oʊ/2.0 ɡ/2.0 ʊ/2.0 d/2.0 t/2.0 u/2.0 b/2.0 i/2.0 b/2.0 æ/2.0 k/2.0 t/2.0 ə/2.0 ɡ/2.0 ɛ/2.0 ð/2.0 ɚ/2.0
/vol/tensusers8/aparikh/hf_cache/so/speechocean762/WAVE/SPEAKER2427/024270197.WAV,LISTEN TO IT IN ALL ITS GLORY,l/2.0 ɪ/2.0 s/2.0 n/2.0 t/2.0 u/2.0 ɪ/2.0 t/1.8 ɪ/2.0 n/2.0 ɔ/2.0 l/2.0 ɪ/2.0 t/2.0 s/2.0 ɡ/2.0 l/2.0 ɔ/2.0 ɹ/2.0 i/2.0
/vol/tensusers8/aparikh/hf_cache/so/speechocean762/WAVE/SPEAKER2427/024270206.WAV,MASKS ARE PART OF UNIFORM,m/2.0 ɑ/2.0 s/2.0 k/2.0 s/2.0 ɑ/2.0 ɹ/2.0 p/2.0 ɑ/2.0 ɹ/2.0 t/2.0 ə/2.0 v/1.8 j/2.0 uː/2.0 n/2.0 ɪ/2.0 f/2.0 ɔ/2.0 m/1.4
/vol/tensusers8/aparikh/hf_cache/so/speechocean762/WAVE/SPEAKER2427/024270245.WAV,WHEN IS IT TIME TO TALK ABOUT GUNS,w/2.0 ɛ/2.0 n/2.0 ɪ/2.0 z/2.0 ɪ/2.0 t/2.0 t/2.0 aɪ/2.0 m/2.0 t/2.0 u/2.0 t/2.0 ɔ/2.0 k/2.0 ə/2.0 b/2.0 aʊ/2.0 t/1.8 ɡ/2.0 ə/1.8 n/1.6 z/1.8
/vol/tensusers8/aparikh/hf_cache/so/speechocean762/WAVE/SPEAKER2427/024270270.WAV,THIS IS NOT A NICE STORY IT'S TRUE,ð/2.0 ɪ/2.0 s/2.0 ɪ/2.0 z/2.0 n/2.0 ə/2.0 t/2.0 ə/2.0 n/2.0 aɪ/2.0 s/2.0 s/2.0 t/2.0 ɔː/2.0 ɹ/2.0 i/2.0 ɪ/2.0 t/2.0 s/2.0 t/2.0 ɹ/2.0 u/2.0
/vol/tensusers8/aparikh/hf_cache/so/speechocean762/WAVE/SPEAKER2427/024270292.WAV,WE SHOULD TOTALLY GO FOR A WALK,w/2.0 i/2.0 ʃ/2.0 ʊ/2.0 d/2.0 t/2.0 oʊ/2.0 t/2.0 ə/1.6 l/2.0 i/2.0 ɡ/2.0 oʊ/2.0 f/2.0 ɔ/2.0 ə/2.0 w/2.0 ɔ/2.0 k/2.0
/vol/tensusers8/aparikh/hf_cache/so/speechocean762/WAVE/SPEAKER2427/024270313.WAV,BUT THEY MUST DO IT,b/2.0 ə/2.0 t/1.8 ð/2.0 eɪ/2.0 m/2.0 ə/2.0 s/2.0 t/2.0 d/2.0 ʊ/1.8 ɪ/2.0 t/1.8
/vol/tensusers8/aparikh/hf_cache/so/speechocean762/WAVE/SPEAKER2427/024270336.WAV,AND NOW IT'S MY TURN,æ/2.0 n/2.0 d/1.8 n/2.0 aʊ/2.0 ɪ/2.0 t/2.0 s/2.0 m/2.0 aɪ/2.0 t/2.0 ɚ/2.0 n/1.8
/vol/tensusers8/aparikh/hf_cache/so/speechocean762/WAVE/SPEAKER2430/024300001.WAV,THERE MAY BE A WAY TO CHANGE ALL THAT,ð/2.0 ɛ/2.0 ɹ/2.0 m/2.0 eɪ/2.0 b/2.0 i/2.0 ə/2.0 w/2.0 eɪ/2.0 t/2.0 u/1.6 tʃ/2.0 eɪ/2.0 n/2.0 dʒ/2.0 ɔ/2.0 l/2.0 ð/2.0 æ/2.0 t/2.0
/vol/tensusers8/aparikh/hf_cache/so/speechocean762/WAVE/SPEAKER2430/024300052.WAV,NOW HE'S OPEN HE CAN SELL IT TO YOU,n/2.0 aʊ/2.0 h/2.0 i/2.0 z/1.8 oʊ/2.0 p/2.0 ə/1.6 n/2.0 h/2.0 i/1.8 k/2.0 æ/2.0 n/2.0 s/2.0 ɛ/2.0 l/2.0 ɪ/2.0 t/2.0 t/2.0 u/2.0 j/2.0 u/2.0
/vol/tensusers8/aparikh/hf_cache/so/speechocean762/WAVE/SPEAKER2430/024300061.WAV,IT WAS A NEW MARKET,ɪ/2.0 t/2.0 w/2.0 ə/2.0 z/1.8 ə/2.0 n/2.0 j/2.0 u/2.0 m/2.0 ɑː/2.0 ɹ/2.0 k/2.0 ɪ/2.0 t/1.6
/vol/tensusers8/aparikh/hf_cache/so/speechocean762/WAVE/SPEAKER2430/024300063.WAV,COULD YOU PUT HIM ON THE BOARD,k/2.0 ʊ/2.0 d/2.0 j/2.0 u/1.8 p/2.0 ʊ/2.0 t/1.8 h/2.0 ɪ/2.0 m/2.0 ə/2.0 n/2.0 ð/2.0 ə/2.0 b/2.0 ɔ/2.0 ɹ/2.0 d/1.8
/vol/tensusers8/aparikh/hf_cache/so/speechocean762/WAVE/SPEAKER2430/024300065.WAV,HE WAS NOT SUPPORTED BY THE PARTY THERE,h/2.0 i/2.0 w/2.0 ə/2.0 z/1.8 n/2.0 ə/2.0 t/2.0 s/2.0 ə/2.0 p/2.0 oʊ/2.0 ɹ/2.0 t/2.0 ɪ/2.0 d/2.0 b/2.0 aɪ/2.0 ð/2.0 ə/2.0 p/2.0 ɑː/2.0 ɹ/1.6 t/2.0 i/0.8 ð/2.0 ɛ/2.0 ɹ/2.0
/vol/tensusers8/aparikh/hf_cache/so/speechocean762/WAVE/SPEAKER2430/024300068.WAV,SO THEY HAVE TO GO WITH MORE SOPHISTICATE POSITIONING,s/2.0 oʊ/1.8 ð/2.0 eɪ/2.0 h/2.0 æ/2.0 v/2.0 t/2.0 u/2.0 ɡ/2.0 oʊ/2.0 w/2.0 ɪ/2.0 ð/2.0 m/2.0 ɔ/2.0 s/2.0 ə/2.0 f/2.0 ɪ/2.0 s/1.8 t/1.8 ɪ/2.0 k/2.0 eɪ/2.0 t/2.0 p/2.0 ə/2.0 z/0.6 ɪ/2.0 ʃ/2.0 ə/2.0 n/2.0 ɪ/2.0 ŋ/2.0
/vol/tensusers8/aparikh/hf_cache/so/speechocean762/WAVE/SPEAKER2430/024300080.WAV,BUT IS NOT NOW,b/2.0 ə/2.0 t/2.0 ɪ/2.0 z/1.8 n/2.0 ə/2.0 t/2.0 n/2.0 aʊ/2.0
/vol/tensusers8/aparikh/hf_cache/so/speechocean762/WAVE/SPEAKER2430/024300082.WAV,NOW BECAUSE OF DRAGONS LOOK WHERE HE IS TODAY,n/2.0 aʊ/2.0 b/2.0 ɪ/2.0 k/2.0 ʌ/2.0 z/2.0 ə/2.0 v/2.0 d/2.0 ɹ/2.0 æ/1.6 ɡ/2.0 ə/2.0 n/2.0 z/1.8 l/2.0 ʊ/2.0 k/2.0 w/2.0 ɛ/2.0 ɹ/2.0 h/2.0 i/2.0 ɪ/2.0 z/1.8 t/2.0 ə/2.0 d/2.0 eɪ/2.0
/vol/tensusers8/aparikh/hf_cache/so/speechocean762/WAVE/SPEAKER2430/024300093.WAV,THERE IS ALWAYS THE QUESTION OF WHAT WILL FOLLOW,ð/2.0 ɛ/2.0 ɹ/2.0 ɪ/2.0 z/2.0 ɔː/2.0 l/2.0 w/2.0 eɪ/2.0 z/2.0 ð/2.0 ə/2.0 k/2.0 w/2.0 ɛ/2.0 s/2.0 tʃ/2.0 ə/2.0 n/2.0 ə/1.8 v/2.0 w/2.0 ə/2.0 t/2.0 w/2.0 ɪ/2.0 l/2.0 f/2.0 ʌ/1.6 l/2.0 oʊ/2.0
/vol/tensusers8/aparikh/hf_cache/so/speechocean762/WAVE/SPEAKER2430/024300099.WAV,THE ECONOMY IS FAR FROM SOUND,ð/2.0 i/2.0 ɪ/2.0 k/1.6 ʌ/0.8 n/1.6 ə/0.8 m/1.6 i/1.6 ɪ/2.0 z/1.8 f/2.0 ɑ/2.0 ɹ/2.0 f/2.0 ɹ/2.0 ə/1.8 m/2.0 s/2.0 aʊ/2.0 n/1.8 d/2.0
/vol/tensusers8/aparikh/hf_cache/so/speechocean762/WAVE/SPEAKER2430/024300118.WAV,KEEP IN TOUCH HAVE A GREAT WEEKEND,k/2.0 i/2.0 p/2.0 ɪ/2.0 n/2.0 t/2.0 ə/2.0 tʃ/2.0 h/2.0 æ/2.0 v/2.0 ə/2.0 ɡ/2.0 ɹ/2.0 eɪ/2.0 t/2.0 w/2.0 iː/2.0 k/2.0 ɛ/2.0 n/2.0 d/1.8
/vol/tensusers8/aparikh/hf_cache/so/speechocean762/WAVE/SPEAKER2430/024300131.WAV,I MEAN IT WAS THE LAST SUPPER,aɪ/2.0 m/2.0 i/2.0 n/2.0 ɪ/2.0 t/2.0 w/2.0 ə/2.0 z/2.0 ð/2.0 ə/2.0 l/2.0 ɑ/2.0 s/2.0 t/2.0 s/2.0 ʌ/0.4 p/2.0 ɚ/2.0
/vol/tensusers8/aparikh/hf_cache/so/speechocean762/WAVE/SPEAKER2430/024300132.WAV,WELL THANKS FOR THE CONSIDERATION,w/2.0 ɛ/2.0 l/2.0 θ/2.0 æ/2.0 ŋ/2.0 k/2.0 s/2.0 f/2.0 ɔ/2.0 ð/2.0 ə/2.0 k/2.0 ə/2.0 n/2.0 s/2.0 ɪ/1.2 d/2.0 ə/2.0 ɹ/2.0 eɪ/2.0 ʃ/2.0 n/2.0
/vol/tensusers8/aparikh/hf_cache/so/speechocean762/WAVE/SPEAKER2430/024300135.WAV,HE ALWAYS KNOWS HOW TO MAKE ME FEEL BETTER,h/2.0 i/2.0 ɔː/2.0 l/2.0 w/2.0 eɪ/2.0 z/1.8 n/2.0 oʊ/2.0 z/1.8 h/2.0 aʊ/2.0 t/2.0 u/2.0 m/2.0 eɪ/2.0 k/2.0 m/2.0 i/1.8 f/2.0 i/2.0 l/2.0 b/2.0 ɛ/2.0 t/2.0 ɚ/2.0
/vol/tensusers8/aparikh/hf_cache/so/speechocean762/WAVE/SPEAKER2430/024300189.WAV,IT'S WEDNESDAY YOU KNOW THE DRILL,ɪ/2.0 t/2.0 s/2.0 w/2.0 ɛ/1.2 n/2.0 z/1.8 d/2.0 eɪ/2.0 j/2.0 u/2.0 n/1.4 oʊ/2.0 ð/2.0 ə/2.0 d/1.8 ɹ/1.8 ɪ/1.8 l/2.0
/vol/tensusers8/aparikh/hf_cache/so/speechocean762/WAVE/SPEAKER2430/024300221.WAV,ENOUGH OF THE TIME LOOP,ɪ/2.0 n/2.0 ʌ/2.0 f/2.0 ə/2.0 v/2.0 ð/2.0 ə/2.0 t/2.0 aɪ/2.0 m/2.0 l/2.0 u/1.8 p/2.0
/vol/tensusers8/aparikh/hf_cache/so/speechocean762/WAVE/SPEAKER2430/024300270.WAV,IT IS SUCH A GOOD FIRM,ɪ/2.0 t/2.0 ɪ/2.0 z/1.8 s/2.0 ə/2.0 tʃ/2.0 ə/2.0 ɡ/2.0 ʊ/2.0 d/2.0 f/2.0 ɚ/2.0 m/2.0
/vol/tensusers8/aparikh/hf_cache/so/speechocean762/WAVE/SPEAKER2430/024300330.WAV,AT FIRST HE COULD NOT SPEAK,æ/2.0 t/2.0 f/2.0 ɚ/2.0 s/2.0 t/2.0 h/2.0 i/2.0 k/2.0 ʊ/2.0 d/2.0 n/2.0 ə/2.0 t/2.0 s/2.0 p/2.0 i/2.0 k/2.0
/vol/tensusers8/aparikh/hf_cache/so/speechocean762/WAVE/SPEAKER2430/024300345.WAV,AND NOW I GO DOWN TO LOOK AT IT,æ/2.0 n/2.0 d/2.0 n/2.0 aʊ/2.0 aɪ/2.0 ɡ/2.0 oʊ/2.0 d/2.0 aʊ/2.0 n/2.0 t/2.0 u/2.0 l/2.0 ʊ/2.0 k/2.0 æ/2.0 t/2.0 ɪ/2.0 t/2.0
/vol/tensusers8/aparikh/hf_cache/so/speechocean762/WAVE/SPEAKER2430/024300360.WAV,SHE WAS BROAD AT THIS SHOULDERS,ʃ/2.0 i/1.8 w/2.0 ə/1.8 z/2.0 b/2.0 ɹ/2.0 ɔ/2.0 d/2.0 æ/2.0 t/2.0 ð/2.0 ɪ/1.6 s/1.6 ʃ/2.0 ʌ/0.8 u/1.2 l/2.0 d/2.0 ə/2.0 z/1.8
/vol/tensusers8/aparikh/hf_cache/so/speechocean762/WAVE/SPEAKER2450/024500006.WAV,THREE AND FOUR ARE THE BEST,θ/1.8 ɹ/2.0 i/2.0 æ/2.0 n/2.0 d/1.8 f/2.0 ɔ/2.0 ɹ/2.0 ɑ/2.0 ɹ/2.0 ð/2.0 ə/2.0 b/2.0 ɛ/2.0 s/2.0 t/2.0
/vol/tensusers8/aparikh/hf_cache/so/speechocean762/WAVE/SPEAKER2450/024500021.WAV,HE AND HIS PARENTS SAY THEY ARE NO LONGER SPEAKING,h/2.0 i/2.0 æ/2.0 n/2.0 d/2.0 h/2.0 ɪ/2.0 z/1.8 p/2.0 ɛ/2.0 ɚ/2.0 ə/2.0 n/2.0 t/2.0 s/2.0 s/2.0 eɪ/2.0 ð/2.0 eɪ/1.8 ɑ/2.0 ɹ/2.0 n/2.0 oʊ/2.0 l/2.0 ʌ/1.8 ŋ/2.0 ɡ/2.0 ə/2.0 s/2.0 p/2.0 iː/2.0 k/2.0 ɪ/2.0 ŋ/2.0
/vol/tensusers8/aparikh/hf_cache/so/speechocean762/WAVE/SPEAKER2450/024500033.WAV,ENOUGH OF THE TECHNICAL STUFF,ɪ/2.0 n/2.0 ʌ/2.0 f/2.0 ə/2.0 v/2.0 ð/2.0 ə/2.0 t/2.0 ɛ/2.0 k/2.0 n/2.0 ɪ/2.0 k/2.0 l/2.0 s/2.0 t/2.0 ə/2.0 f/2.0
/vol/tensusers8/aparikh/hf_cache/so/speechocean762/WAVE/SPEAKER2450/024500095.WAV,WE ALL KNOW THIS IS A TOUGH RACE TRACK,w/2.0 i/2.0 ɔ/1.8 l/2.0 n/2.0 oʊ/2.0 ð/2.0 ɪ/2.0 s/2.0 ɪ/2.0 z/2.0 ə/2.0 t/2.0 ə/1.6 f/2.0 ɹ/2.0 eɪ/2.0 s/1.8 t/2.0 ɹ/2.0 æ/2.0 k/2.0
/vol/tensusers8/aparikh/hf_cache/so/speechocean762/WAVE/SPEAKER2450/024500126.WAV,YOU MUST HAVE A LOT,j/2.0 u/1.8 m/2.0 ə/2.0 s/2.0 t/1.8 h/2.0 æ/2.0 v/2.0 ə/2.0 l/2.0 ə/2.0 t/1.8
/vol/tensusers8/aparikh/hf_cache/so/speechocean762/WAVE/SPEAKER2450/024500139.WAV,BUT I KNOW WHAT YOU ARE,b/2.0 ə/2.0 t/2.0 aɪ/2.0 n/2.0 oʊ/2.0 w/2.0 ə/2.0 t/2.0 j/2.0 u/2.0 ɑ/2.0 ɹ/2.0
/vol/tensusers8/aparikh/hf_cache/so/speechocean762/WAVE/SPEAKER2450/024500141.WAV,THIS WOULD BE A VERY BUSY DAY,ð/1.8 ɪ/2.0 s/2.0 w/2.0 ʊ/2.0 d/2.0 b/2.0 i/2.0 ə/2.0 v/2.0 ɛ/2.0 ɹ/2.0 i/2.0 b/2.0 ɪ/2.0 z/2.0 i/2.0 d/2.0 eɪ/2.0
/vol/tensusers8/aparikh/hf_cache/so/speechocean762/WAVE/SPEAKER2450/024500147.WAV,I COME FROM A FAMILY OF TEACHERS,aɪ/2.0 k/2.0 ə/2.0 m/2.0 f/2.0 ɹ/2.0 ə/2.0 m/1.8 ə/2.0 f/2.0 æ/2.0 m/2.0 ə/2.0 l/2.0 i/2.0 ə/2.0 v/2.0 t/2.0 iː/2.0 tʃ/2.0 ɚ/1.8 s/2.0
/vol/tensusers8/aparikh/hf_cache/so/speechocean762/WAVE/SPEAKER2450/024500151.WAV,SORRY FOR BEING A PLASTIC,s/2.0 ʌ/2.0 ɹ/2.0 i/2.0 f/2.0 ɔ/2.0 b/2.0 iː/2.0 ɪ/2.0 ŋ/2.0 ə/2.0 p/2.0 l/2.0 æ/2.0 s/2.0 t/2.0 ɪ/2.0 k/2.0
/vol/tensusers8/aparikh/hf_cache/so/speechocean762/WAVE/SPEAKER2450/024500156.WAV,WHAT DO YOU SAY THE MOST,w/2.0 ə/2.0 t/1.8 d/2.0 ʊ/1.8 j/2.0 u/1.8 s/2.0 eɪ/1.2 ð/2.0 ə/2.0 m/2.0 oʊ/2.0 s/2.0 t/2.0
/vol/tensusers8/aparikh/hf_cache/so/speechocean762/WAVE/SPEAKER2450/024500164.WAV,WHAT AND HOW DO YOU SING,w/2.0 ə/2.0 t/2.0 æ/2.0 n/2.0 d/1.8 h/2.0 aʊ/2.0 d/2.0 ʊ/1.8 j/2.0 u/1.8 s/2.0 ɪ/2.0 ŋ/1.8
/vol/tensusers8/aparikh/hf_cache/so/speechocean762/WAVE/SPEAKER2450/024500228.WAV,WHERE ARE YOU GOING TO BE READY TO PLAY,w/2.0 ɛ/2.0 ɹ/2.0 ɑ/2.0 j/2.0 u/1.8 ɡ/2.0 oʊ/2.0 ɪ/2.0 ŋ/2.0 t/2.0 u/1.8 b/2.0 i/2.0 ɹ/2.0 ɛ/2.0 d/2.0 i/2.0 t/2.0 u/1.8 p/2.0 l/2.0 eɪ/2.0
/vol/tensusers8/aparikh/hf_cache/so/speechocean762/WAVE/SPEAKER2450/024500250.WAV,DO YOU LIKE THE COLOR OF THE SKY,d/2.0 ʊ/1.8 j/2.0 u/1.8 l/2.0 aɪ/2.0 k/2.0 ð/2.0 ə/2.0 k/2.0 ʌ/2.0 l/2.0 ɚ/2.0 ə/2.0 v/2.0 ð/2.0 ə/2.0 s/2.0 k/2.0 aɪ/2.0
/vol/tensusers8/aparikh/hf_cache/so/speechocean762/WAVE/SPEAKER2450/024500268.WAV,WHY IN THE WORLD AM I NOT IN THE BED,w/2.0 aɪ/2.0 ɪ/2.0 n/2.0 ð/2.0 ə/2.0 w/2.0 ɚ/2.0 l/1.4 d/2.0 eɪ/0.8 ɛ/2.0 m/2.0 aɪ/2.0 n/2.0 ə/2.0 t/2.0 ɪ/2.0 n/2.0 ð/2.0 ə/2.0 b/2.0 ɛ/2.0 d/2.0
/vol/tensusers8/aparikh/hf_cache/so/speechocean762/WAVE/SPEAKER2450/024500284.WAV,IT'S SUNDAY NIGHT NOT THE END OF THE WORLD,ɪ/2.0 t/2.0 s/2.0 s/2.0 ʌ/1.8 n/1.8 d/2.0 eɪ/2.0 n/2.0 aɪ/2.0 t/2.0 n/2.0 ə/1.6 t/2.0 ð/2.0 ə/1.6 ɛ/1.8 n/2.0 d/2.0 ə/2.0 v/2.0 ð/2.0 ə/2.0 w/2.0 ɚ/2.0 l/1.4 d/2.0
/vol/tensusers8/aparikh/hf_cache/so/speechocean762/WAVE/SPEAKER2450/024500317.WAV,AND IN A SENSE YOU WERE RIGHT,æ/2.0 n/2.0 d/1.8 ɪ/2.0 n/2.0 ə/2.0 s/2.0 ɛ/2.0 n/2.0 s/2.0 j/2.0 u/1.8 w/2.0 ɚ/2.0 ɹ/2.0 aɪ/2.0 t/2.0
/vol/tensusers8/aparikh/hf_cache/so/speechocean762/WAVE/SPEAKER2450/024500327.WAV,AND IT IS MY OWN HAND,æ/2.0 n/2.0 d/2.0 ɪ/2.0 t/1.6 s/2.0 m/2.0 aɪ/2.0 oʊ/0.6 n/1.6 h/2.0 æ/2.0 n/2.0 d/0.8
/vol/tensusers8/aparikh/hf_cache/so/speechocean762/WAVE/SPEAKER2450/024500333.WAV,AS FOR THE FINAL THREE,æ/1.2 z/1.8 f/2.0 ɔ/2.0 ɹ/2.0 ð/2.0 ə/2.0 f/2.0 aɪ/1.8 n/2.0 l/2.0 θ/1.8 ɹ/2.0 i/2.0
/vol/tensusers8/aparikh/hf_cache/so/speechocean762/WAVE/SPEAKER2450/024500350.WAV,HE STARED AT THE STUDENTS,h/2.0 i/2.0 s/2.0 t/2.0 ɛ/0.2 ɚ/0.2 d/2.0 æ/2.0 t/2.0 ð/2.0 ə/2.0 s/2.0 t/2.0 j/2.0 ʊ/2.0 d/2.0 n/2.0 t/1.8 s/1.8
/vol/tensusers8/aparikh/hf_cache/so/speechocean762/WAVE/SPEAKER2450/024500363.WAV,THERE'S NOTHING TO DO BUT GET DRUNK,ð/2.0 ɛ/2.0 ɹ/2.0 z/1.6 n/2.0 ʌ/2.0 θ/1.8 ɪ/2.0 ŋ/2.0 t/2.0 u/1.8 d/2.0 u/2.0 b/2.0 ə/2.0 t/2.0 ɡ/2.0 ɛ/2.0 t/2.0 d/2.0 ɹ/2.0 ə/1.2 ŋ/2.0 k/2.0
/vol/tensusers8/aparikh/hf_cache/so/speechocean762/WAVE/SPEAKER2621/026210005.WAV,THANK YOU AND GOD BLESS YOU ALL,θ/2.0 æ/2.0 ŋ/2.0 k/2.0 j/2.0 u/1.8 æ/2.0 n/2.0 d/2.0 ɡ/2.0 ə/2.0 d/2.0 b/2.0 l/2.0 ɛ/2.0 s/2.0 j/2.0 u/2.0 ɔ/0.6 l/2.0
/vol/tensusers8/aparikh/hf_cache/so/speechocean762/WAVE/SPEAKER2621/026210047.WAV,YOU TRY NOT TO THINK ABOUT THOSE KIND OF THINGS,j/2.0 u/2.0 t/2.0 ɹ/2.0 aɪ/2.0 n/2.0 ə/2.0 t/2.0 t/2.0 u/2.0 θ/2.0 ɪ/2.0 ŋ/2.0 k/2.0 ə/2.0 b/2.0 aʊ/2.0 t/2.0 ð/2.0 oʊ/2.0 z/1.8 k/2.0 aɪ/2.0 n/2.0 d/1.8 ə/2.0 v/1.8 θ/2.0 ɪ/2.0 ŋ/2.0 z/1.6
/vol/tensusers8/aparikh/hf_cache/so/speechocean762/WAVE/SPEAKER2621/026210096.WAV,IT'S A VICTORY LAP FOR ME,ɪ/2.0 t/2.0 s/2.0 ə/2.0 v/2.0 ɪ/2.0 k/2.0 t/2.0 ɚ/2.0 i/2.0 l/2.0 æ/2.0 p/2.0 f/2.0 ɔ/2.0 m/2.0 i/2.0
/vol/tensusers8/aparikh/hf_cache/so/speechocean762/WAVE/SPEAKER2621/026210123.WAV,JUST WONDERING WHAT TO DO WITH THE CAT,dʒ/2.0 ə/2.0 s/2.0 t/2.0 w/2.0 ʌ/2.0 n/2.0 d/2.0 ɚ/2.0 ɪ/2.0 ŋ/2.0 w/2.0 ə/1.6 t/1.8 t/2.0 u/1.8 d/2.0 ʊ/1.8 w/2.0 ɪ/2.0 ð/1.8 ð/1.8 i/1.6 k/2.0 æ/2.0 t/2.0
/vol/tensusers8/aparikh/hf_cache/so/speechocean762/WAVE/SPEAKER2621/026210132.WAV,AND WHAT HAVE YOU LEARNED SO FAR,æ/2.0 n/2.0 d/2.0 w/2.0 ə/2.0 t/2.0 h/2.0 æ/2.0 v/2.0 j/2.0 u/2.0 l/2.0 ɜː/2.0 n/2.0 ɪ/1.2 d/2.0 s/2.0 oʊ/2.0 f/2.0 ɑ/2.0 ɹ/2.0
/vol/tensusers8/aparikh/hf_cache/so/speechocean762/WAVE/SPEAKER2621/026210135.WAV,COULD NOT BE SO PROUD,k/2.0 ʊ/2.0 d/2.0 n/2.0 ə/2.0 t/2.0 b/2.0 i/1.8 s/2.0 oʊ/2.0 p/2.0 ɹ/2.0 aʊ/1.8 d/2.0
/vol/tensusers8/aparikh/hf_cache/so/speechocean762/WAVE/SPEAKER2621/026210136.WAV,LET'S TAKE A LOOK AT THAT,l/2.0 ɛ/2.0 t/1.8 s/1.8 t/2.0 eɪ/2.0 k/2.0 ə/2.0 l/2.0 ʊ/1.4 k/2.0 æ/2.0 t/1.8 ð/1.6 æ/2.0 t/2.0
/vol/tensusers8/aparikh/hf_cache/so/speechocean762/WAVE/SPEAKER2621/026210141.WAV,LOT MORE TO LIFE THAN FOOTBALL,l/2.0 ə/2.0 t/2.0 m/2.0 ɔ/2.0 t/2.0 u/1.8 l/2.0 aɪ/2.0 f/2.0 ð/1.4 æ/1.6 n/1.6 f/2.0 ʊ/2.0 t/2.0 b/2.0 ɔ/2.0 l/2.0
/vol/tensusers8/aparikh/hf_cache/so/speechocean762/WAVE/SPEAKER2621/026210157.WAV,HI ANGEL YOU NEVER KNOW WHAT WILL HAPPEN,h/2.0 aɪ/0.4 eɪ/1.6 n/2.0 dʒ/2.0 l/1.6 j/2.0 u/2.0 n/2.0 ɛ/2.0 v/2.0 ɚ/2.0 n/2.0 oʊ/2.0 w/2.0 ə/1.8 t/2.0 w/2.0 ɪ/2.0 l/1.6 h/2.0 æ/2.0 p/0.4 ə/2.0 n/2.0
/vol/tensusers8/aparikh/hf_cache/so/speechocean762/WAVE/SPEAKER2621/026210177.WAV,WAIT YOU CAN SEE THAT CAN YOU,w/2.0 eɪ/1.6 t/1.6 j/2.0 u/1.8 k/2.0 æ/2.0 n/2.0 s/2.0 i/2.0 ð/2.0 æ/2.0 t/2.0 k/2.0 æ/2.0 n/2.0 j/2.0 u/1.8
/vol/tensusers8/aparikh/hf_cache/so/speechocean762/WAVE/SPEAKER2621/026210185.WAV,HOPELESSNESS IS A GREAT SIGH,h/2.0 oʊ/2.0 p/2.0 l/2.0 ə/1.2 s/2.0 n/2.0 ə/1.2 s/2.0 ɪ/2.0 z/2.0 ə/1.8 ɡ/2.0 ɹ/2.0 eɪ/2.0 t/2.0 s/2.0 aɪ/1.8
/vol/tensusers8/aparikh/hf_cache/so/speechocean762/WAVE/SPEAKER2621/026210203.WAV,IT WAS SO GREAT TO SEE EVERYONE,ɪ/2.0 t/2.0 w/2.0 ə/2.0 z/1.8 s/2.0 oʊ/2.0 ɡ/2.0 ɹ/2.0 eɪ/2.0 t/2.0 t/2.0 u/1.8 s/2.0 i/2.0 ɛ/2.0 v/2.0 ɹ/2.0 i/2.0 w/2.0 ə/2.0 n/2.0
/vol/tensusers8/aparikh/hf_cache/so/speechocean762/WAVE/SPEAKER2621/026210213.WAV,THEY TALK A LOT OF SENSE,ð/1.8 eɪ/2.0 t/2.0 ɔ/2.0 k/2.0 ə/2.0 l/2.0 ə/2.0 t/2.0 ə/2.0 v/1.8 s/2.0 ɛ/2.0 n/2.0 s/2.0
/vol/tensusers8/aparikh/hf_cache/so/speechocean762/WAVE/SPEAKER2621/026210220.WAV,IT'S NOT AS SWEET WHEN YOU HAVE TO SHARE,ɪ/2.0 t/2.0 s/2.0 n/2.0 ə/2.0 t/2.0 æ/2.0 z/1.8 s/2.0 w/2.0 i/2.0 t/2.0 w/2.0 ɛ/2.0 n/2.0 j/2.0 u/2.0 h/2.0 æ/2.0 v/2.0 t/2.0 u/2.0 ʃ/2.0 ɛ/0.8 ɹ/0.8
/vol/tensusers8/aparikh/hf_cache/so/speechocean762/WAVE/SPEAKER2621/026210231.WAV,A LIGHT IN THE SHADOW,ə/2.0 l/2.0 aɪ/2.0 t/2.0 ɪ/2.0 n/2.0 ð/2.0 ə/2.0 ʃ/1.8 æ/2.0 d/2.0 oʊ/2.0
/vol/tensusers8/aparikh/hf_cache/so/speechocean762/WAVE/SPEAKER2621/026210242.WAV,HOPE TO SEE MUCH MORE OF YOU,h/2.0 oʊ/2.0 p/2.0 t/2.0 u/1.8 s/2.0 i/2.0 m/2.0 ə/2.0 tʃ/2.0 m/2.0 ɔ/2.0 ə/2.0 v/1.6 j/2.0 u/2.0
/vol/tensusers8/aparikh/hf_cache/so/speechocean762/WAVE/SPEAKER2621/026210262.WAV,GREAT FIRST GAME OF THE SEASON,ɡ/2.0 ɹ/2.0 eɪ/2.0 t/2.0 f/2.0 ɚ/2.0 s/2.0 t/2.0 ɡ/2.0 eɪ/1.8 m/1.6 ə/1.4 v/1.8 ð/2.0 ə/2.0 s/2.0 iː/2.0 z/2.0 n/2.0
/vol/tensusers8/aparikh/hf_cache/so/speechocean762/WAVE/SPEAKER2621/026210287.WAV,IT USED TO BE CALLED A HAPPY ENDING,ɪ/2.0 t/2.0 j/2.0 u/2.0 z/2.0 d/1.6 t/2.0 u/1.8 b/2.0 i/2.0 k/2.0 ɔ/2.0 l/1.6 d/2.0 ə/1.8 h/2.0 æ/2.0 p/2.0 i/2.0 ɛ/2.0 n/2.0 d/2.0 ɪ/2.0 ŋ/2.0
/vol/tensusers8/aparikh/hf_cache/so/speechocean762/WAVE/SPEAKER2621/026210299.WAV,AND I GET TO HEAR A LOT OF IT,æ/2.0 n/2.0 d/2.0 aɪ/2.0 ɡ/2.0 ɛ/2.0 t/2.0 t/2.0 u/1.8 h/2.0 ɪ/2.0 ə/2.0 ə/2.0 l/2.0 ə/2.0 t/2.0 ə/2.0 v/1.8 ɪ/2.0 t/2.0
/vol/tensusers8/aparikh/hf_cache/so/speechocean762/WAVE/SPEAKER2621/026210302.WAV,IT WAS A GREAT FUN,ɪ/2.0 t/2.0 w/2.0 ə/2.0 z/2.0 ə/2.0 ɡ/2.0 ɹ/2.0 eɪ/2.0 t/2.0 f/2.0 ə/1.0 n/2.0
/vol/tensusers8/aparikh/hf_cache/so/speechocean762/WAVE/SPEAKER2799/027990028.WAV,HE RUNS HE BLOCKS HE CATCHES THE BALL,h/2.0 i/2.0 ɹ/2.0 ə/1.4 n/2.0 z/1.8 h/2.0 i/2.0 b/2.0 l/2.0 ɑ/2.0 k/2.0 s/2.0 h/2.0 i/2.0 k/2.0 æ/2.0 tʃ/2.0 ɪ/2.0 z/1.6 ð/2.0 ə/2.0 b/2.0 ɔ/2.0 l/1.6
/vol/tensusers8/aparikh/hf_cache/so/speechocean762/WAVE/SPEAKER2799/027990046.WAV,WE HAVE THE EARLY SIGNS,w/2.0 i/2.0 h/2.0 æ/2.0 v/2.0 ð/2.0 ə/1.6 ɜː/2.0 l/2.0 i/2.0 s/2.0 aɪ/2.0 n/2.0 z/1.4
/vol/tensusers8/aparikh/hf_cache/so/speechocean762/WAVE/SPEAKER2799/027990056.WAV,ON SUNDAY NONE OF THAT COUNTED FOR ANYTHING,ə/2.0 n/2.0 s/2.0 ʌ/1.2 n/1.6 d/2.0 eɪ/2.0 n/2.0 ə/2.0 n/2.0 ə/2.0 v/2.0 ð/2.0 æ/2.0 t/2.0 k/2.0 aʊ/1.6 n/2.0 t/2.0 ɪ/2.0 d/2.0 f/2.0 ɔ/1.8 ɛ/2.0 n/2.0 i/2.0 θ/2.0 ɪ/2.0 ŋ/2.0
/vol/tensusers8/aparikh/hf_cache/so/speechocean762/WAVE/SPEAKER2799/027990059.WAV,PEOPLE ARE GETTING BACK TO WORK,p/2.0 iː/2.0 p/2.0 l/2.0 ɑ/2.0 ɡ/2.0 ɛ/2.0 t/2.0 ɪ/2.0 ŋ/2.0 b/2.0 æ/2.0 k/2.0 t/2.0 u/1.8 w/2.0 ɚ/1.6 k/2.0
/vol/tensusers8/aparikh/hf_cache/so/speechocean762/WAVE/SPEAKER2799/027990066.WAV,IT SHOW THE WEAKNESS OF THE MOVEMENTS,ɪ/2.0 t/2.0 ʃ/2.0 oʊ/2.0 ð/2.0 ə/2.0 w/2.0 iː/2.0 k/1.6 n/2.0 ə/1.4 s/2.0 ə/2.0 v/2.0 ð/2.0 ə/2.0 m/2.0 uː/2.0 v/2.0 m/2.0 ə/2.0 n/2.0 t/2.0 s/2.0
/vol/tensusers8/aparikh/hf_cache/so/speechocean762/WAVE/SPEAKER2799/027990153.WAV,IN A WORLD CUP GAIN,ɪ/2.0 n/2.0 ə/2.0 w/2.0 ɚ/2.0 l/2.0 d/2.0 k/2.0 ə/2.0 p/2.0 ɡ/2.0 eɪ/2.0 n/1.8
/vol/tensusers8/aparikh/hf_cache/so/speechocean762/WAVE/SPEAKER2799/027990156.WAV,LOOKING FORWARD TO SEEING WHAT YOU HAVE TO OFFER,l/2.0 ʊ/2.0 k/2.0 ɪ/2.0 ŋ/2.0 f/2.0 ɔː/2.0 ɹ/2.0 w/2.0 ɚ/2.0 d/2.0 t/2.0 u/1.8 s/2.0 iː/2.0 ɪ/2.0 ŋ/2.0 w/2.0 ə/2.0 t/2.0 j/2.0 u/2.0 h/2.0 æ/2.0 v/2.0 t/2.0 u/2.0 ʌ/2.0 f/2.0 ə/0.4
/vol/tensusers8/aparikh/hf_cache/so/speechocean762/WAVE/SPEAKER2799/027990160.WAV,I HAVE A NEW THING ON THE FRIDGE,aɪ/2.0 h/2.0 æ/2.0 v/2.0 ə/2.0 n/2.0 j/2.0 u/2.0 θ/2.0 ɪ/2.0 ŋ/2.0 ə/2.0 n/2.0 ð/2.0 ə/2.0 f/2.0 ɹ/2.0 ɪ/2.0 dʒ/2.0
/vol/tensusers8/aparikh/hf_cache/so/speechocean762/WAVE/SPEAKER2799/027990162.WAV,TIME TO THINK ABOUT SOMETHING ELSE FOR A WHILE,t/2.0 aɪ/2.0 m/2.0 t/2.0 u/1.8 θ/2.0 ɪ/2.0 ŋ/2.0 k/2.0 ə/2.0 b/2.0 aʊ/2.0 t/2.0 s/2.0 ʌ/2.0 m/1.6 θ/1.8 ɪ/2.0 ŋ/2.0 ɛ/2.0 l/1.4 s/2.0 f/2.0 ɔ/2.0 ə/2.0 w/2.0 aɪ/2.0 l/1.6
/vol/tensusers8/aparikh/hf_cache/so/speechocean762/WAVE/SPEAKER2799/027990167.WAV,YOU TALKED YOU CAUGHT YOU SCORED,j/2.0 u/1.8 t/2.0 ɔ/2.0 k/2.0 t/2.0 j/2.0 u/1.8 k/2.0 ɔ/2.0 t/2.0 j/2.0 u/1.8 s/2.0 k/2.0 ɔ/2.0 d/1.8
/vol/tensusers8/aparikh/hf_cache/so/speechocean762/WAVE/SPEAKER2799/027990201.WAV,WHAT TO EAT IF YOU HAVE NO MONEY,w/2.0 ə/1.8 t/2.0 t/2.0 u/1.8 i/2.0 t/2.0 ɪ/2.0 f/2.0 j/2.0 u/2.0 h/2.0 æ/2.0 v/2.0 n/2.0 oʊ/2.0 m/2.0 ʌ/2.0 n/2.0 i/2.0
/vol/tensusers8/aparikh/hf_cache/so/speechocean762/WAVE/SPEAKER2799/027990232.WAV,YOU SHOULD KEEP AN EYE OUT FOR THEM,j/2.0 u/2.0 ʃ/2.0 ʊ/2.0 d/2.0 k/2.0 i/2.0 p/2.0 æ/2.0 n/2.0 aɪ/2.0 aʊ/2.0 t/2.0 f/2.0 ɔ/1.8 ð/2.0 ɛ/2.0 m/2.0
/vol/tensusers8/aparikh/hf_cache/so/speechocean762/WAVE/SPEAKER2799/027990242.WAV,LOOKING FOR A GOOD GIFTS,l/2.0 ʊ/2.0 k/2.0 ɪ/2.0 ŋ/2.0 f/2.0 ɔ/1.8 ə/2.0 ɡ/2.0 ʊ/2.0 d/2.0 ɡ/2.0 ɪ/2.0 f/2.0 t/2.0 s/2.0
/vol/tensusers8/aparikh/hf_cache/so/speechocean762/WAVE/SPEAKER2799/027990247.WAV,JOY CAN BE HARD TO FIND SOMETIMES,dʒ/2.0 ɔɪ/2.0 k/2.0 æ/2.0 n/2.0 b/2.0 i/2.0 h/2.0 ɑ/2.0 d/2.0 t/2.0 u/2.0 f/2.0 aɪ/2.0 n/2.0 d/1.4 s/2.0 ʌ/2.0 m/1.4 t/2.0 aɪ/2.0 m/1.6 z/1.8
/vol/tensusers8/aparikh/hf_cache/so/speechocean762/WAVE/SPEAKER2799/027990264.WAV,I WILL NOT HESITATE TO CALL THE POLICE,aɪ/2.0 w/2.0 ɪ/2.0 l/2.0 n/2.0 ə/2.0 t/2.0 h/2.0 ɛ/2.0 z/2.0 ɪ/2.0 t/2.0 eɪ/2.0 t/1.8 t/2.0 u/1.8 k/2.0 ɔ/2.0 l/2.0 ð/2.0 ə/2.0 p/2.0 ə/1.6 l/2.0 iː/2.0 s/2.0
/vol/tensusers8/aparikh/hf_cache/so/speechocean762/WAVE/SPEAKER2799/027990309.WAV,THE HOUSE WAS TOO BIG,ð/2.0 ə/2.0 h/2.0 aʊ/2.0 s/2.0 w/2.0 ə/2.0 z/1.8 t/2.0 u/2.0 b/2.0 ɪ/1.8 ɡ/1.8
/vol/tensusers8/aparikh/hf_cache/so/speechocean762/WAVE/SPEAKER2799/027990328.WAV,THE TOP OF ITS HEAD WAS STILL OPEN,ð/2.0 ə/2.0 t/2.0 ə/1.6 p/2.0 ə/2.0 v/2.0 ɪ/2.0 t/2.0 s/2.0 h/2.0 ɛ/2.0 d/2.0 w/2.0 ə/2.0 z/1.8 s/2.0 t/2.0 ɪ/2.0 l/1.6 oʊ/1.6 p/2.0 ə/2.0 n/2.0
/vol/tensusers8/aparikh/hf_cache/so/speechocean762/WAVE/SPEAKER2799/027990330.WAV,THE DOOR WAS OPENED WITH DIFFICULTY,ð/2.0 ə/2.0 d/2.0 ɔ/2.0 w/2.0 ə/2.0 z/2.0 oʊ/1.6 p/2.0 ə/1.6 n/2.0 w/2.0 ɪ/2.0 ð/2.0 d/2.0 ɪ/2.0 f/2.0 ɪ/2.0 k/2.0 ə/2.0 l/1.8 t/2.0 i/2.0
/vol/tensusers8/aparikh/hf_cache/so/speechocean762/WAVE/SPEAKER2799/027990341.WAV,HE MARKED THEIR PROGRESS ON THE CHART,h/2.0 i/2.0 m/2.0 ɑ/2.0 k/2.0 t/2.0 ð/2.0 ɛ/1.8 ɹ/1.8 p/2.0 ɹ/2.0 oʊ/2.0 ɡ/2.0 ɹ/2.0 ɛ/2.0 s/2.0 ə/2.0 n/2.0 ð/2.0 ə/2.0 tʃ/2.0 ɑ/2.0 t/1.8
